newid,title,author,ptime,dtime,url,content
L0M1C3QWW6-158,"North Korea's Kim Jong Un sends sympathy messages to Iran, Japan -KCNA",Reuters,"January 5, 2024 at 1:49 PM·1 min read",20240105,https://news.yahoo.com/north-koreas-kim-jong-un-214906832.html,"SEOUL (Reuters) - North Korean leader Kim Jong Un sent messages of sympathy to the leaders of Iran and Japan on Saturday, state media said, after the countries were hit with deadly bombings and earthquake respectively this week.
Two bomb blasts in Iran claimed by Islamic State killed nearly 100 people on Wednesday, while the death toll in Japan's devastating earthquake on New Year's Day is nearing 100.
Kim expressed condolences to Japanese Prime Minister Fumio Kishida with the hope that affected areas would be restored to stability soon, according to state media KCNA.
He also expressed sympathy to Iranian President Ebrahim Raisi and reaffirmed North Korea's stand in ""opposing all sorts of terrorism"", KCNA said.
North Korea on Friday fired more than 200 artillery rounds near a disputed maritime border with South Korea, prompting the South to take ""corresponding"" action with live fire drills.
(Reporting by Joyce Lee; Editing by Sandra Maler)"
A3JICMFLYV-159,Russian oligarch's firm files $1 billion claim against Ukraine over bank nationalization,Martin Fornusek,"January 5, 2024 at 10:47 PM·2 min read",20240105,https://news.yahoo.com/russian-oligarchs-firm-files-1-144704291.html,"ABH Holdings S.A. (ABHH) banking group, whose main shareholder is sanctioned Russian oligarch Mikhail Fridman, filed an arbitration request and a claim of over $1 billion against Ukraine over the nationalization of Sense Bank, the company said in its press release on Jan. 4.
Ukraine seized Sense Bank, a Ukrainian branch of Fridman's Alfa-Bank, in the summer of 2023 as its owner had been placed under sanctions. The oligarch is wanted in Ukraine for financially supporting the Russian war machine during the full-scale war.
ABHH, a Luxmebourg-based entity that operates Alfa-Bank, brought its claim to the International Centre for Settlement of Investment Disputes (ICSID) based in Washington, D.C., on Dec. 29.
""The legal basis for the claim is the Treaty between the Belgo-Luxembourg Economic Union and the Government of Ukraine on the Reciprocal Promotion and Protection of Investments,"" the press release read.
The firm called the complaint ""an acid test of the rule of law in the West,"" adding that it seeks ""full compensation for the unlawful expropriation.""
The Ukrainian state bought 100% of Sense Bank's shares for a symbolic 1 Hr ($0.03) on July 22 last year and appointed new management.
""The government decided on the state's participation in the withdrawal of SENS BANK JSC from the market in order to ensure the stability of the financial system of Ukraine and protect the interests of depositors and other creditors of the bank,"" the Finance Ministry said in justification of the decision.
Join our community Support independent journalism in Ukraine. Join us in this fight. Support Us
On May 29, Ukraine's parliament adopted a bill allowing to nationalize banks owned by sanctioned individuals.
According to the Security Service of Ukraine (SBU), Fridman has poured around 2 billion rubles ($22 million) into Russian military plants since the start of the full-scale invasion.
The oligarch is under both international and Ukrainian sanctions, and Kyiv has blocked the assets of several of Fridman's companies.
ABHH called Ukraine's justifications for the nationalization of inventions and ""black PR."" While pointing to damages caused to Sense Bank's owners and beneficiaries, the press release does not mention Fridman by name.
Read also: Investigative Stories from Ukraine: Russian oligarchs continue luxurious life in London despite sanctions
We’ve been working hard to bring you independent, locally-sourced news from Ukraine. Consider supporting the Kyiv Independent."
LZWMKSTSZB-160,South Florida flight to Boston diverted to Orlando after in-flight disturbance,James Tutten,"January 5, 2024 at 9:54 PM·1 min read",20240105,https://news.yahoo.com/south-florida-flight-boston-diverted-131023042.html,"JetBlue said a flight from Fort Lauderdale to Boston had to be diverted to Orlando.
The airline said there was a disturbance Thursday night between two passengers on board, and pilots landed early out of an abundance of caution.
Law enforcement took them off the plane, and after a delay, the flight continued to Boston.
Watch: Judge hits juror who lied, caused mistrial with max sentence
Channel 9′s sister station in Boston obtained video from inside the plane.
Right now, they are talking to passengers about exactly what happened.
Read: Lakeland nurse accused of fatally poisoning her neighbors’ pet cats, pregnant Chihuahua
Channel 9 is working to gather more details and will provide updates on Eyewitness News.
Click here to download our free news, weather and smart TV apps. And click here to stream Channel 9 Eyewitness News live."
6QNITXNFWI-161,South Korea’s military says North Korea fired artillery into maritime buffer zone in ‘provocative act’,"Gawon Bae, Jessie Yeung and Brad Lendon, CNN","January 5, 2024 at 4:40 PM·5 min read",20240105,https://news.yahoo.com/south-korea-military-says-north-063544970.html,"South Korea’s military condemned its northern neighbor on Friday after Pyongyang fired artillery rounds that fell within a maritime buffer zone that has long been a flashpoint between the two.
North Korea fired more than 200 rounds between 9 a.m. and 11 a.m off its west coast, near South Korea’s Baengnyeong and Yeonpyeong islands, according to South Korea’s Joint Chiefs of Staff (JCS).
The artillery fell north of the Northern Limit Line (NLL), a disputed de facto border drawn up by the United Nations at the end of the Korean War in 1953.
The incoming rounds did not harm any civilians or military, the JCS added, calling the incident a “provocative act that threatens peace and heightens tension on the Korean Peninsula.”
In response South Korea’s military held its own maritime shooting exercise on Friday afternoon, with the defense ministry saying it was to “respond to North Korea’s provocation of shooting artilleries inside the no-hostile act zone this morning.” There were “no unusual movements” by the North Korean military during the exercise, it said.
Ahead of the exercise, Yeonpyeong residents were ordered to evacuate to nearby shelters and “refrain from doing outdoor activities,” according to a government website message, and a local resident who told CNN they received the same message via text.
Photos from the island showed people gathering near designated shelters, some sitting inside and others milling around outside.
Yeonpyeong, a tiny island that only measures 3 square miles, is home to more than 2,100 people, according to its local office website. Baengnyeong island, about 18 square miles, has more than 4,900 residents.
It is not unprecedented for North Korea to fire shells into the maritime buffer zone but such acts do raise tensions.
The hermit nation resumed firing artillery within the buffer zone after scrapping an inter-Korean military agreement last November, the JCS said. Multiple rounds were also fired in the same area in late 2022.
The military agreement was signed in 2018 as part of efforts with the United States to contain the threat of war on the Korean Peninsula, and broaden the buffer zone between the two Koreas.
But relations have deteriorated since, with Seoul pulling back from the agreement, and both sides stepping up military exercises and weapons tests.
The South Korean military is now working with the US to track related movements, and will take “actions corresponding to North Korea’s provocation,” the JCS said Friday.
“It is not unusual for North Korea to fire artillery into the West Sea during its winter exercises,” said Leif-Eric Easley, a professor at Ewha University in Seoul. “What’s different this year is the two Koreas have recently backed away from a military confidence-building agreement, and Kim Jong Un has publicly disavowed reconciliation and unification with the South.”
On Sunday, North Korean state-run news agency KCNA reported that the hermit nation’s leader Kim Jong Un had said the state will no longer seek reconciliation and reunification with South Korea.
Kim said inter-Korean relations have become “a relationship between two hostile countries and two belligerents at war,” according to the KCNA report. He reportedly added that if the US and South Korea attempt a military confrontation with the North, its “nuclear war deterrent will not hesitate to take serious action.”
The Northern Limit Line runs 3 nautical miles from the North Korean coastline and put five islands close to the coast under South Korean control.
North Korea has proposed a different line that would roughly extend the demilitarized zone (DMZ) between the two nations southwest into the Yellow Sea, rather than hug North Korea’s shoreline.
Yeonpyeong Island lies off South Korea’s northwest coast, right by the border with its northern neighbor – and has been the location of hostilities between the two sides before.
In November 2010, Pyongyang launched an attack on the island, killing two marines and two civilians. The attack also injured 15 South Korean soldiers and three civilians, South Korea said. It prompted an island-wide evacuation, and South Korean forces returned fire.
The North blamed the South at the time for provoking that attack by holding an artillery drill in the waters near Yeonpyeong.
The island shelling also came half a year after North Korea torpedoed a South Korean Navy corvette, killing 46 of the 104 sailors aboard, during joint US-South Korea naval exercises. North Korea denied the sinking, which a Seoul-led multinational investigation team concluded had come from a torpedo fired by a North Korean midget submarine.
The 2010 clash was one of the worst flare-ups of violence in years; at the time, the secretary general of the United Nations called North Korea’s attack “one of the gravest incidents since the end of the Korean War.”
The war has technically never ended; an armistice brought hostilities to a halt in 1953 – but there’s never been a peace treaty.
Though diplomats in Seoul and Washington have in recent years discussed an agreement to end the war, those efforts have faltered as tensions in the Korean Peninsula rose again – especially with Pyongyang ramping up its weapons development program and missile testing.
For more CNN news and newsletters create an account at CNN.com"
PQBHKCB052-162,Teen reported missing from Albany Park on New Year's Eve,FOX 32 Digital Staff,"January 4, 2024 at 6:00 PM",20240105,https://news.yahoo.com/teen-reported-missing-albany-park-020000799.html,"CHICAGO - Chicago police are asking for the public's help in finding a missing teen who was last seen in Albany Park on New Year's Eve.
Lizieric Lima, 15, was at her home in the 3400 block of West Sunnyside Avenue before she disappeared on Dec. 31, according to police.
She's described as being 5-foot-2 with brown eyes and brown hair.
Anyone with more information on Lima's whereabouts is urged to contact Chicago PD's Area 5 SVU at 312-746-6554."
