newid,title,author,ptime,dtime,url,content
TR7KXRPY7J-82,"Going against FDA, Florida Surgeon General discourages use of mRNA COVID vaccines",Melissa Marino,"January 4, 2024 at 4:50 AM·2 min read",20240103,https://news.yahoo.com/going-against-fda-florida-surgeon-205037668.html,"TAMPA, Fla. (WFLA) — Florida’s Surgeon General is calling for a halt in the use of COVID-19 mRNA vaccines, going against the U.S. Food and Drug Administration’s recommendations.
“We continue to live in a world, where the CDC and the FDA, when it comes to Covid at least, are just beating their own path and direction that is inexplicable in terms of thinking about data and thinking about common sense,” Dr. Joseph Ladapo said at a recent meeting regarding the mRNA Covid vaccine.
On Dec. 6, Ladapo sent a letter to the FDA that called into question the safety of the mRNA vaccine, citing a case study that claims the mRNA could cause cancer if a sequence of events happens. He also said there haven’t been enough clinical trials.
DeSantis, Ladapo warn against newly approved COVID booster
“DNA integration poses a unique and elevated risk to human health and to the integrity of the human genome, including the risk that DNA integrated into sperm or egg gametes could be passed onto offspring of mRNA COVID-19 vaccine recipients. If the risks of DNA integration have not been assessed for mRNA COVID-19 vaccines, these vaccines are not appropriate for use in human beings,” Ladapo wrote in the letter. “The FDA’s response does not provide data or evidence that the DNA integration assessments they recommended themselves have been performed.”
“We would like to make clear that based on a thorough assessment of the entire manufacturing process, FDA is confident in the quality, safety, and effectiveness of the COVID-19 vaccines,” the FDA said in response to the letter. “The agency’s benefitrisk assessment and ongoing safety surveillance demonstrate that the benefits of their use outweigh their risks.”
“With over a billion doses of the mRNA vaccines administered, no safety concerns related to residual DNA have been identified,” the FDA added.
DeSantis: Ladapo ‘blackballed’ over COVID vaccines ‘just the reality’
“Worldwide, several billion people have gotten mRNA vaccines. To say that we don’t have the data, in fact, we do have the data,” said Dr. Thomas Unnasch with the USF Center for Global Health Research.
Unnasch worries Ladapo’s stance could be dangerous.
“There are going to be more people who aren’t going to get vaccinated and as a result, particularly among the at-risk groups, people who don’t get vaccinated, and then there are going to be people who are going to end up hospitalized and die from the infection,” Unnasch said.
Ladapo would need federal approval to prevent the vaccine from being distributed in Florida, which Dr. Unnasch said is unlikely to happen at this time.
An FDA representative released the following statement to WFLA on Wednesday:
The FDA stands firmly behind the safety, effectiveness and manufacturing quality of the approved and authorized COVID-19 vaccines, and respectfully disagrees with the Florida Surgeon General’s opinion. With over a billion doses of the mRNA vaccines administered and following very careful review of all the available scientific evidence, the FDA has not identified safety concerns related to the sequence of, or amount of, residual DNA. In general, while concerns have been raised previously as theoretical issues, the available scientific evidence regarding the mRNA vaccines strongly supports the conclusion that the vaccines are safe and effective and have a highly favorable profile of benefit to risk. Additionally, it is simply a fact that millions of lives have been saved because of the COVID-19 mRNA vaccines, which most Americans undergoing vaccination have received (Two Years COVID Vaccines Prevented Millions Hospitalizations Deaths | Commonwealth Fund).
Perpetuating references to information about residual DNA in COVID-19 vaccines without placing it within the context of the manufacturing process and the known benefits of the vaccine is misleading. Please refer to FDA’s letter to Dr. Ladapo for an explanation along with references. As stated in the letter, the challenge we continue to face is the ongoing proliferation of misinformation and disinformation about these vaccines which results in vaccine hesitancy that lowers vaccine uptake. Given the dramatic reduction in the risk of death, hospitalization and serious illness afforded by the vaccines, lower vaccine uptake is contributing to the continued death and serious illness toll of COVID-19.
For the latest news, weather, sports, and streaming video, head to WFLA."
FR8K2MQ508-83,Hezbollah chief Seyyed Hassan Nasrallah warns Israel against full-scale war on Lebanon,Dalal Saoud,"January 4, 2024 at 4:02 AM·3 min read",20240103,https://news.yahoo.com/hezbollah-chief-seyyed-hassan-nasrallah-200242970.html,"BEIRUT, Lebanon, Jan. 3 (UPI) -- Hezbollah leader Seyyed Hassan Nasrallah warned Israel on Wednesday that launching a full-scale war on Lebanon would be ""very costly,"" and that the assassination of a senior Hamas leader in Beirut would not go unpunished.
""If the enemy thinks of launching a war on Lebanon, then our fighting will be without limits, ceiling, rules or restraints and he knows what I mean,"" Nasrallah said of Israel during a speech broadcast live via video at a rally to commemorate Iranian Gen. Qasem Soleimani on the fourth anniversary of his assassination in a U.S. drone strike in Iraq.
Referring to Hezbollah's ""missiles, capabilities and men,"" Nasrallah emphasized: ""This is all to say that we are not afraid of war and not hesitant...Who thinks of [engaging] in a war with us, he will regret it if God wills.""
Nasrallah, whose fighters have been battling Israeli troops along the Lebanese border since the Gaza war broke out in October, warned that such a wider war will be ""very, very, very costly.""
He explained that his fighters have been battling since Oct. 8 along the border with Israel in a ""controlled"" way, taking into consideration Lebanon's precarious conditions. However, he said that resulted in ""paying a high price"" -- a great number of Hezbollah men killed, about 120.
The Hezbollah chief said his group joined the battle a day after Hamas' attack on Israel sparked the war to support the Palestinian people and resistance in Gaza.
By opening the Lebanese front, Hezbollah prevented Israel from waging a surprise war on Lebanon, he said. Otherwise, the Lebanese ""could have woken up during the night and Israel destroyed everything in this country because the international community is supporting it.""
Nasrallah described the Tuesday assassination of a senior Hamas leader and his companions in an Israeli strike in Beirut's southern suburbs, Hezbollah's stronghold, as ""a big and dangerous crime.""
He said it was the first time his stronghold has been ""targeted in that way since 2006,"" when Israel destroyed large parts of the southern suburbs during a 33 day-war with Hezbollah.
Saleh al-Arouri, 58, who served as Hamas' deputy politburo leader and its military commander of the West Bank, was killed in the drone attack, along with two commanders of Ezzedine al-Qassam Brigades, Hamas' armed wing, and four other members of the Palestinian group.
Al-Arouri was a founding commander of the brigades and has been living in Lebanon since 2018. He was imprisoned twice in Israeli jails for a total of 18 years before being released in 2010. He was known to be the coordinator between Hamas and Hezbollah and Iran.
""This dangerous crime will not stay without response and punishment,"" Nasrallah said.
His retaliation threats would either deter Israel or increase fears of a full-scale war between the two battling forces, which have been engaged in daily fighting mostly restricted to parts of southern Lebanon and northern Israel, resulting in numerous deaths, destruction and displacement on both sides."
VY2UKAV536-84,Hezbollah leader promises response to Hamas official’s killing,Laura Kelly,"January 4, 2024 at 4:11 AM·2 min read",20240103,https://news.yahoo.com/hezbollah-leader-promises-response-hamas-201140033.html,"Hezbollah’s leader Hassan Nasrallah said the alleged Israeli assassination of a top Hamas official in a Beirut suburb Tuesday would not go unanswered.
On Wednesday, Nasrallah addressed the killing of Saleh al-Arouri, the No. 3 member of Hamas’s political and military leadership, during a major speech marking the four-year anniversary of the death of Qassem Soleimani, a top Iranian commander who was killed in a U.S. strike in Baghdad in 2020.
Nasrallah said Hezbollah “will not be quiet about [it] … without any response or paucity of action on the battlefield,” in remarks translated from Arabic by Sky News.
Israel has not taken responsibility for al-Arouri’s killing, but Mark Regev, a senior adviser to Israeli Prime Minister Benjamin Netanyahu, told NBC News the death of a top Hamas official in Beirut did not implicate Lebanon or Hezbollah in Israel’s larger war against Hamas.
“Israel has not taken responsibility for this attack. But whoever did it, it must be clear that this was not an attack on the Lebanese state. It was not an attack even on Hezbollah, the terrorist organization,” Regev said. “Whoever did this did a surgical strike against the Hamas leadership.”
Israel and Hezbollah have traded strikes and counterstrikes nearly every day across the border between Israel and Lebanon since Oct. 7, following Hamas’s shocking terrorist attack on Israel that triggered a wider war by Israel against Hamas in the Gaza Strip.
Still, the fighting between Israel and Hezbollah is considered restrained in comparison with a larger war that could take place, between Israel’s large military and Hezbollah’s deep reserve of fighters and weaponry.
The U.S. has sought to keep a lid on fighting in the Middle East as Israel prosecutes its war against Hamas, even as tensions and attacks occur in multiple theaters throughout the region.
For the latest news, weather, sports, and streaming video, head to The Hill."
40AYQT2V9U-85,Hezbollah leader warns Israel against waging war on Lebanon,AFP,"January 4, 2024 at 4:13 AM·3 min read",20240103,https://news.yahoo.com/hezbollah-leader-warns-israel-against-201345139.html,"The chief of Lebanon's powerful Hezbollah movement, Hassan Nasrallah, warned Israel on Wednesday against waging war on Lebanon, a day after a strike killed Hamas's deputy leader in the southern Beirut stronghold of Hezbollah.
""If the enemy thinks of waging a war on Lebanon, we will fight without restraint, without rules, without limits and without restrictions,"" Nasrallah said in a televised speech.
""We are not afraid of war,"" he said, adding that ""for now, we are fighting on the frontline following meticulous calculations"".
Hamas, and security officials in Lebanon, accused Israel of killing Saleh al-Aruri and six others on Tuesday.
Israeli army spokesman Daniel Hagari did not directly comment on Aruri's killing but said the military was ""highly prepared for any scenario"" in its aftermath.
Hezbollah and its arch-foe Israeli have exchanged near-daily fire over their border since the Israel-Hamas war broke out on October 7, but the Aruri killing led to fears of wider conflict.
He is the most high-profile Hamas figure to be killed during the war, and his death came in the first strike on the Lebanese capital since hostilities began.
The strike that killed Aruri marked ""the first time they target the southern suburbs in this way since 2006,"" Nasrallah said, in reference to that year's Israel-Hezbollah war which saw Beirut's southern suburbs bombed.
Israel had sent ""messages"" to indicate it ""did not intend to target Lebanon or Hezbollah,"" but was rather ""settling scores"" with Hamas leaders, the Hezbollah leader added.
Nasrallah described the attack as a ""major and dangerous crime"" which ""will not go unanswered and unpunished"" -- repeating a threat made by Hezbollah on Tuesday.
The group announced several strikes on Israeli troops and positions Wednesday, within the usual scope of the border area.
Israel's military said it responded with artillery after munitions were fired from Lebanon. Warplanes also hit Hezbollah targets and a tank struck a ""terrorist squad"" in Lebanon, the military said.
""Israel has been weakened"" by Hamas's October 7 onslaught, Nasrallah said.
He spoke in a pre-planned speech commemorating Iran's Islamic Revolutionary Guard Corps General Qasem Soleimani four years after his death in a US strike in Iraq.
Nasrallah is set to deliver another televised speech on Friday.
Earlier Wednesday, a high-level Lebanese security official told AFP that Israel fired guided missiles from a warplane to kill Aruri. Lebanese state media had on Tuesday reported he died in a drone strike.
Hamas said Aruri would be buried on Thursday in Beirut's Shatila Palestinian refugee camp.
Since hostilities began, 171 people have been killed on the Lebanese side, most of them Hezbollah members but also more than 20 civilians including three journalists, according to an AFP tally.
On the Israeli side, at least four civilians and nine soldiers have been killed, according to figures from the military.
lar/aya/it"
34D8F0OG3L-86,Israel on alert for wider conflict after death of senior Hamas official in Lebanon,Tara Suter,"January 3, 2024 at 10:05 PM·1 min read",20240103,https://news.yahoo.com/israel-alert-wider-conflict-death-140557316.html,"A senior Hamas official was reportedly killed in a strike Tuesday in Lebanon’s capital city, putting Israel on high alert should the conflict in the region widen.
According to local news channels, Israel carried out a bombing that killed Saleh al-Arouri, the deputy chief of the political bureau for the Palestinian militant group in Beirut. The Hamas official is the highest-ranked member killed in the ongoing war between Israel and the group in Gaza.
The State Department listed al-Arouri as a terrorist and offered a $5 million reward for information about him, according to The Associated Press.
Despite the win for Israel in taking out the official, Hamas leaders have been quickly supplanted in the past. There’s also the question of how the Israeli bombing in an area where Iran-backed Hezbollah is strong could affect current fighting along the Lebanese-Israeli border.
Hezbollah leader Hassan Nasrallah had promised retaliation in the past for all forms of Israeli targeting of allied militant leaders in his country, the AP reported. However, Nasrallah has seemed reluctant thus far to escalate the fighting.
Israeli officials have not provided comment on the bombing that killed al-Arouri. However, military spokesman Rear Adm. Daniel Hagari said “we are on high readiness for any scenario.”
Hezbollah said the strike was “a serious attack on Lebanon, its people, its security, sovereignty and resistance,” per the AP.
“We affirm that this crime will never pass without response and punishment,” the group said.
The Associated Press contributed.
For the latest news, weather, sports, and streaming video, head to The Hill."
K1SHGIVCI0-87,Israeli spy master vows to track down every Hamas terrorist responsible for Oct 7: 'No matter where they are',Lawrence Richard,"January 3, 2024 at 9:19 AM·3 min read",20240103,https://news.yahoo.com/israeli-spy-master-vows-track-151929505.html,"Israel will track down all Hamas terrorists responsible for the October 7th attack on Israeli border towns,  in which Israel says 1,200 people were killed and more than 240 taken hostage, the country's spy master said on Wednesday. The attack provoked the current Israel-Hamas war.
""Let every Arab mother know that if her son took part, directly or indirectly, in the October 7 massacre, his blood is forfeit,"" Mossad director David Barnea said near Tel Aviv, during a eulogy for his predecessor Zvi Zamir.
He added: ""Today we are again in the middle of a war. The Mossad, today as it was 50 years ago, is committed to settling the score with the murderers who rampaged through the Gaza periphery on October 7 - with the planners, and with those who dispatched them. It will take time, as it took time after the Munich massacre, but we will get them, no matter where they are.""
Israeli officials have said the masterminds of the Oct. 7 attack — Yahya Sinwar, the Hamas leader in Gaza, and Mohammed Deif, the commander of the military wing — remain at large and Israel has affirmed it may need more months to track them down.
IRAN PRAISES HOUTHI PROXY GROUP RAIDING US MILITARY ASSETS, ISRAEL: 'SUPPORT TO THE RESISTANCE FRONT'
The comments come a day after a senior Hamas official was killed in Beirut, Lebanon and as the Israeli military has carried out strikes to take out Hamas operatives in the Gaza Strip and its surrounding countries.
READ ON THE FOX NEWS APP
The leader, Saleh al-Arouri, was killed in a drone strike in the Lebanese capital on Tuesday. A military spokesperson said that Israeli forces were placed in a high state of readiness to respond to any potential retaliation.
The current war in Gaza is entering its 4th month and Israel has continually said it would remain in Gaza until it achieves its military objective to eliminate Hamas’ presence in the territory.
""Anyone who thinks we're going to stop is detached from reality,"" Israeli Prime Minister Benjamin Netanyahu said this week.
ISRAELI MAN WHO BATTLED HAMAS IN GAZA ACCUSED OF IMPERSONATING SOLDIER, STEALING WEAPONS
Netanyahu and other Israeli lawmakers have also emphasized the importance of Hamas releasing every Israeli hostage.
In response, Hamas has said it would release the remaining 129 hostages once the war has ended. The two sides previously agreed to a temporary cease-fire, when they exchanged Israeli hostages for Palestinian prisoners and allowed humanitarian aid to enter Gaza.
As of the new year, the Hamas-run Gaza Health Ministry says more than 22,300 Palestinians have been killed and an additional 57,000 have been injured in the Gaza Strip during the Israel-Hamas war.
Reuters contributed to this report.

Original article source: Israeli spy master vows to track down every Hamas terrorist responsible for Oct 7: 'No matter where they are'"
XNGV3C3JHK-88,"ISW analyses Putin's statements that West is ""Russia's enemy""",Ukrainska Pravda,"January 3, 2024 at 11:52 AM·6 min read",20240103,https://news.yahoo.com/isw-analyses-putins-statements-west-035219997.html,"Experts at the Institute for the Study of War (ISW) have analysed Russian President Vladimir Putin's statements that the West is Russia's enemy and that Russia is waging an existential war against the West in Ukraine.
Source: ISW
Details: Russian President Vladimir Putin has called the West a Russian enemy, and suggested that Russia is fighting in Ukraine to defeat the West.
Putin was responding to a question from a Russian soldier about Western assistance to Ukraine during a meeting at a military hospital in Moscow Oblast on 1 January, saying that Russia's problem is not that the West is helping Ukraine, but that the West is ""Russia's enemy"".
He additionally claimed that Ukraine on its own is not an enemy to Russia, but that Western ""actors"" ""who want to destroy Russian statehood"" and bring about the ""strategic defeat of Russia on the battlefield"" are Russia's enemies.
Putin said that Western elites are trying to split Russia into five parts and are trying to do so by using Ukraine, but the situation on the fronts is changing, and Russia will ""deal with [the West] faster"" than the West can deal with Russia on the battlefields in Ukraine.
Putin added that the problem is not the supply of Western aid to Ukraine, and noted that Ukraine is already completely destroyed, that there is ""nothing left"", and that it ""exists only on handouts"".
Putin hinted that Russia is waging an existential war in Ukraine against the West, and noted that Western rhetoric has recently shifted to how to ""quickly end the conflict.""
ISW noted that this wording means that Putin sees a conflict and potential negotiations between Russia and the West, rather than a conflict and potential negotiations between Russia and Ukraine.
Putin added that Russia also wants to end the conflict between Russia and the West, but only on the Kremlin's terms, and stressed that Russia will not give up its positions.
The Russian president does not view Ukraine as an independent actor and thus portrays his full-scale invasion of Ukraine as a confrontation between Russia and the West. In this way, Putin is deliberately distorting the reality that Russia invaded Ukraine with the aim of destroying Ukraine's sovereignty and territorial integrity.
Putin's emphasis on changing the narrative in the West may indicate that he will perceive and/or present any weakening of Western support for Ukraine and any defeats of Ukraine on the battlefield as a Russian victory in this supposed Russian-Western confrontation.
The fact that Putin is presenting his war in Ukraine as Russia's struggle against the West, not Ukraine, demonstrates that he has no intention of negotiating with Ukraine in good faith and is setting up information conditions aimed at persuading the West to betray Ukraine through negotiations.
Putin is likely deliberately and falsely portraying Ukraine as a powerless pawn in the Russia-West conflict to mask his expansionist and maximalist goals of establishing full effective Russian control over Ukraine.
Quote: ""Putin’s 1 January discussion of negotiations refers to his intent to negotiate solely with the West about Ukraine’s future within the Russian sphere of influence and only about Western abandonment of Ukraine.""
More details: Putin previously followed a similar line when he issued two ultimatums to the United States and NATO in December 2021, which were aimed at forcing the West to recognise Russia's sphere of influence in Eastern Europe by ceding significant elements of Ukraine's sovereignty in the name of de-escalating the conflict between the West and Russia that Putin had fuelled.
Any Western commitment to negotiating Ukraine's future bypassing Ukraine would signal to Russia that it can impose its will on countries it perceives to be in its sphere of influence, potentially including Finland and Moldova, for which Russian actors have begun to set the stage for future campaigns.
Putin may expand his military objectives in Ukraine to include a confrontation with the West to create the conditions for a continued build-up of the Russian military and justify high casualties on the battlefield.
In addition, his statements likely indicate that he is preparing a long-term justification for keeping troops mobilised and engaged in combat to ostensibly defend Russia's sovereignty against the West.
To quote the ISW’s Key Takeaways on 2 January:
Russian President Vladimir Putin identified the West as Russia’s ""enemy"" and implied that Russia is fighting in Ukraine in order to defeat the West.
Putin’s framing of his war in Ukraine as a Russian struggle against the West – and not Ukraine – indicates that he does not intend to negotiate in good faith with Ukraine and is setting information conditions aimed at convincing the West to betray Ukraine through negotiations.
Putin may be expanding his war aims in Ukraine to include confrontation with the West in an effort to set conditions for permanent Russian military buildup and to justify high battlefield sacrifices.
Ukrainian President Volodymyr Zelenskyy stressed Ukraine’s need for urgent Western support to protect both Ukraine and the rest of Europe in an interview with The Economist published on 1 January.
Russian forces conducted another massive series of drone and missile strikes against deep rear areas in Ukraine between 31 December and 2 January, one of which used a strike package similar to that used on 29 December, and to which Ukrainian forces appear to be adapting.
Western provision of air defence systems and missiles to Ukraine remains crucial for Ukraine as Russian forces will likely attempt to adapt to Ukrainian air defence capabilities.
Russian officials publicly defined the goals for Russia’s 2024 chairmanship of both BRICS and the Commonwealth of Independent States (CIS), articulating how the Kremlin may intend to use these organisations to fulfil its foreign policy objectives this year.
The Norwegian government announced on 1 January that it is permitting Norwegian defence companies to sell weapons and defence-related products directly to the Ukrainian government.
The Turkish government announced on 2 January that it will not allow the United Kingdom (UK) to transport two mine hunting ships to Ukraine via the Turkish Straits ""as long as the war continues.""
Russian society continues to reckon with the impacts of increasing anti-migrant sentiment amid Russian authorities’ ongoing efforts to systematically disenfranchise migrant communities within Russia.
Russian forces made marginal confirmed advances along the Svatove-Kreminna line, northwest and southwest of Bakhmut, northwest of Avdiivka, and southwest of Donetsk City.
The Russian military command may be seeking avenues to re-pardon recidivists who previously fought in the war in Ukraine in an apparent effort to maintain Russia's ability to leverage convict recruits as a manpower resource.
Russian occupation authorities are restricting and likely monitoring internet communications ahead of the March 2024 presidential elections.
Support UP or become our patron!"
