newid,title,author,ptime,dtime,url,content
JFZB6SVYTG-222,Blinken meets Qatari leader in Middle East trip aimed at containing Israel-Hamas conflict,Darryl Coote,"January 8, 2024 at 12:31 PM·3 min read",20240108,https://news.yahoo.com/blinken-meets-qatari-leader-middle-043108706.html,"Jan. 7 (UPI) -- Israel's war against Hamas in Gaza ""could easily metastasize,"" causing more insecurity and suffering, U.S. Secretary of State Antony Blinken warned Sunday as he met with Arab leaders in the Middle East as he tries to prevent the conflict from expanding.
The United States' top diplomat made the comment to reporters alongside Qatari Prime Minister Al Thani in Doha during his fourth trip to the region since the Israel-Hamas war began on Oct. 7 and amid a diplomatic push to contain the conflict to the Palestinian enclave of Gaza as it threatens to spill into neighboring countries.
Blinken said ""the heart of discussions"" Saturday with Turkish President Recep Tayyip Erdogan and Jordanian King Abdullah II and Thani on Sunday have been centered on preventing the conflict from spreading.
""We share a commitment to ensure that the conflict does not expand, and I think we also share a commitment to use the influence, the relationships, the ties that we have with different parties in the region to try to avoid escalation and to deter new fronts from opening,"" he said.
""This is not just a regional issue; it's a matter of global concern.""
His trip to Turkey, Greece, Jordan and Qatar, and which will also include stops in the United Arab Emirates, Saudi Arabia, Israel, the occupied West Bank and Egypt through Thursday comes amid a precarious time in region.
On top of the war in Gaza, fighting between Israel and Hamas' Lebanese ally Hezbollah continues to escalate, Houthi rebels continue attacking shipping vessels in the Red Sea, disrupting the important trade route, and militants continue striking U.S. military personnel in Iraq and Syria -- all of which threatens to expand the initial conflict.
Thani told reporters that Qatar has been working with international and regional partners to achieve de-escalation and improve access to humanitarian aid in Gaza, but he remarked that the violence is increasing.
""We believe that we need to contain the crisis as soon as possible and to reach a cease-fire in Gaza, which will also help on de-escalating the region,"" he said.
Blinken's trip also comes as Israel has transitioned to a less intensive phase of its military operation in northern Gaza and amid discussions about the future governance of the Palestinian enclave, with some far-right Israeli politicians stating Palestinians should relocate.
Both Blinken and Thani reiterated their support for Palestinians to be able to return to their homes in Gaza.
""They cannot and they must not be pressed to leave Gaza,"" Blinken said. ""We reject the statements by some Israeli ministers and lawmakers calling for a resettlement of Palestinians outside of Gaza.""
Nearly 23,000 Palestinians have been killed in the war that began Oct. 7 when Hamas launched a bloody surprise attack on Israel, killing some 1,200 Israelis with another 240 taken hostage.
UP to 1.9 million Palestinians in Gaza, more than 85% of the enclave's population, have been displaced, many multiple times over, according to the United Nations relief agency of Palestine refugees.
Blinken said he has discussed efforts with world leaders on his trip to prevent further Palestinian deaths."
Q6FR8GPXXJ-223,Britain's BT to turn street cabinets into EV charging points,Reuters,"January 8, 2024 at 4:50 PM·1 min read",20240108,https://finance.yahoo.com/news/britains-bt-turn-street-cabinets-085029480.html,"LONDON (Reuters) - BT, Britain's biggest telecoms group, said it would convert the first of its street cabinets traditionally used to house cabling to an electric vehicle (EV) charging unit in a pilot that could lead to a network of 60,000 new points.
The first unit will be installed at a cabinet in East Lothian, Scotland, BT said on Monday, adding that it will roll out further trials across Britain in the coming months.
BT said its research showed a shortage of chargers on Britain's roads was deterring some people from buying an EV, with 38% of drivers saying they would have an EV already if charging were less of an issue.
There were 53,906 EV charging points across the UK at the end of December, according to figures quoted by BT from Zapmap. The government wants to increase the number to 300,000 by the 2030s.
Tom Guy, managing director of BT's start-up arm Etc, said: ""Our new charging solution is a huge step in bringing EV charging kerbside and exploring how we can address key barriers customers are currently facing.
""Working closely with local councils in Scotland and more widely across the UK, we are at a critical stage of our journey in tackling a very real customer problem that sits at the heart of our wider purpose to connect for good.""
BT said it would retrofit the cabinets to add a charge point alongside the existing broadband service with no need to create a new power connection.
EV charging can be deployed in cabinets used for current copper broadband services, or in those due for retirement, depending on the space and power available, it added.
(Reporting by Paul Sandle; Editing by Kate Holton)"
1O8QPTYAJ3-224,British space startup Spacebit delivering Ukrainian flag on rocket heading for moon,The New Voice of Ukraine,"January 8, 2024 at 6:44 AM·1 min read",20240108,https://news.yahoo.com/british-space-startup-spacebit-delivering-144400262.html,"UK space startup Spacebit sent a metal version of the Ukrainian flag to the moon as part of the Peregrine Mission One, a private lunar mission, NASA reported on Jan. 8.
Spacebit's lunar rover, named Asagumo, was launched aboard a Vulcan Centaur rocket at 2:18 a.m. (EST).
Read also:  Ukraine’s Zelensky hails successful launch of Ukrainian-US Antares rocket
The Ukrainian flag is on board as a sign of solidarity with the people of Ukraine, at the initiative of Pavlo Tanasyuk, a British-Ukrainian space entrepreneur.
The metal flag of Ukraine also includes a map of the country.
""This metallic plate uses a new type of coating that has never been tested on the lunar surface before,"" the press service said.
“These paints are water-based and can withstand extreme temperature conditions for hundreds of years to come. A copy of the plate was presented to President Volodymyr Zelenskyy at the end of 2021.”
The launch of the Asagumo lunar rover has been postponed for a long time due to the coronavirus pandemic. The main goal of the mission is to deliver the world's smallest robotic lunar rover to the Moon to explore lava tubes on Earth's natural satellite for the first time in history.
Read also:  Russian space agency deputy head among three detained, accused of siphoning nearly $5 million
Spacebit is a private British company founded by Pavlo Tanasyuk in 2014. It works on space data analysis tools and robotic space exploration concepts, including the use of artificial intelligence and advanced micro-robotics.
We’re bringing the voice of Ukraine to the world. Support us with a one-time donation, or become a Patron!
Read the original article on  The New Voice of Ukraine"
IY8CK41IFS-225,Charles Michel’s election bid sparks race to stop Orbán from taking European Council reins,Mared Gwyn Jones,"January 8, 2024 at 10:46 PM·5 min read",20240108,https://news.yahoo.com/charles-michel-election-bid-sparks-144628583.html,"Charles Michel unexpectedly announced on Saturday that he would be the lead candidate for his Belgian liberal party - the Reformist Movement (MR) - in the European elections which take place on 6-9 June.
This means Michel, a former Belgian prime minister who has presided over the European Council since 2019, is highly likely to be elected as a member of the European Parliament (MEP) and stand down as Council chief following the election.
The EU’s 27 heads of government now have less than six months to name his successor. The President's role involves chairing European Council meetings and brokering agreements among member states, including on sensitive budget and foreign policy decisions.
According to EU treaties, in the absence of a president, the country that holds the six-month rotating presidency of the Council takes on caretaker responsibility. This means that without a successor, Hungary’s Prime Minister Viktor Orbán would take control of the Council when his country’s takes on the rotating presidency on 1 July.
A European Council source brushed off the potential disruption of Michel's surprise announcement, saying that the decision on his successor was “due to happen in June 2024.”
“It is therefore possible to have the next president of the European Council starting his duty in summer 2024, if the European Council decides so,” the source said.
June's European elections will trigger a reshuffle of Brussels' top jobs, but the process sometimes takes months due to the intricate nature of discussions and the need to ensure political, geographical and gender balance between appointments.
Many have denounced Michel for a move that will throw a shadow of uncertainty over the Council during a politically pivotal moment.
Speaking to Euronews, Alberto Alemanno, Jean Monnet Professor of European Union Law at HEC Paris said that Michel's decision risks triggering a ""constitutional crisis.""
""As Michel abruptly ends his mandate at the most critical moment when the powers of the council are at their peak (...) he is set to become a lame duck president with little authority,"" Alemanno explained.
""This is really terra incognita,"" he said, adding that Michel was pursuing ""his own self-interest"" rather than wider European Union interests.
Dutch MEP Sophie in 't Veld, a liberal who belongs to the same political family as Michel, sharply criticised his decision on social media platform, X: “The Captain leaving the ship in the middle of a storm. If that is how little committed you are to the fate of the European Union, then how credible are you as a candidate?”
As Michel abruptly ends his mandate at the most critical moment when the powers of the council are at their peak (...) he is set to become a lame duck president with little authority.
The possibility of Orbán seizing influence in Brussels in the second half of the year has spooked many in the EU capital. The nationalist prime minister, recently seen shaking Russian President Vladimir Putin’s hand in Beijing, is infamous for being a thorn in Brussels’ side.
The bloc’s proposed €50-billion package in long-term financial support to Ukraine is currently being held up after Orbán vetoed its approval during a European Council summit in December.
It followed the release of €10 billion in EU funds to Budapest, previously frozen due to backsliding on the rule of law. The move fuelled speculation that Orbán is using his veto power in the Council to pressure Brussels to unfreeze more frozen cash.
Orbán also consistently uses anti-EU rhetoric to foster Eurosceptic sentiment among his domestic audience in Hungary.
His government recently personally targeted European Commission President Ursula von der Leyen in a billboard campaign and implied that Brussels wanted to ""create migrant ghettos in Hungary"" in an inflammatory public consultation.
EU lawmakers have in the past cast doubt over Hungary and Orbán's credibility to take on the Council's presidency in the second half of 2024.
In a non-binding resolution adopted last June, MEPs questioned ""how Hungary will be able to credibly fulfil this task in 2024, in view of its non-compliance with EU law and the values enshrined in Article 2 (of the EU treaties), as well as the principle of sincere cooperation.""
Despite having no executive powers, the EU state that holds the Council's presidency can wield significant influence over the institution's functioning by setting the agenda, hosting meetings, steering negotiations and organising votes.
Should the president's responsibilities fall temporarily into the hands of Orbán, it could increase his capacity to shape the EU's legislative calendar in the last six months of 2024.
But Alemanno told Euronews that he believes leaders are unfazed by the prospect of Orbán stepping in temporarily to do the job.
""I'm not so sure that European leaders are so afraid of Mr. Orbán,"" Alemanno explained.
""Otherwise they would have taken many more measures in order to counter his defiant stance vis-à-vis (...) foreign policy and rule of law and a number of issues,"" he said, adding that Orbán's role would be limited to chairing meetings should he need to step in.
European Council chiefs are usually former heads of state, with a preference for leaders versed in complex negotiations or with experience managing coalition governments.
Names speculated for the role include the Netherlands' current caretaker prime minister Mark Rutte, who was forced to step down in July amid a coalition rift over the issue of immigration, or former Luxembourgish premier Xavier Bettel.
Portugal's caretaker prime minister Antonio Costa was also speculated for the role, but his candidacy could be marred by a sprawling corruption investigation involving his key aides.
The EU treaties also allow the 27 leaders to change the rules should they fail to name a successor. Fourteen member states, representing a simple majority, could vote to block Orbán from temporarily taking on the president's responsibilities and appoint another temporary chief.
Alemanno predicts that a ""temporary, interim"" successor will be found in due time, with a permanent replacement then named after the June ballot."
PLDZW4KRXG-226,China sanctions five US defence firms over Taiwan arms sales,Peter Hoskins - Business reporter,"January 8, 2024 at 7:47 AM·1 min read",20240108,https://news.yahoo.com/china-sanctions-five-us-defence-042647955.html,"China has announced sanctions on five Western defence firms over the latest round of US arms sales to Taiwan.
The announcement comes as Taiwan prepares to hold presidential and parliamentary elections on 13 January.
US weapons sales to Taiwan are a frequent source of tension between Beijing and Washington.
China views democratically governed Taiwan as its territory, a claim Taiwan's government rejects.
Last month, the US State Department approved a $300m (£236m) sale of equipment to help maintain Taiwan's tactical information systems.
The Chinese Foreign Ministry said in a statement on Sunday that the sanctions were ""In response to these gravely wrong actions taken by the US"".
It also said the recent arms sales ""seriously harm China's sovereignty and security interests, undermine the peace and stability across the Taiwan Strait"".
The companies being sanctioned were named as BAE Systems Land and Armament, Alliant Techsystems Operation, AeroVironment, ViaSat and Data Link Solutions.
China will freeze the assets of the companies and ban people and organisations in China from engaging them, the Foreign Ministry said.
The BBC has contacted the US embassy in Beijing for comment.
Beijing has ramped up its pressure on Taiwan ahead of the elections that could redefine the island's relationship with China.
In his annual New Year's Eve address, Chinese President Xi Jinping reiterated his claim that Taiwan would ""surely be reunified"" with China.
He also struck a stronger tone than last year's message, when he spoke about Taiwan being part of the ""same family"".
China sees the self-ruled island of 23 million as a breakaway province that will eventually be under Beijing's control. Taiwan considers itself distinct from the Chinese mainland, with its own constitution and democratically elected leaders."
BPJ9YDKYLB-227,China says foreign consulting agency head spied for Britain,AFP,"January 8, 2024 at 2:15 AM·2 min read",20240108,https://news.yahoo.com/china-says-foreign-consulting-agency-081537468.html,"China's spy agency said Monday the head of a foreign consultancy had been found to be spying for Britain's MI6 intelligence service.
The Ministry of State Security said in a WeChat post that Britain's Secret Intelligence Service -- also known as MI6 -- used a foreign national with the surname Huang to establish an ""intelligence cooperation relationship"".
Huang, who headed a foreign consulting agency, ""entered China several times under instructions to use their public profile as a cover to collect China-related intelligence for Britain... and seek other personnel whom MI6 could turn"", the MSS said.
Huang allegedly passed 17 pieces of intelligence, including confidential state secrets, to MI6 before he was identified, according to the MSS.
The ministry also claimed he had received ""professional intelligence training"" in Britain and had used ""specialist spying equipment"" to send communications.
The MSS said an investigation had ""promptly discovered criminal evidence that Huang was engaged in espionage activities, and took criminal coercive measures in accordance with the law"".
The statement did not provide further details of Huang's identity or employer, or describe their current condition or whereabouts.
Britain's embassy in Beijing directed an AFP request to comment to the Foreign Office in London, which did not immediately respond.
China's foreign ministry declined to provide further comment when asked about the case at a regular press briefing.
- Trading allegations -
China and Britain have traded barbs in recent months over allegations of perceived espionage and its resulting impact on national security.
Britain's government has warned that Chinese spies are increasingly targeting officials, allegations that Beijing has denied.
A researcher at the British parliament was arrested last year under the Official Secrets Act and subsequently denied spying for Beijing.
China, which has a broad definition of state secrets, has publicised several other alleged spying cases in recent months.
In May, authorities sentenced 78-year-old American citizen John Shing-wan Leung to life in prison for espionage, though Beijing has not provided substantial details of his case.
And in October, the MSS published the story of another alleged spy, surnamed Hou, who was accused of sending several secret and classified documents to the US.
China last year also conducted raids on a string of big-name consulting, research and due diligence firms.
Last May, China said it had raided the offices of US consultancy firm Capvision in order to safeguard its ""national security and development interests"".
Beijing also questioned staff at the Shanghai branch of another American consultancy, Bain, in April.
And authorities detained workers and shuttered a Beijing office belonging to US-based due diligence firm Mintz Group in March.
The US government and its chambers of commerce warned that the raids damage investor confidence and the operations of foreign businesses in China.
mjw-oho/je/sn"
ND5AZCHR3D-228,Court ruling clears way for Sharif to become Pakistan’s premier again,DPA,"January 8, 2024 at 9:29 PM·1 min read",20240108,https://news.yahoo.com/court-ruling-clears-way-sharif-132950389.html,"Pakistan’s Supreme Court on Monday ruled that politicians convicted on moral charges cannot be disqualified for life, removing the last of the legal hurdles for former premier Nawaz Sharif to seek a record fourth term.
A seven-judge bench in the capital Islamabad overruled a six-year-old decision by their predecessors that had banned Sharif from holding public office for the rest of his life.
The chief justice announced the brief decision live on national television channels.
The Supreme Court had cut short Sharif's third term in power in 2017 and ordered he must not be allowed to contest an election again.
But a vague article of the constitution under which Sharif was disqualified was later done away with by parliament by fixing the maximum period of disqualification at five years.
Six out of seven judges argued the parliament's decision was supreme and held grounds over the court's ruling.
Sharif was later convicted on three separate graft charges by lower tribunals in 2018 and put in jail, but he was acquitted last year.
Sharif, who has ruled Pakistan three times but could never complete his term due to differences with the powerful army, is the front runner again, his party announced last month.
The 74-year-old is credited for ending power outages and building a web of highways to link the country with China, Afghanistan and Iran and ultimately to Central Asia and Europe.
Sharif was a key partner of China for President Xi Jinping’s flagship Belt and Road Initiative (BRI).
He allowed Beijing access to the markets in the Middle East, Africa and Europe through overland and seas routes through Pakistan."
