UniqueID,Title,Author,PTime,DTime,MentionSourceName,MentionIdentifier,Content
QYVCVR02F7_1ZHJ2J7MT8CELLK,"North Dakota man, only 22 years old, has DOUBLE LUNG transplant caused by his vaping habit: Can never drink or smoke again and will eventually need another new set of lungs fitted",Ishita Srivastava For Dailymail.Com,"Published: 02:28 GMT, 21 January 2024 | Updated: 08:48 GMT, 21 January 2024",20240121,dailymail.co.uk,https://www.dailymail.co.uk/news/article-12987853/North-Dakota-man-double-lung-transplant-vaping.html,"A 22-year-old North Dakota man has been hospitalized for months and had to undergo a double lung transplant due to his troublesome vaping habit.
Jackson Allard was initially admitted to the University of Minnesota Medical Center in October 2023 for stomach pain.
After doctors conducted tests, he was found suffering from Influenza 4 and double pneumonia which had impacted his lungs and oxygen levels.
The young adult had been intubated to give his lungs a chance to heal but his condition kept deteriorating and doctors were forced to place him on an ECMO (extracorporeal membrane oxygenation) machine.
Ultimately, multiple doctors advised Allard to have a double lung transplant to survive.
Jackson Allard, 22, was found suffering from Influenza 4 and double pneumonia due to vaping. He had to have a double lung transplant to survive
The young adult had been intubated to give his lungs a chance to heal but his condition kept deteriorating and doctors were forced to place him on an ECMO machine
Allard's grandmother, Doreen Hurlburt said: 'At one point, a doctor said he had a 1 percent chance of living and we said, ""He's fighting, he's fought for how many weeks we're going to give him a chance to fight, we're not going to stop any procedures or anything.""'
'He's just friendly, he's outgoing, everybody's just attracted to his energy and how much fun he is.
'I thought for sure we were going to lose him. I thought for sure he’s not going to survive this, but in my mind I kept picturing him coming home.
'You have to stop vaping, and we kept telling him that over and over and over again, and he was a heavy vaper. He vaped all the time, but he said, ""It’s better than cigarettes.""'
'Well they said, with cigarettes in 50 years you’ll have lung cancer, in five years, if you vape they will see you with permanent lung damage.'
The vape-addicted adult and his mother, Jamie, will be staying in Minneapolis for at least six months to attend regular check-ups at the university hospital.
Based on the current situation, Allard can never drink alcohol or smoke and will need another transplant in his life.
According to the GoFundMe page launched by Hurlburt, the last words he said before being intubated were: 'I am scared, I don’t want to be alone.'
The fundraising page has raised $20,910 toward its $30,000 goal.
Allard's grandmother, Doreen Hurlburt said: 'At one point a doctor said he had a 1 percent chance of living and we said, ""He's fighting, he's fought for how many weeks we're going to give him a chance to fight, we're not going to stop any procedures or anything""
Based on the current situation, Allard can never drink alcohol or smoke and will need another transplant in his life
According to the GoFundMe page launched by Hurlburt, the last words he said before being intubated were: 'I am scared, I don’t want to be alone'
The vape-addicted adult and his mother, Jamie will be staying in Minneapolis for at least six months to attend regular check-ups at the university hospital
According to Johns Hopkins University research on vape ingredients, thousands of chemical ingredients in vape products have not been identified.
But among those identified, several were harmful substances, including caffeine, three chemicals never previously found in e-cigarettes, a pesticide and two flavorings linked with possible toxic effects and respiratory irritation.
A University of North Carolina study also found that the two primary ingredients found in e-cigarettes, propylene glycol and vegetable glycerin, are toxic to body cells.
'Emerging data suggests links to chronic lung disease and asthma, as well as associations between dual use of e-cigarettes and smoking with cardiovascular disease,' Dr. Michael Blaha, director of clinical research at the Johns Hopkins Ciccarone Center for the Prevention of Heart Disease, said.
Based on the 2021 National Youth Tobacco Survey, over two million American middle and high school students reported using e-cigarettes, with more than eight in 10 using flavored e-cigarettes.
The process of getting a double lung transplant is not without its own risks.
According to the Mayo Clinic, the human immune system protects the body against foreign substances and even if the patients has the best possible match with the donor, the body will try to attack and reject the new lungs.
To decrease the risk of organ rejection, patients are given immunosuppressant medications which they need to consume for the rest of their life.
A risk of infection, kidney damage, osteoporosis and cancer also exist."
R69H1G0PW2_79JBSAVF1AXKVB5,"Musician slams Qantas for damaging his 'handcrafted' $13,000 double bass before Perth Fringe Festival",Lisa Edser For Daily Mail Australia,"Published: 11:58 GMT, 21 January 2024 | Updated: 13:03 GMT, 21 January 2024",20240121,dailymail.co.uk,https://www.dailymail.co.uk/news/article-12988659/Musician-Qantas-double-bass-damaged.html,"A musician has hit out at Qantas for damaging his 'handcrafted' double bass worth $13,000 right before he was due to perform at the Perth Fringe Festival.
Mark Elton travelled from Melbourne to Perth for the gig checking the instrument in as oversized baggage with stickers market 'fragile' on the case.
But when the musician of more than 30 years opened up the bag when he arrived, he noticed large cracks in the wood.
'Hey @qantas! Thanks for a very depressing start to my month of shows at @fringeworldperth 2024,' he posted to Instagram along with images of the damage.
'After flying Melbourne/Perth today I opened my flight case and found my beautiful Double Bass smashed beyond repair after obviously being dropped from a considerable height by your baggage people.
Mark Elton posted to his Instagram account on Monday that the instrument's damage was too extensive and 'smashed beyond repair', writing it needed to be replaced
Mark Elton travelled to Perth for his gig when he noticed 'unusual' damage to his beloved instrument
The musician who was set to perform a month of shows at the Perth Fringe festival, said the double bass looked like it had been 'dropped from a considerable height', blaming the baggage handlers
'What's worse is there was no apology or notification of any accident involving my precious instrument.
'After many years of being a club member and choosing to fly with @qantas I'm hoping you'll support me through this major emotional & financial setback.'
With a month of shows lined up and no way to get a tune out of his double bass, fellow musicians rallied to his support with WA Symphony Orchestra double bassist and luthier Andrew Tait, loaning him an instrument.
Qantas have since responded to the complaint and checked CCTV.
The airline said there was no evidence of damage to the case in transit, but did offer a goodwill payment.
'We know how important it is to handle all luggage with care, including musical instruments,' Qantas said in a statement.
Cracks in the instrument are pictured
The case the instrument was in was also damaged. Social media followers were shocked by the photos of the damage Mr Elton shared, with many calling the incident 'heartbreaking'
'We are concerned to hear that the double bass has been damaged and we have been actively investigating what has happened with our ground handling partners since we were first notified on Tuesday.'
Social media users were shocked by the photos calling the incident 'heartbreaking' for a performer.
'That is out of control!!! How on earth did they create this amount of damage?' one wrote.
'Our instruments are our babies, hope there's a swift and satisfying outcome,' said another."
RFF6AYVP3S_LUHBLVKEKVCQXOS,Trent Jennings: Desperate measures police are taking on the Central Coast to track down mental health patient who stabbed a sexual partner to death during a drug-fuelled meet-up two decades ago,Australian Associated Press,"Published: 08:56 GMT, 21 January 2024 | Updated: 18:13 GMT, 21 January 2024",20240121,dailymail.co.uk,https://www.dailymail.co.uk/news/article-12988503/Trent-Jennings-Central-Coast-manhunt-stabbed-sexual-partner.html,"Police have sent geo-targeted alert texts to residents on the Central Coast, warning them about a man who stabbed a sexual partner to death during a drug-fuelled meet-up more than two decades ago.
Trent Jennings, 38, failed to return to a mental health facility on Wednesday night and was last seen at a motel on The Entrance Road at The Entrance.
He is currently wanted by police on an outstanding arrest order, but members of the public are warned to steer clear and contact police.
'Trent is described as being of Caucasian appearance, about 175cm tall with a medium build, short brown receding hair, and has a scar on his right hand,' NSW Police said in the text message.
'The public is urged NOT TO APPROACH this man and to contact Triple Zero (000) immediately if they see him or know of his whereabouts.'
Sydney city police on Friday raised the alarm about Trent Jennings, who was last seen on the NSW Central Coast on Wednesday night, after he failed to return to a mental health facility
Police sent out a geo-targeted alert text to residents in NSW's Central Coast on Sunday asking for assistance to find Mr Jennings
Jennings was previously ordered to spend an indefinite amount of time in a psychiatric hospital after stabbing 32-year-old Giuseppe Vitale to death in 2003
Jennings was previously ordered to spend an indefinite amount of time in a psychiatric hospital after stabbing 32-year-old Giuseppe Vitale to death in 2003.
The then-18-year-old met Mr Vitale online and the pair arranged to meet for casual sex before Jennings tied the older man up and stabbed him in the neck.
Jennings was in 2005 found not guilty of Mr Vitale's murder on mental health grounds and detained in a hospital.
Six years later, he made headlines again when he absconded from Morisset hospital near Newcastle before going on the run in a stolen car belonging to another man he met online.
Jennings was handed a minimum 18-month jail sentence for the theft, which came after he tied the man up during a consensual bondage session at an inner-Sydney apartment.
Police are searching the Sydney city centre and other areas where he is known to spend time, including the Central Coast, Cumberland and Sutherland Shire areas.
Jennings was last seen wearing prescription glasses, a blue shirt, navy shorts, blue runners, a black and gold watch, and carrying a black backpack and a white tackle box.
He is wanted on an outstanding arrest order and was last seen at a motel on The Entrance Road at The Entrance (pictured), police said"
RZ7J7O4LPU_FAIQXH7P0ZQDEQL,King holds 'spy Oscars' with secret annual ceremony at MI5 to honour those that risked their lives for Britain,Emily Jane Davies,"Published: 17:07 GMT, 21 January 2024 | Updated: 17:38 GMT, 21 January 2024",20240121,dailymail.co.uk,https://www.dailymail.co.uk/news/article-12989095/King-spy-Oscars-secret-annual-ceremony-MI5-honour-risked-lives-Britain.html,"The King holds secret annual awards dubbed the 'spy Oscars' for those who have risked their lives for the country, spymasters claim.
The ceremonies for the spies were first held in 2012, and were mentioned on the Instagram account of MI5 at the time of the King's Coronation.
King Charles, who is patron of the Intelligence Services, presented hundreds of the secret agents with honours, awards and citations for bravery back when he was the Prince of Wales.
The locations of these events have differed over the years, including taking place at Thames House - the HQ of MI5 in London.
Security sources told The Telegraph that there are no fixed dates for the ceremonies.
It is uncertain if Prince William will potentially take over this role.
The ceremonies for the spies were first held in 2012 and were mentioned on the Instagram account of MI5 at the time of the King's Coronation
King Charles, who is patron of the Intelligence Services, presented hundreds of the secret agents with honours, awards and citations for bravery back when he was the Prince of Wales
The majority of spy operations are never known to the public and consequently the agents don't receive any public recognition. Pictured is the MI5 building
The majority of spy operations are never known to the public and consequently the agents don't receive any public recognition.
But sources told The Telegraph that the King personally presented awards to those responsible for foiling dozens of terrorist attacks.
Colonel Philip Ingram, a former Army intelligence officer, told the newspaper: 'It is fantastic that His Majesty takes a personal interest and plays his role in saying thank you to some of these exceptional men and women who have to permanently live and work in the shadows.'
The awards were separated into operational and non-operational divisions, The Telegraph reported.
This is so that archivists, interpreters and other forms of staff could also be rewarded.
Also included are counter-terrorism and counter-espionage workers, along with those tackling organised crime alongside the police.
Many agents honoured by the King were involved in operations in countries like Russia, China and Iran.
Ken McCallum, the director-general of MI5, Sir Richard Moore, the head of MI6, also known as 'C', and Anne Keast-Butler, the director of GCHQ are the only members of the intelligence services to be named publicly.
MI5 Director General, Ken McCallum, gives a speech at Thames House in central London
Pictured is Anne Keast-Butler, the first female director of GCHQ
Sir Richard Moore, from Leatherhead, Chief, Secret Intelligence Service, is made a Knight Commander of the Order of St Michael and St George by King Charles III
In an Instagram post at the time of the Coronation, the official MI5 account said: 'Alongside the rest of the nation, we are delighted to celebrate the coronation of Their Majesties King Charles III and Queen Camilla.
We have benefited from His Majesty's public and private recognition of our work, including through a regular award ceremony in which he recognises the efforts and achievements of teams working in the UK's intelligence agencies.
'His dedication to the intelligence agencies means a great deal to our people.
'From everyone at MI5, we offer our heartfelt congratulations to Their Majesties as we continue in our unwavering commitment to keeping this country safe.'
In 2015, it was reported that Prince William has made a top secret visit to the Government Communications Headquarters (GCHQ) – the maximum security 'listening station' which tracks electronic traffic of terrorists and spy agencies around the world.
The Duke's first ever trip to GCHQ, housed in a doughnut-shaped building in Cheltenham, Gloucestershire, comes after The Mail on Sunday revealed that he and other young Royals were being advised to change their email addresses and cut back on social media activities over fears they could be targeted by foreign spies and hackers.
It is uncertain if Prince William will potentially take over this role
But questions were asked last night about the Duke's use of a publicly funded Royal helicopter to make the trip, as it was not an official public engagement and was not announced in the Palace's Court Circular.
The Duke was flown from London's Kensington Palace to Gloucestershire airport on the Queen's helicopter Flight, funded by the taxpayer, and which is supposed to be only used for official engagements by the Royals.
A Palace source initially described the 200-mile round trip as a 'private visit' but later suggested it was 'official', and so could possibly be paid from the taxpayer-funded Royal Travel Budget.
Kensington Palace and GCHQ refused to say whom he met, or what he saw. But it is believed the Prince met the new head of GCHQ, Robert Hannigan, and also saw the agency's code breakers at work, monitoring internet and communications traffic to pick up terrorist threats.
Other members of the Royal family have previously visited GCHQ, which was opened by the Queen in 2004.
A GCHQ spokesman said: 'Prince William paid a private visit to GCHQ on March 19. As it was a private visit we can't go into further details of what his itinerary involved.'"
S8RLOYBAZX_XQUIL6E2SJ6DL8I,"Almost two thirds of young people are addicted to online pornography, research suggests",Padraic Flanagan,"Published: 02:17 GMT, 21 January 2024 | Updated: 02:30 GMT, 21 January 2024",20240121,dailymail.co.uk,https://www.dailymail.co.uk/news/article-12988023/thirds-young-people-addicted-online-pornography.html,"Almost two thirds of young people are now addicted to online pornography, according to a leading mental health and addiction clinic.
Paracelsus Recovery said research on patients referred for treatment suggested that porn addiction is significantly more prevalent than official numbers suggest.
Children are being exposed to online pornography from as young as nine, according to a recent study for the children's commissioner for England.
A quarter of 16 to 21-year-olds first saw pornography on the internet while still at primary school. By the age of 13, 50 per cent had been exposed to it.
But Paracelsus Recovery, which is based in Zurich and London, warned it had seen a 150 per cent increase in the number of people being treated for porn addiction between 2019 and 2023.
Its chief executive Jan Gerber said: 'It is clear from our research that porn addiction is significantly more common than official numbers suggest.
A quarter of 16 to 21-year-olds first saw pornography on the internet while still at primary school. By the age of 13, 50 per cent had been exposed to it (stock image)
Children are being exposed to online pornography from as young as nine, according to a recent study for the children's commissioner for England (stock image)
One 27-year-old British man treated by Paracelsus Recovery said he became addicted to pornography after he started watching it from the age of 12 (stock image)
'We estimate that one in two males suffer from problematic porn consumption that would meet the diagnostic criteria for addiction, and one in four females.
'Among under-18s, the levels are higher still, at around 60 per cent.'
The United Kingdom has the second highest incidence of internet pornography searches in the world, with an average of 16,600,000 searches for porn taking place each month. The adult film industry is estimated to be worth more than £15billion a year.
The Government's Online Safety Act, passed last year, will force porn websites to use age verification software to stop access by under-18s. Similar technology is already used by gambling websites.
Ofcom is consultation with the porn industry about how the scheme will be rolled out next year.
One 27-year-old British man treated by Paracelsus Recovery said he became addicted to pornography after he started watching it from the age of 12.
He said: 'I had lost all control over my behaviour. I was sitting in my room smoking weed and watching porn videos from morning to night.
'I had no friends, it had messed up my education, and I felt hopeless.
'I cannot even articulate how disgusting and ashamed I felt, and it's only other individuals who have struggled with a porn addiction who can understand the depths of this despair.'"
SACZM4FT0W_PTZAJJHFA6HYTBG,AstraZeneca is facing tens of millions of pounds in compensation claims from 35 alleged victims of the Covid jab in High Court legal battle,Elena Salvoni,"Published: 19:45 GMT, 21 January 2024 | Updated: 10:25 GMT, 22 January 2024",20240121,dailymail.co.uk,https://www.dailymail.co.uk/news/article-12989257/AstraZeneca-millions-pounds-compensation-claims-Covid-jab-High-Court.html,"AstraZeneca is is facing tens of millions of pounds in compensation claims from 35 alleged victims over complications they say were caused by the Covid-19 vaccine.
The pharmaceutical giant, which developed its jab in partnership with the University of Oxford, is set to face a High Court battle over claims the vaccine is 'defective'.
It has been linked to a newly identified condition called Vaccine-Induced Immune Thrombocytopenia and Thrombosis (VITT) which causes blood clots.
At least 81 people have died due to complications linked to the very rare side effect while hundreds of others have also suffered illness as a result.
In what may be one of the biggest cases of its kind, more cases are expected to be lodged, meaning the vaccine manufacturer could face up to £80million in compensation payouts if it loses, according to The Telegraph.
The pharmaceutical giant, which developed its jab in partnership with the University of Oxford , is set to face a High Court battle over claims the vaccine is 'defective'
MP Sir Jeremy Wright has been urged the government to take 'step in and settle' legal claims
The government indemnified AstraZeneca and other vaccine manufacturers as it sought to roll out vaccines during the pandemic.
Under Vaccine Damage Payment scheme, victims of certain vaccines, including ones used to beat Covid, are entitled to a one-off 'all-or-nothing' sum of £120,000 from the Government.
Tory MP Sir Jeremy Wright, whose constituent Jamie Scott suffered a 'significant permanent brain injury' from a blood clot after getting the job in 2021, has urged the government to take action.
The former Attorney General said: 'The public need the confidence to know they will be looked after if in the tiny, tiny minority of cases where the vaccine has gone wrong.
'And that confidence is damaged if the Government does not step in and settle these cases.'
The claimants are suing under the Consumer Protection Act, suggesting that the vaccine was not as safe as those who received it were led to believe.
AstraZeneca is fighting the claims, calling them 'confused' and 'wrong in law'.
The company has also pointed to the millions of lives the vaccine is believed to have saved in its first year of rollout.
The AstraZeneca vaccine is not being used as part of the UK's booster programme after experts recommended mRNA vaccines – such as the Pfizer or Moderna jabs – should be used instead.
Dr Stephen Wright (left), 32, died from a blood clot to the brain after having his first dose of the AstraZeneca jab in January 2021
Vaccine complications have been listed on the death certificates of a number of people who were administered the AstraZeneca jab.
Dr Stephen Wright, 32, died from a blood clot to the brain ten days after having his first dose of the AstraZeneca jab in January 2021.
In April last year, a coroner ruled the vaccine should be added to Dr Wright's death certificate.
In another case, a rock musician known as Lord Zion suffered a severe headache and was admitted to hospital eight days after receiving the jab.
Lord Zion's partner Vikki (pictured together) said she is still 'pro-vaccine' following his death, but called on the Government to better educate medical staff on the side effects
His condition worsened and he passed away in hospital on May 19, with the preliminary death certificate listing a brain bleed caused by vaccine complications as the cause.
His partner Vikki said she is still 'pro-vaccine' following his death, but called on the Government to better educate medical staff on the side effects and rework the Vaccine Damage Payment Scheme.
An AstraZeneca spokesperson said: 'Patient safety is our highest priority and regulatory authorities have clear and stringent standards to ensure the safe use of all medicines, including vaccines. Our sympathy goes out to anyone who has lost loved ones or reported health problems.
'From the body of evidence in clinical trials and real-world data, Vaxzevria has continuously been shown to have an acceptable safety profile and regulators around the world consistently state that the benefits of vaccination outweigh the risks of extremely rare potential side effects.
'The Medicines and Healthcare products Regulatory Authority (MHRA) has granted full marketing approval for Vaxzevria for the UK based on the safety profile and efficacy of the vaccine.'"
