UniqueID,Title,Author,PTime,DTime,MentionSourceName,MentionIdentifier,Content
042B6ZMVQ8_8ZXCK8Z3ZPH9VK0,"Joe's granddaughter Maisy parties with SNL cast moments after show calls race between Biden, 81, and Trump, 77, 'elder abuse'",Sophie Mann For Dailymail.Com,"Published: 17:10 GMT, 21 January 2024 | Updated: 17:15 GMT, 21 January 2024",20240121,dailymail.co.uk,https://www.dailymail.co.uk/news/article-12988951/Maisy-Biden-SNL-weekend-update-president-Trump.html,"President Joe Biden's granddaughter Maisy Biden was spotted at the Saturday Night Live afterparty, cozying up with celebrity hosts and guest stars after the show presented a joke that called her grandfather's reelection campaign against Trump 'elder abuse.'
Maisy, 23, was seen wearing a very relaxed outfit to combat the frigid cold that New York City is currently experiencing.
She paired an orange and black bomber jacket with a bright yellow beanie, and loose-fitting jeans. Other guests appeared to be dressed in similarly eclectic manners.
During the live taping of the show, Weekend Update hosts Colin Jost and Michael Che roasted the likely 2024 presidential nominees from both parties over their ages. Biden is 81 and Trump is 77.
'Guys I don't know if we should do this election,' said Jost. 'It's honestly starting to feel like elder abuse.'
'We should tell Trump and Biden that they both won' and then essentially send them out to pasture, he joked.
President Joe Biden's granddaughter Maisy Biden, 23, attended the SNL afterparty over the weekend, following a series of featured jokes aimed at her powerful relative
Colin Jost and Michael Che with the first Weekend Update of 2024! pic.twitter.com/jF85Bdbc9f
Both Donald Trump, 77, and Joe Biden, 81, have been described as too old for the country's top job. As their campaigns kick into high gear, increased scrutiny will be applied to any moments of confusion or error either experiences
Australian actor Jacob Elordi hosted the January 20 SNL show with musical guest Reneé Rapp, both of whom were in attendance at the afterparty.
Rapp, who is currently starring in the musical reboot of Mean Girls, wore black pants, a black jacket, white t-shirt and a big smile as she headed to the event.
Elordi's girlfriend, social media star and college admissions bribery scandal participant, Olivia Jade, was also in attendance.
The long-limbed beauty was snapped leaving the afterparty bundled up in a long white fur coat, which she wore over black tights and black platform heels.
Model and actress Cara Delevingne was also spotted in a hat and scarf paired with her characteristically downcast expression.
Also pictured entering the party was cast member Chloe Fineman, who was accompanied by comedian Sarah Sherman, and famed director Steven Spielberg, who braved the below-freezing temperatures in what appeared to be just a suede jacket.
A beaming Reneé Rapp, who was SNL's musical guest this week, was seen entering the after party, which was held at Saks Fifth Avenue's ninth floor restaurant, L'Avenue
Jacob Elordi and Olivia Jade have been dating on-and-off since 2021. Though breakup rumors about the stunning pair swirled this week, but all appeared well on Saturday night
Comedian Sarah Sherman (left) and SNL cast member Chloe Fineman (right) attended the afterparty in vastly different styles of winter outfit
Actress and model Cara Delavigne swung by the afterparty looking chilly and downtrodden
Steven Spielberg was also at the late night gathering, sporting only a light suede jacket in the frigid NYC air
During the SNL weekend update, Che, commenting on John Kerry's decision to leave his role as the administration's 'climate envoy' is a poor indicator for things to come on the Biden campaign trail.
'It's not a great sign that President Biden's campaign is a bigger emergency than climate change.' he said.
Jost detailed two moments on the campaign trail from last week.
Biden claimed to have had his picture taken with Congresswoman Deborah Ross at an event in North Carolina. She was, in fact, not at the event.
The gaffe was reminiscent of the tangibly awkward moment in 2022, when the president asked Congresswoman Jackie Walorski, a Republican from Indiana, to stand up. Walorski had tragically passed away in a car accident the month prior.
On the campaign trail in New Hampshire, former President Donald Trump seemed to sub rival Nikki Haley's name into a thought about former House Speaker Nancy Pelosi.
'By the way, they never report the crowd on January 6. You know, Nikki Haley, Nikki Haley, Nikki Haley … did you know they destroyed all of the information, all of the evidence, everything, deleted and destroyed all of it?
'All of it, because of lots of things, like Nikki Haley is in charge of security, we offered her 10,000 people, soldiers, national guards, whatever they want. They turned it down,' he said.
Trump and Biden are currently their respective party's presumptive nominees for the Oval Office.
Biden, despite a rocky first term and ongoing criticism about his old age and mental abilities, is not seriously being challenged by anyone inside the Democratic establishment for the nomination
That led Haley to question Trump fitness to serve as president, while Trump hit back at Haley's concerns.
Trump and Biden are currently their respective party's presumptive nominees for the Oval Office.
Biden, despite a rocky first term and ongoing criticism about his old age and mental abilities, is not seriously being challenged by anyone inside the Democratic establishment for the nomination.
Trump is facing several challengers, though the list has winnowed significantly and voting has only occurred in one state.
It is not remotely clear that either Nikki Haley or Ron DeSantis have a path to the nomination, but the three will continue to duke it out in New Hampshire on Tuesday, followed by Nevada and South Carolina."
04MVU8LUES_TSAMCHW67I73IYD,Glowed-up Robert Jenrick 'not ruling out' running for Tory leader after leading hardline immigration campaign over Rwanda flights as senior party figures jostle to replace Rishi Sunak,"David Wilcock, Deputy Political Editor For Mailonline","Published: 13:05 GMT, 21 January 2024 | Updated: 13:19 GMT, 21 January 2024",20240114,dailymail.co.uk,https://www.dailymail.co.uk/news/article-12988839/Glowed-Robert-Jenrick-not-ruling-running-Tory-leader-Rwanda.html,"Robert Jenrick today refused to rule out running to be Tory leader in place of Rishi Sunak, as senior party figures again jostled for position ahead of an expected election defeat.
The former immigration minister was questioned on GB News about his recent personal makeover which has seen him shed the pounds and adopt a new businesslike haircut.
Westminster gossip suggests he might be lining up a leadership bid in the wake of a Tory election defeat, having taking an increasingly leading role in opposition to Rishi Sunak's Rwanda plans.
Mr Jenrick was one of just 11 Tories who voted against the Safety of Rwanda Bill last week, arguing the plan to deport Channel migrants to east Africa was not strong enough to work.
While MPs backed down from defeating the law, potentially toppling Mr Sunak's administration, Mr Jenrick's actions - which included writing several hardline amendments to the bill - have increased his appeal to the party right.
Asked by GB News whether he was positioning as a future leader if Mr Sunak steps down he said: 'I'm not giving that any though … I'm not ruling it out but that is not my intention, yet.'
It came as another potential leadership candidate broke cover to demand greater military spending.
Penny Mordaunt, who challenged both Mr Sunak and Liz Truss in the summer of 2022, warned that the Royal Navy must 'keep pace' with its rivals in a stark intervention in a row over the size of the fleet.
It came as Defence Secretary Grant Shapps was unable to say when the UK might hit its target of spending 2.5 per cent of GDP on defence, amid warnings about the shrinking size of the British Army.
The former immigration minister was questioned on GB News about his recent personal makeover which has seen him shed the pounds and adopt a new businesslike haircut.
Mr Jenrick in Downing Street in February, before his makeover and move to the party right
Westminster gossip suggests he might be lining up a leadership bid in the wake of a Tory election defeat, having taking an increasingly leading role in opposition to Rishi Sunak's Rwanda plans.
Mr Jenrick told GB News he was just trying to 'make an argument' about illegal migration.
'I think that for too long, too few politicians have gone and argued that we need to take the most robust action.
'So if I can help the conservative party by making that argument very strongly then I will do. Because I think there is a path to victory at the next election, but it goes through taking the strongest possible approach on migration.'
Mr Sunak has said he is 'determined' to get his Rwanda legislation through Parliament, as ministers prepare for stiff resistance in the House of Lords to the flagship asylum policy.

Cabinet Minister Penny Mordaunt warned that the Royal Navy must 'keep pace' with its rivals in a stark intervention in a row over the size of the fleet.
Many peers have already expressed deep unease about the plan, with ministers braced for a battle with the Upper House over the Bill.
The Prime Minister, who has urged the Lords not to block the 'will of the people', said he wanted to get the scheme 'up and running' as soon as possible.
Peers could seriously frustrate that ambition, with Downing Street likely to face attempts by peers to introduce a range of amendments to the proposed legislation.
The Bill is likely to receive its second reading by the end of January, with February 12, 14 and 19 pencilled in for debate at the committee stage.
It is possible that the third reading of the Bill could happen around the middle of March.
Mr Sunak played down the prospect of having to pack the Lords with Tory peers to get the legislation through, adding that the country was fed up with the 'merry-go-round' on the issue."
0CLI8BR1IM_OG6MW7AUNF02HDE,Rainn Wilson shares a heartfelt message on a napkin about The Office given to him by a flight attendant: 'So humbled',Kevin Kayhart For Dailymail.com,"Published: 01:03 GMT, 21 January 2024 | Updated: 01:19 GMT, 21 January 2024",20240121,dailymail.co.uk,https://www.dailymail.co.uk/tvshowbiz/article-12987771/Rainn-Wilson-shares-heartfelt-message-napkin-flight-attendant.html,"It's not every day that we humans can have such a positive impact on the lives of people we've never met.
But that's exactly what happened in recent days to actor Rainn Wilson when he took a flight that went through Portland International Airport.
While traveling Wilson, who played Dwight Schrute on the hit series The Office, unknowingly received a heartfelt message from a fan of the show that came in the form of a letter on a napkin.
He has since posted a photo of that napkin on his social media platforms, along with a message back to the woman, who turned out to be a flight attendant.
'The Office got me through some of the darkest days of my life. I can't thank you enough for that,' the message read from Melanie with Alaska Airlines.
Rainn Wilson, 57, shared a sweet message he received from a fan, who praised him and The Office for helping her 'get through some of the darkest days of my life'
Along with posting the photo of the message on Instagram and X (formerly Twitter), Wilson shared some more of the story behind her kind act, as well as a tribute to his former colleagues on The Office.
'I didn't even see who dropped this on my lap at the PDX airport, but I greatly appreciate the sentiment, flight attendant Melanie of Alaska Airlines,' he wrote in response. 'So humbled to be a part of a show that affected, touched, comforted and inspired. And continues to do so! It's so f***ing rare.'
It's at this point that the acclaimed actor, who earned three consecutive Emmy nominations for Outstanding Supporting Actor In A Comedy Series for his work on The Office, shared some of the praise from that woman with the cast and crew.
'A continuous thank you to the whole Office family, cast, writers, crew and especially AUDIENCE!' the Seattle, Washington native continued, before adding that 'this is not an open invitation to give me notes on napkins!'
The mockumentary series also starred the likes of Steve Carell, John Krasinski, Jenna Fischer, Ed Helms, Mindy Kaling, B. J. Novak, Leslie David Baker, Brian Baumgartner, Angela Kinsey, Oscar Nunez, Phyllis Smith, Kate Flannery, Paul Lieberstein, Ellie Kemper, David Denman, Melora Hardin, Creed Bratton, Craig Robinson, Rashida Jones, Zack Woods, Amy Ryan, Catherine Tate, James Spader, Clark Duke and Jake Lacy.
The show, which depicts the everyday work lives of office employees at the Scranton, Pennsylvania branch of the fictional Dunder Mifflin Paper Company, ran on NBC for nine seasons from 2005 to 2013.
Based on the BBC series of the same name created by Ricky Gervais and Stephen Merchant, it was adapted for American television by Greg Daniels, a veteran writer Saturday Night Live, King of The Hill and The Simpsons.
Like its British counterpart, the show was filmed in a single-camera setup without a studio audience or a laugh track to simulate the look of an actual documentary.
The actor played fan favorite Dwight Schrute on the mockumentary sitcom for its nine season run on NBC from 2005 to 2013
Wilson maintained he didn't even see who dropped the sweet message on his lap at Portland International Airport this week
While The Office was a popular show during its original run, it saw a resurgence during the lockdown of the COVID-19 pandemic, beginning in mid-March 2020; picture are stars B.J. Novak (Ryan Howard), John Krasinski (Jim Halpert), Jenna Fischer (Pam Beesley), Rainn Wilson (Dwight Schrute), Steve Carell (Michael Scott)
The Office, which starred Steve Carell in the leading role of the boss Michael Scott, received 42 Primetime Emmy Award nominations that resulted in five wins; pictured in a scene from the show are Wilson, Carell and Krasinski
Overall, The Office received 42 Primetime Emmy Awards nominations that resulted in five wins, including Outstanding Comedy Series (season two), Outstanding Writing For A Comedy Series (Greg Daniels for Gay Witch Hunt), Outstanding Directing For A Comedy Series (Jeffrey Blitz for Stress Relief), and Outstanding Single-Camera Picture Editing For A Comedy Series (David Rogers and and Claire Scanlon for Finale).
While Carell never received an Emmy Award for his performance in the series, he did win a Golden Globe Award for Best Actor In A Television Comedy Or Musical (2006).
The series saw a resurgence in its popularity while everyone was in lockdown during the COVID-19 pandemic, beginning in mid-March 2020, as reported by a number of publications, including People. Wilson discussed that affect the show has had on fans with Carell on the finale of his Instagram Live series, Hey There, Human.
'One thing that's been really gratifying for me is during this really dark time, I've heard from so many people that they've really appreciated having The Office there — that it has a warmth and humanity to it, kind of a family feel that makes it a special thing and that's helped them during this time, and even helped their mental health,' Wilson shared at the time."
0KUJUOQG0H_OU7J43Z1HXZ9HWX,Faye Winter sends temperatures soaring in a skimpy brown bikini as she enjoys a sunset boat trip in Dubai - as fans beg for her return to Love Island,Bethan Edwards For Mailonline,"Published: 12:57 GMT, 21 January 2024 | Updated: 16:41 GMT, 21 January 2024",20240121,dailymail.co.uk,https://www.dailymail.co.uk/tvshowbiz/article-12988669/Faye-Winter-sends-temperatures-soaring-skimpy-brown-bikini-enjoys-sunset-boat-trip-Dubai-fans-beg-return-Love-Island.html,"Faye Winter sent temperatures soaring as she posed in a patterned bikini on Instagram during a lavish trip to Dubai on Saturday.
The former Love Island star, 28, looked nothing short of sensational in the skimpy two-piece as she enjoyed a sunset boat trip.
Leaving her long tresses loose, she showed off her incredible figure in the triangle top and matching tie side bottoms as she posed up a storm for snaps.
Faye has been keeping her 1.1million followers up-to-date as she enjoyed some winter sun at the five-star Sofitel Dubai The Palm resort costing upwards of £500 per night.
Captioning her latest shots, she wrote: 'Sunset boats'.
Faye Winter sent temperatures soaring as she posed in a patterned bikini on Instagram during a lavish trip to Dubai on Saturday
The former Love Island star, looked nothing short of sensational in the skimpy two-piece as she enjoyed a sunset boat trip
Sharing another photo, Faye stripped off naked as she faced away from the camera while enjoying a glass on wine in a luxury bath.
She wrote: 'Coming to Dubai wasn’t on my travel list as I assumed it would be too fast pace for me.
'We know I love the slow life however @sofiteldubaipalm is the perfect resort, wouldn’t need to leave if I didn’t want to, it’s giving Caribbean ☁️ and nights in are still my favourites just with the added bonus of a sea view, huge bath and pretty lights'.
It comes after Faye sent fans into a frenzy when she showed off her jaw-dropping physique in a slew of racy snaps last week - as they begged her to join Love Island All stars.
The reality star set pulses racing as she posed in a brown skimpy bikini - flaunting her honed curves an Instagram post.
The stunner looked incredible as she was captured enjoying a sushi lunch poolside while soaking the sun in Dubai.
Faye drew attention to her ample assets and toned figure, shielding from the sunshine with a pair of black cat-eye shades.
Fans were sent into frenzy as they raced to comment below her sizzling shots, with many begging her to be the next bombshell to join the new Love Island All Stars.
Leaving her long tresses loose, she showed off her incredible figure in the triangle top and matching tie side bottoms as she posed up a storm for snaps
Faye has been keeping her 1.1million followers up-to-date as she enjoyed some winter sun at the five-star Sofitel Dubai The Palm resort costing upwards of £500 per night
Sharing another photo, Faye stripped off naked as she faced away from the camera while enjoying a glass on wine in a luxury bath
It comes after Faye sent fans into a frenzy when she showed off her jaw-dropping physique in a slew of racy snaps last week
One gushed: 'Its giving @loveisland bombshell the queeeeen.'
'Was hoping you was going to be a bombshell,' hoped another fan.
A third begged: 'Nooo, we need you on all stars!' as a fourth echoed remarking: 'We need on all stars!!'
'Why is she not on Love Island All Stars?' wondered another user.
The reality favourite continued to stun her followers as she also shared a sizzling mirror selfie in her Instagram stories earlier in the day.
The jaw-dropping snap displayed her toned physique in a tiny red bikini set, while showing off her breathtaking view from her balcony."
0LWD6BAM11_UYDD0FZ5I4MXV4F,Sadiq Khan says re-entering Custom Union trade alliance 'should be on the table' when Brexit deal with the EU comes up for review next year,Mail on Sunday Reporter,"Published: 02:31 GMT, 21 January 2024 | Updated: 08:50 GMT, 21 January 2024",20240121,dailymail.co.uk,https://www.dailymail.co.uk/news/article-12988067/Sadiq-Khan-says-entering-Custom-Union-trade-alliance-table-Brexit-deal-EU-comes-review-year.html,"Labour stands accused of trying to reverse Brexit after Sadiq Khan said the UK could rejoin the Customs Union.
The London Mayor said re-entering the trade alliance should be on the table when the Brexit deal with the EU comes up for review next year.
His comments came as shadow Foreign Secretary David Lammy vowed that a future Labour government would treat Brussels as 'our closest friends and allies' rather than opponents.
Mr Khan told a Fabian Society conference in London: 'I'm not saying today we should rejoin the EU. What I'm saying is David Lammy is on to something when he's saying we should have a closer relationship with the EU.'
Asked if that meant the Customs Union, he replied: 'I think everything should be on the table.'
Sadiq Khan told a Fabian Society conference in London: 'I'm not saying today we should rejoin the EU. What I'm saying is David Lammy is on to something when he's saying we should have a closer relationship with the EU'
He criticised the Tory Government's 'extreme hard Brexit' and even appeared to hit out at Labour's 'omerta', or pact of silence, preventing the party from discussing potential economic reintegration with Brussels.
Mr Khan, who is seeking a third term in May's mayoral election, said in a statement: 'The Government's hard Brexit has done damage right across London, and it is young people who have been hardest hit in so many ways.
'Not only is it more difficult for young people to move abroad for work but the Government's wrongheaded decision to leave the Erasmus scheme has made it much harder for students to study abroad too.
'I'm clear that I'd be supportive of a youth mobility scheme, which would benefit us economically, culturally and socially.
'While the UK may no longer be part of the EU, London is and always will be a European city.'
The mayor wants young people to be able to study, travel and fill vacancies in key sectors of the economy such as hospitality, which has historically relied on EU workers and has faced staff shortages."
