UniqueID,Title,Author,PTime,DTime,MentionSourceName,MentionIdentifier,Content
6YAL6ZXW94_Z4VTVW1Q7CPWJA9,"Protesters should be banned from wearing face masks, PM's adviser on political violence says in the wake of Palestinian protests that saw people shouting pro-Hamas slogans","David Wilcock, Deputy Political Editor For Mailonline","Published: 15:31 GMT, 21 January 2024 | Updated: 15:47 GMT, 21 January 2024",20240121,dailymail.co.uk,https://www.dailymail.co.uk/news/article-12989025/Protesters-banned-wearing-face-masks-Palestinian-Gaza-Hamas.html,"Protesters should be banned from covering their faces in the wake of anti-Semitism and pro-Hamas activity at Gaza demonstrations, a top government adviser has said.
Lord Walney, the former Labour MP who is now the political violence tsar, recommended a law change in a review that comes after a serious of mass protests against Israeli military action.
A feature of many of the marches has been marked demonstrators shouting pro-Hamas slogans, despite the group being banned as terrorists in the UK.
His review is set to recommend that marches only be allowed to go ahead after clear undertakings than no one would wear masks, balaclavas or scarves across their faces, according to the Sun on Sunday.
Lord Walney said: 'What would peaceful demonstrators have to fear from a ban on masks to tackle intimidation and violence?⁦'
Lord Walney, the former Labour MP who is now the political violence tsar, recommended a law change in a review that comes after a serious of mass protests against Israeli military action.
His review is set to recommend that marches only be allowed to go ahead after clear undertakings than no one would wear masks, balaclavas or scarves across their faces.
A feature of many of the marches has been marked demonstrators shouting pro-Hamas slogans, despite the group being banned as terrorists in the UK.
It came as Britain today warned Israeli prime minister Benjamin Netanyahu that there is 'no other option' than a two-state solution to fighting in the Middle East.
Defence Secretary Grant Shapps today lambasted Netanyahu's 'disappointing' rejection of a Palestinian state as part of any post-war plan for Gaza.
Thousands of people demonstrated in central Tel Aviv on Saturday, calling for the return of hostages held in Gaza and early elections to oust Mr Netanyahu, who rules at the head of a coalition containing far-right nationalists.
He has has vowed to press ahead with the offensive in Gaza for many months despite mounting pressure on Israel to rein in its military action as the scale of death and destruction intensifies.
Speaking to the BBC's Sunday with Laura Kuenssberg, Mr Shapps said: 'Palestinians deserve a sovereign state, Israel deserves to have the full ability to defend itself, its own security. Unless you pursue a two-state solution, I really don't see that there is another solution."
7KY5OL06TI_ZCDPUI27NVKJU0W,"Dem. Senator John Fetterman breaking with his party AGAIN says migration crisis threatens to destroy the American dream as another 300,000 people approach southern border in hopes of crossing into US",Dolores Chang For Dailymail.Com,"Published: 23:51 GMT, 20 January 2024 | Updated: 09:26 GMT, 21 January 2024",20240121,dailymail.co.uk,https://www.dailymail.co.uk/news/article-12987479/John-Fetterman-migrant-crisis-American-dream-border.html,"Democrat Sen. John Fetterman broke with his party, stating that the border crisis is threatening to destroy the American dream as another 300,000 people approached the southern border in hopes of crossing into the U.S.
Fetterman voiced his concerns about the ongoing migration crisis and demanded a 'secure border' as he spoke to CNN's The Lead anchor Jake Tapper on Friday.
The Democratic senator, 54, from Pennsylvania said, 'I honestly don't understand why it's controversial to say we need a secure border.'
'And [what] I think about immigration is, we want to provide the American Dream for any migrant. However, it seems very difficult when you have 300,000 people showing up, encountered at our border, to achieve that,' he added.
His remarks come as the U.S. Customs and Border Patrol documented more than 302,000 attempts to cross the U.S. southern border in December, the highest total for a single month ever recorded in history.
Democrat Sen. John Fetterman (right) broke with his party, stating that the border crisis is threatening to destroy the American dream as he spoke to CNN 's The Lead anchor Jake Tapper (left) on Friday
His remarks come as the U.S. Customs and Border Patrol documented more than 302,000 attempts to cross the U.S. southern border in December, the highest total for a single month ever recorded in history
The Democratic Pennsylvania senator, 54, said: 'I honestly don't understand why it's controversial to say we need a secure border'
Fetterman, whose wife arrived in the U.S. as an undocumented immigrant at the age of 7, insisted he's a proponent of legal migration on Friday's show.
'I've been very clear, in fact, that was weaponized against me [by] Republicans in my race, that I'm very much a strong supporter of immigration, and you know, my wife's family, that's the origin story about that,' he added.
But he questioned why progressive critics from the left have issues with his pro-border security stance.
'I honestly don't understand,' he responded to Tapper's question, 'Why do you think you've been criticized by so many progressives?'
'And I think two things can be true at the same time. You can be very supportive of immigration, but we also need to have a secure border,' he said.
In recent weeks, Fetterman has broken from the far-left of his party by showing strong support for Israel since the October 7 Hamas terror attack.
He also stated that the U.S. should toughen up its southern border policy, a stance some on the left think is inhumane.
The Democratic senator questioned why progressive critics from the left have issues with his pro-border security stance
Fetterman, whose wife Gisele Barreto Fetterman arrived in the U.S. as an undocumented immigrant at age 7, insisted he's a proponent of legal migration on Friday's show
'I'm not a progressive,' Fetterman told NBC News last month. 'I just think I'm a Democrat that is very committed to choice and other things.
'But with Israel, I'm going to be on the right side of that. And immigration is something near and dear to me, and I think we do have to effectively address it as well.'
Fetterman said it was 'not ideal to have this conversation' about immigration linked to funding Israel and Ukraine, he added that 'it's still one that we should have.'
'Progressives better do that because we can't leave Israel - we can't sell them out, and we can't sell Ukraine out, and we have to deliver on that,' Fetterman told the network. 'I just would very much like to get a deal to deliver this critical aid.'
As for immigration, Fetterman argued he can be both pro-immigration, while also favor policies to restrict the flow of immigrants across the southern border to a manageable level.
'It's a reasonable conversation - until somebody can say there's an explanation on what we can do when 270,000 people are being encountered on the border, not including the ones, of course, that we don't know about,' he said.
'To put that in reference, that is essentially the size of Pittsburgh, the second-largest city in Pennsylvania,' the Democrat added.
In a December interview with Politico, the lawmaker said:  'I hope Democrats can understand that it isn't xenophobic to be concerned about the border. It's a reasonable conversation, and Democrats should engage.'
Last fiscal year, the Biden administration saw the single highest number of encounters at the border on record
At least 2.4 million migrants streamed across the US' southern border in fiscal 2023, and that figure just represents the encounters border patrol agents had - there are plenty of illegal crossers who did not come into contact with DHS officers
People camp as they wait to cross the border between Mexico and the United States in Ciudad Juarez, Mexico
Last fiscal year, the Biden administration saw the single highest number of encounters at the border on record.
At least 2.4 million migrants streamed across the southern border in fiscal 2023, and that figure just represents the encounters border patrol agents had - there are plenty of illegal crossers who did not come into contact with DHS officers.
The figure breaks down to an average of about 6,575 encounters per day, which means it would take just over two full weeks for 95,000 illegal crossers to enter the US.
Between Dec. 1 and December 31 2023, more than 302,000 migrants were documented attempting to cross the US southern border, which marks the first time migrant encounters have reached over 300,000.
Last week, as New York City braced for a snowstorm and cold front, city executives made the decision to keep students home from school for a day and instead use the Brooklyn facility to house migrants during the storm.
Mayor Eric Adams has repeatedly begged governors in border states to stop bussing migrants to NYC, where locals in midtown have been horrified for close to a year at the number of migrants being semi-housed in formerly expensive cosmopolitan hotels.
'We're getting close to anywhere from 2,500 to peaking at 4,000 a week,' Adams said recently in an interview, during which he also proclaimed in no uncertain terms that NYC in 'out of room' for the incoming migrants.
'We were not just saying we're out of room as a soundbite,' Adams answered, citing the more than 161,000 migrants who have arrived and sought city aid since spring 2022.
'We're out of room, literally', the Democrat declared. 'People are going to be eventually sleeping on the streets.'"
80EV3NJWDS_Y93FPM8SJ1IUXK6,Glum Alec Baldwin is spotted for the first time since being indicted for fatal shooting on Rust movie set as he heads out with the kids in the Hamptons,Rachel Bowman For Dailymail.Com,"Published: 22:02 GMT, 21 January 2024 | Updated: 07:48 GMT, 22 January 2024",20240121,dailymail.co.uk,https://www.dailymail.co.uk/news/article-12989563/Alec-Baldwin-spotted-Hamptons-indicte-shooting-Rust.html,"Alec Baldwin was seen for the first time in public since he was indicted on involuntary manslaughter charges by a New Mexico grand jury for the 2021 shooting death of cinematographer Halyna Hutchins.
On Sunday, Baldwin was pictured zipping up his jacket while walking outside with his children in the Hamptons, just days after his indictment.
The 65-year-old appeared sullen wearing a navy puffer, black shirt, dark pants and sneakers as he braved the cold.
On Saturday, he posted on Instagram a video of the beach in Montauk, but nothing about the indictment. PEOPLE magazine reported the new involuntary manslaughter charges  have been 'frustrating' and 'very stressful' for the actor and his wife Hilaria.
A source said, 'They had a great Christmas and New Year. Hilaria also just turned 40. This is not how they wanted to start the new year.'
Alec Baldwin was seen for the first time in public since he was charged with involuntary manslaughter by a New Mexico grand jury
Baldwin is pictured zipping up his jacket while walking outside in the Hamptons on Sunday
The 65-year-old appeared sullen wearing a navy puffer, black shirt, dark pants and sneakers
The indictment was returned on Friday and charges Baldwin with involuntary manslaughter for the 2021 set shooting that killed cinematographer Halyna Hutchins (pictured)
'It's stressful for Hilaria. It's frustrating for them both that Alec is being recharged. They knew there was a possibility there would be a new indictment. The back and forth is hard. It's very stressful.'
Hilaria was spotted in New York City on Friday, keeping a low profile in sunglasses and a long black winter coat, the day the charges were announced.
The indictment was returned on Friday and charges Baldwin with involuntary manslaughter on the grounds of negligent use of a firearm and disregard for others' safety.
If convicted, Baldwin faces up to 18 months in prison.
In a statement, Baldwin's attorneys Alex Spiro and Luke Nikas said: 'We look forward to our day in court.'
Gloria Allred, the attorney for Halyna's parents and sister, said in a statement: 'Our clients have always sought the truth about what happened on the day that Halyna Hutchins was tragically shot and killed on October 21, 2021.
'They continue to seek the truth in our civil lawsuit for them and they also would like there to be accountability in the criminal justice system.
'The grand jury has decided that there is sufficient evidence to indict Alec Baldwin on the charge of involuntary manslaughter.
'We are looking forward to the criminal trial which will determine if he should be convicted for the untimely death of Halyna.'
On October 21, 2021, Baldwin was filming a scene inside a church when he pulled the trigger on his Colt .45 revolver and fatally shot cinematographer Halyna Hutchins.
He's insisted that the gun fired spontaneously, as he struck director Joel Souza in the shoulder before he shot Hutchins.
Hutchins was taken to the hospital where she was later pronounced dead.
Baldwin was interviewed by the Santa Fe County Sheriff's Office following her death, as he showed tremendous emotions for his actions.
If convicted, Baldwin faces up to 18 months in prison. In a statement, Baldwin's attorneys Alex Spiro and Luke Nikas said: 'We look forward to our day in court'
Alec Baldwin and Halyna Hutchins, along with other cast, are pictured on the Rust set
On October 21, 2021, Baldwin was filming a scene inside a church when he pulled the trigger on his Colt .45 revolver and fatally shot Hutchins
He was initially charged in January 2023 by First Judicial District Attorney of New Mexico Mary Carmack-Altwies, who launched her own media tour soon after filing charges.
Baldwin's team interpreted her enthusiasm for the case as a fame-hungry effort to boost her own career.
After hashing it out with his team in the court of public opinion, Carmack-Altwies stepped down from the case and a special prosecutor was appointed to take over.
In April last year, that team opted to drop the charges and Baldwin, who had already settled a wrongful death lawsuit launched by Hutchins' family, breathed a momentary sigh of relief.
Baldwin has always maintained that he followed gun safety laws, and that the fault lies with the armorer or crew who handed him a gun loaded with a live round."
82TY2Z8MIH_DFFA525AFIPRA0X,North Carolina middle school removes bathroom MIRRORS after students kept cutting classes to go and film TikTok videos,Dolores Chang For Dailymail.Com,"Published: 02:59 GMT, 21 January 2024 | Updated: 09:02 GMT, 21 January 2024",20240121,dailymail.co.uk,https://www.dailymail.co.uk/news/article-12988039/North-Carolina-middle-school-bathroom-MIRRORS-TikTok.html,"A North Carolina middle school removed bathroom mirrors after students were skipping classes to make TikTok videos in the bathroom.
The Alamance-Burlington School System announced this week that Southern Alamance Middle School had mirrors removed from its hallway bathrooms to reduce distractions.
The move came as the school officials observed many students using bathrooms seven or eight times a day, and in many cases, during class.
'Students were going to the bathroom for long periods of time and making TikTok videos,' Les Atkins, the public relations officer for ABSS, told WFMY News.
The removal of mirrors has proven to be effective so far, as school officials noticed fewer visits to the bathroom and students spending less time there.
A North Carolina middle school removed bathroom mirrors after students were skipping classes to make TikTok videos in the bathroom (Pictured above: A similar video was posted by a middle school aged social media user)
The Alamance-Burlington School System announced this week that Southern Alamance Middle School had mirrors removed from its hallway bathrooms to reduce distractions
The move came as the school district observed many students using bathrooms seven or eight times a day, and in many cases, during class
The removal of mirrors proved to be effective, as school officials noticed fewer visits to the bathroom and students spending less time there. (Pictured: Stock image of a bathroom)
so many mirror selfie’s
'Since removing the mirrors, we have seen a drastic decrease in bathroom visits from students asking to be excused just to make videos,' Atkins said.
'[The school saw] not as many visits to the bathroom, and [students] not staying as long.' he said.
'And students are held accountable. When there's accountability, you see a great difference,' he added.
The school district also implemented Smart Pass, a digital hall pass system, to allow students to check in and out when they leave classrooms.
The system is part of the school's existing software; therefore, it won't add extra costs to the district.
'We strive to limit distractions so students can focus on learning. Though this is an adjustment, we believe these changes will foster a better learning environment by minimizing disruptions,' the school district said.
Phoenixville middle school bathroom: 1/10 👎
'Students were going to the bathroom for long periods of time and making TikTok videos,' Les Atkins, the public relations officer for ABSS, told WFMY News
The removal of mirrors proved to be effective, as school officials noticed fewer visits to the bathroom and students spending less time there
Parents and social media users support the school's approach, noting that there are too many distractions for middle school students.
A mother of a 12-year-old boy wrote: 'Am I the only mean parent of a middle schooler who won’t let them have a smart phone?'
She added that her son is using a Nokia, which 'has prevented a lot of issues.' She added, 'Why does a kid need anything more than the ability to place a phone call during an emergency while at school?'
Another person chimed in: 'Middle school age kids have no reason to even need a phone at school. It’s one big distraction.'
They said: 'I’m not saying they can’t have a phone. It should be treated as a reward or privilege rather. Give it to them when they get home from school as a reward for working hard at school. Problem solved.'
Other social media users offered their solutions, with one saying: 'I know a substitute that has the rule of in order to go to the bathroom they have to turn in their phone. They get it back when they return.'"
890OO7VOMD_CBJCO5H2G7QTKXH,Amanda Holden ensures all eyes are on her in sequin co-ord while dancing up a storm to viral hit Murder On The Dancefloor at daughter Lexi's 18th birthday party,Milly Veitch For Mailonline,"Published: 09:56 GMT, 21 January 2024 | Updated: 11:51 GMT, 21 January 2024",20240121,dailymail.co.uk,https://www.dailymail.co.uk/tvshowbiz/article-12988607/Amanda-Holden-ensures-eyes-sequin-ord-dancing-storm-viral-hit-Murder-Dancefloor-daughter-Lexis-18th-birthday-party.html,"Amanda Holden looked to be having the time of her life on Saturday night, as she showed off her dance moves at daughter Lexi's 18th birthday party.
The radio presenter, 52, pulled out all the stops to celebrate her eldest child's milestone birthday.
She donned a sparkly white pair of trousers covered in sequins and a coordinating backless top to show off some extra skin.
Amanda stood behind the DJ decks with a microphone and took the opportunity to play Sophie Ellis-Bextor's hit Murder On The Dancefloor.
As the familiar tune began, she began dancing seductively against the wall, while Lexi's friends all cheered.
Amanda Holden looked to be having the time of her life on Saturday night, as she showed off her dance moves at daughter Lexi's 18th birthday party
The radio presenter, 52, pulled out all the stops to celebrate her eldest child's milestone birthday
She donned a sparkly white pair of trousers covered in sequins and a coordinating backless top to show off some extra skin
The birthday girl could be seen singing along in the crowd in a showstopping beaded minidress.
Amanda then made her way through the crowd to find her lookalike daughter and hand her the microphone.
The Britain's Got Talent star carried on moving through the teenagers and encouraging them to dance along.
She shared a video of the fun-filled moment to her Instagram, writing: 'The latest trend' in reference to the resurgence of Murder On The Dancefloor thanks to Saltburn.
Amanda shares lookalike daughter Lexi with her husband Chris Hughes, as well as their 11-year-old Hollie.
Lexi has already begun to follow in her mother's showbusiness footsteps, signing with the Storm modelling agency in 2022.
At the time, Amanda said: 'Lexi was approached last year and obviously we were waiting until she was 16 to sign anything.
'It's something she actually wants to do, so I'm taking the lead from her. She's a very quiet girl but she knows her own mind. She's very bright and wants to continue her studies.
Amanda stood behind the DJ decks with a microphone and took the opportunity to play Sophie Ellis-Bextor 's hit Murder On The Dancefloor
The birthday girl could be seen singing along in the crowd in a showstopping beaded minidress
Amanda then made her way through the crowd to find her lookalike daughter and hand her the microphone
The Britain's Got Talent star carried on moving through the teenagers and encouraging them to dance along
'There's no pressure and we'll just see what happens. But finishing her education is very much her plan, she'll have our support whatever she decides to do.'
Discussing Lexi's next steps last year, Amanda exclusively told MailOnline: 'She's been taken on by Storm.
'She's 17 but I think when she's 18 we'll start looking for her to be in that field. At the minute they are working on her Lookbook.'
However, she has banned Lexi from ever appearing on hit reality series Love Island, despite the teenager being 'obsessed' with the show.
Speaking on her Heart FM Breakfast Show with Jamie Theakston and Ashley Roberts, the trio discussed whether they would allow their kids on the show.
Ashley asked: 'Would you ever let your kids go on Love Island?' causing Amanda and Jamie to quickly shut down the idea: 'No! Absolutely not.'
Amanda continued: 'No way, my daughter’s 18 next year. It's just another way of being famous, isn't it really? It's not really about love. It's just about looking hot and just getting involved.
'It's just amazing telly, but it's not really for love so I don't want my daughter anywhere near it'.
Jamie replied: 'You don't go on that show to find love. Do you know what I mean? It's just manipulative'.
Lexi has already begun to follow in her mother's showbusiness footsteps, signing with the Storm modelling agency in 2022
However, she has banned Lexi from ever appearing on hit reality series Love Island, despite the teenager being 'obsessed' with the show (pictured together in 2022)"
