UniqueID,Title,Author,PTime,DTime,MentionSourceName,MentionIdentifier,Content
GG8RT69AXO_TXUNE8IGUQNPU7A,Revealed: Muslim schoolgirl who is taking High Court legal action against her teachers after pupils were banned from praying in school playground was suspended last year for threatening to stab girl,"Abul Taher, Security Correspondent For The Mail On Sunday","Published: 00:46 GMT, 21 January 2024 | Updated: 00:46 GMT, 21 January 2024",20240121,dailymail.co.uk,https://www.dailymail.co.uk/news/article-12987505/Muslim-schoolgirl-taking-High-Court-legal-against-teachers.html,"A Muslim schoolgirl who is taking High Court legal action against her teachers after pupils were banned from praying in the playground was suspended last year for threatening to stab a girl.
Court papers reveal the teenager made the threat soon after confiding in the fellow pupil that she was bringing the court case to 'harm the school'. She was excluded for five days last April after her 'scared' confidante told teachers what the girl had said to her.
The news comes as her headteacher, Katharine Birbalsingh, told The Mail on Sunday last night that she feared for her own safety due to the backlash over the legal case, which the pupil and her mother are funding with legal aid.
The girl is suing Michaela Community School, claiming the ban breached her human rights.
The judgment in the High Court case, which could cost £1million, is expected next month.
The girl's headteacher, Katharine Birbalsingh (pictured), told The Mail on Sunday last night that she feared for her own safety due to the backlash over the legal case
The girl is suing Michaela Community School (pictured), claiming the ban breached her human rights
The controversy was revealed by The Mail on Sunday last year when we told how the school and its staff received bomb threats, death threats and racial abuse after anger was whipped up by extremists following the ban.
The media was able to name the school and the head last week after a judge lifted reporting restrictions.
Michaela in Brent, North-West London, is one of Britain's best-known state schools, and attains some of the best GCSE and A-Level results in the country. It is rated 'excellent' by Ofsted.
Since its foundation in 2014, it has strictly enforced discipline.
The school – half of whose 700 pupils are Muslim – has never provided a prayer room, and pupils did not pray in the past, including the pupil suing the school, who can only be known as TTT.
Last night, in her first newspaper interview about the case, Ms Birbalsingh said of the threats against the school: 'Thousands of people were after us – we were getting the most horrific phone calls and emails, threatening violence and death.'
The head said the school stopped the praying when TTT and others began to intimidate other Muslim pupils, telling them to fast during Ramadan.
She added: 'We believe in promoting cohesion. Too often the Left denies brown and black children the right to be British – they say we are from somewhere else. But we are not. For multi-culturalism to work, everyone needs to feel as though they are British.'"
GRHPN2RXXU_3171Q223ROKKXP0,HEALTH NOTES: Researchers testing inhaled tuberculosis vaccine as cases rise,Mail on Sunday Reporters,"Published: 22:00 GMT, 20 January 2024 | Updated: 23:36 GMT, 20 January 2024",20240121,dailymail.co.uk,https://www.dailymail.co.uk/health/article-12986641/HEALTH-NOTES-Researchers-testing-inhaled-tuberculosis-vaccine-cases-rise.html,"Experts are searching for a more effective tuberculosis (TB) vaccine amid rising levels of infections.
Researchers from the Jenner Institute at the University of Oxford are recruiting volunteers who have had a BCG jab, who will be given a booster that is inhaled.
Scientists hope to prove that inhaling the medication through the lungs – where droplets of TB enter and infect the body – will be better at stimulating the immune system to fight off the disease. The BCG jab is generally given to babies and young children, but is thought to wear off over time.
The UK Health Security Agency announced in September that TB cases in England had increased by seven per cent in the first half of 2023, with 2,408 cases compared with 2,251 in the first half of 2022.
Dr Esther Robinson, head of the TB unit at UKHSA, says: 'Tuberculosis is curable and preventable, but despite significant progress towards elimination in recent years, the disease remains a serious public health issue in the UK.'
Researchers from the Jenner Institute at the University of Oxford are recruiting volunteers who have had a BCG jab, who will be given a booster that is inhaled
A quarter of people referred for diagnostic tests on the NHS face a wait of six weeks or more.
The medical negligence firm Patient Claim Line analysed NHS England data from October 2023 to find that of almost 1.6 million people waiting for tests, 393,583 had been on the list for more than a month-and-a-half. Some 160,000 had faced delays of more than three months.
People seeking urodynamic tests – which analyse how well the bladder can hold and release urine – were the most likely to face lengthy delays, with 42 per cent having to wait six weeks or more.
People seeking urodynamic tests – which analyse how well the bladder can hold and release urine – were the most likely to face lengthy delays, with 42 per cent having to wait six weeks
Artificial intelligence (AI) is being used to help people spot if medicines they have bought are counterfeits.
A smartphone app created by AI firm Cypheme says its detection technology can identify fakes by comparing images of medicine packaging against images of genuine products to check for subtle differences.
Users take a photo on their smartphone of the product they want to evaluate, then upload it on to the AI software ChatGPT to allow Cypheme's software to scan it and instantly reveal whether or not it is genuine.
It is thought that one in ten people in the UK have bought fake medical products in the past year alone as criminal gangs intercept shipments of medicines and switch them for lookalike counterfeits. Those most commonly bought in the UK include erectile dysfunction and weight-loss pills.
It's also much more likely that medicines bought from dodgy websites will be fake. While there's no single method to spotting these, suspicious websites will often be poorly designed with lots of pop-up ads, spelling and grammatical errors and adverts for prescription-only medicines on the homepage – which is illegal in the UK."
H220OY9Q4F_T0K1521MIE7KEG4,"EXCLUSIVECheers alum Shelley Long is seen looking glum and lost in thought days after skipping reunion with Kelsey Grammer, John Ratzenberger and other former co-stars at the Emmys",Karen Ruiz For Dailymail.com,"Published: 19:37 GMT, 21 January 2024 | Updated: 19:56 GMT, 22 January 2024",20240121,dailymail.co.uk,https://www.dailymail.co.uk/tvshowbiz/article-12983445/Cheers-Shelley-Long-glum-skipping-reunion-Kelsey-Grammer-John-Ratzenberger-Emmys.html,"Cheers alum Shelley Long was spotted breaking cover just days after she was a no-show at her former castmates' reunion at the 2024 Emmy Awards.
The TV star stepped out in her Pacific Palisades neighborhood on Tuesday afternoon to take her dog for a walk, exclusive DailyMail.com photos show.
Long, 74, who starred as bartender Diane Chambers on the classic TV sitcom, appeared glum and lost in thought, keeping her hands in her coat pockets while the pooch sniffed around without a leash.
The actress looked quite unrecognizable from her glamorous Hollywood heyday, sporting large eye glasses and dressed down in gray sweat pants, sneakers and a blue turtleneck.
Shelley Long was seen looking downcast and pensive in Los Angeles days after her mysterious absence at the Emmys
The 74-year-old actress broke cover on Tuesday to walk her pet Chihuahua around her Pacific Palisades neighborhood
The television star was notably on the Emmys stage on Monday when former cast members Ted Danson (Sam Malone), Rhea Perlman (Carla Tortelli), Kelsey Grammer (Frasier Crane) and John Ratzenberger (Cliff Claven) appeared on a replica of the show's Boston bar set
Long was mysteriously absent on the Emmys stage on Monday where her former Cheers co-stars reunited around a recreated set of the show's iconic bar.
It is not known why she skipped the get-together where cast members Ted Danson, Rhea Perlman, Kelsey Grammer, John Ratzenberger and George Wendt were all present together in a recreation of the famous set, although Woody Harrelson was also a no-show.
Kirstie Alley, who replaced Long in Season 6, died in 2022.
Cheers ran for 11 seasons from 1982 to 1993, though the show was almost canceled after its first season due to low ratings (74th of 77 primetime shows at the time).
However, it spent eight of its remaining 10 seasons in the top 10, becoming the most-watched show in Season 9.
It earned 28 Emmy Awards from 117 nominations, earning Outstanding Comedy Series nominations all 11 seasons, winning four.
Long was nominated for an Emmy five times, winning in 1991. She also won an Emmy three years later for her role in the special David's Mother in which she played the title role, the parent of an autistic boy.
Long's character's on-again, off-again romance with former Red Sox relief pitcher Sam Malone (played by fellow Emmy winner Ted Danson) kept the show on the top of the ratings chart year after year.
Shelley quit at the end of Season 5 in 1986, believing her character had run its course.
Dressed down in gray sweat pants, sneakers and a blue turtleneck, she appeared lost in thought and kept her hands in her coat pockets while the pooch sniffed around without a leash
Long is known for her role as intellectual barmaid Diane Chambers (left) in the hit NBC sitcom, which ran from 1982 to 1993. She looked quite unrecognizable from her glamorous Hollywood heyday during her outing on Tuesday
Long's character was known for her romance with Sam Malone (played by Ted Danson). She quit at the end of Season 5 in 1986, believing her character had run its course
But she reprised her Cheers role to appear as a guest character on Frasier opposite on-screen love interest Kelsey Grammer.
In his 1995 biography 'So Far' Kelsey claimed Shelley was unpopular with producers on Cheers.
He claimed producers grew tired of her constant complaints about his own character and plotlines.
Long found fame playing the intellectual barmaid in the 1980s sitcom but has also appeared in a string of other hit shows and movies including, The Money Pit, Troop Beverly Hills, Hello Again, and The Brady Bunch Movie.
The Hollywood star, who has been divorced twice and is a mother of one, has lived in a $1.3million condo in the upscale West Los Angeles enclave of Pacific Palisades, California, since divorcing her second husband Bruce Tyson in 2004.
But according to locals, she is rarely seen out and about."
HCIG6EL711_HPSO1SEAZP56C7L,Trade union leader threatens to disrupt Britain's Red Sea military operation against Houthis by calling for strike by civilian sailors working for the Royal Navy,"Abul Taher, Security Correspondent For The Mail On Sunday","Published: 01:29 GMT, 21 January 2024 | Updated: 02:16 GMT, 21 January 2024",20240121,dailymail.co.uk,https://www.dailymail.co.uk/news/article-12987895/leader-threatens-disrupt-Britains-Red-Sea-operation.html,"A militant trade union leader has threatened to disrupt Britain's military mission against Red Sea terrorists by calling for a strike by civilian sailors who provide vital supplies to Royal Navy warships.
Eddie Dempsey, assistant general secretary of the RMT Union, called Israel's war on Hamas terrorists in Gaza a 'genocide' during an online interview with Stop The War Coalition on Friday night.
He revealed plans for strike action by Royal Fleet Auxiliary sailors, who are vital in the resupply of ships conducting strikes against Houthi terrorists attacking Israel-bound cargo ships off the coast of Yemen in support of Hamas.
Mr Dempsey said: 'How insane it is we are bombing a former colony [Yemen] in support of a genocide, supposedly to protect shipping...
'We've got members in the Royal Fleet Auxiliary, who are stationed in the Mediterranean, who act as a civilian supply route to the Royal Navy.
Britain launched missile strikes against Houthi terrorists inside Yemen on January 12, in coordination with the Americans. Type 45 destroyer HMS Diamond (pictured) and frigate HMS Lancaster are in the Red Sea
Eddie Dempsey, assistant general secretary of the RMT Union, called Israel 's war on Hamas terrorists in Gaza a 'genocide' during an online interview with Stop The War Coalition on Friday night
'So our members are in danger because of the absolutely insane rhetoric we are seeing from Western politicians and the actions of our Government deciding to bomb Yemen along with the United States.
'I have to report to you that we are balloting our members for industrial action in the Royal Fleet Auxiliary.' His comments provoked fury from politicians and former military chiefs last night.
Admiral Lord West, a former head of the Royal Navy, said: 'It's an extraordinary and very dangerous thing to do, for a union to decide what is going to be a government's policy or not.'
Former Tory leader Iain Duncan Smith, an ex-soldier, added: 'I never thought a trade union would put the lives of members of Armed Forces at risk. I think it's shameful.'
Britain launched missile strikes against Houthi terrorists inside Yemen on January 12, in coordination with the Americans.
Type 45 destroyer HMS Diamond and frigate HMS Lancaster are in the Red Sea. Another frigate, HMS Richmond, is on its way there.
Iranian protesters are pictured burning a Union Jack and US flag during a demonstration in front of the British embassy in Tehran on January 12
The Houthis said they had launched their attacks in support of Hamas in Gaza. Israel went to war with Hamas in response to the October 7 terror attacks that killed 1,200 people in southern Israel.
Last night, an RMT spokesman claimed that the strike ballot of RFA members was about pay, despite Mr Dempsey's comments to Stop The War Coalition.
The spokesman said: 'At no point does Eddie Dempsey say that the ballot is due to UK foreign policy.
'RMT has an interest in the health and safety and working conditions of all its members. And where Government or employer decisions have an impact on our members, we will continue to speak out.'"
HQ7UU05K3Q_SFWRAYKCGNVUGTD,'Harry cannot stoop lower - I would advise him to stay away': German royal's fury as Harry takes selfie at tacky LA aviation awards with self-styled 'prince' who is accused of using spurious connections to flog 'wealth elixir' and become a reality TV star,Caroline Graham,"Published: 11:13 GMT, 21 January 2024 | Updated: 14:46 GMT, 21 January 2024",20240121,dailymail.co.uk,https://www.dailymail.co.uk/news/article-12988675/prince-harry-aviation-award-selfie-warning-stay-away-german-prince.html,"Prince Harry has been warned to 'stay away' from a German 'prince', who is accused of using his spurious connections to flog a 'wealth elixir', after posing for a selfie with him at an aviation awards ceremony.
The duke was all smiles as he posed with Prince Mario-Max Schaumburg-Lippe - who was once dubbed the 'King of Trash TV' -  at the 'Living Legends of Aviation' in Los Angeles on Friday night.
Prince Mario-Max website boasts connections stretching back to William of Orange, which would make him a very, very distant cousin of the British Royals.
But his royal connections have been questioned with the head of the family, Prince Alexander of Schaumburg-Lippe, accusing him of 'harvesting our name for personal gain' and warning Harry to 'stay away from this man'.
The 46-year-old was on the German version of Celebrity Big Brother in 2014 where he was evicted after just eight days inside the house, as well as appearing on a shopping channel to sell a 'wealth elixir'.
Prince Harry was all smiles as he posed for a selfie with Prince Mario-Max Schaumburg-Lippe at the Living Legends of Aviation in Los Angeles on Friday night
Mario-Max has been dubbed 'the King of Trash TV' in the German Press (Pictured in October 2023)
The head of the family, Prince Alexander of Schaumburg-Lippe, told The Mail on Sunday last night: 'It's very painful for me, this guy has been harvesting our name for his personal gain. Prince Harry cannot stoop lower than appearing with him. I would advise him to stay away from this man. '
Mario-Max – who claims he has the right to use the royal title after he was adopted by a distant relative of the family when he was 23 years old – has been dubbed 'the King of Trash TV' in the German Press for appearing on the local version of Big Brother, and hawking products on shopping channels including a so-called 'wealth elixir'.
He is also a regular visitor to America, where he has posed for photos with celebrities including Paris Hilton, Liza Minnelli and Ivana Trump at parties and red-carpet events, and where he once dated one of the Real Housewives Of Beverly Hills.
On Friday he immediately posted the photo of himself with Prince Harry – as featured on our front page – on social media. It attracted comments including: 'So cringe. Two irrelevant middle-aged men without serious pursuit using their titles to grift in superficial Hollywood,' and 'I'm embarrassed for both of you. This must be a joke.'
Speaking about meeting Harry, Mario-Max told The Mail on Sunday: 'We had a personal conversation and he was fabulous, very humble, very sweet. It filled me with joy.'
The Duke of Sussex was inducted into the 'Living Legends of Aviation' on Friday night where he was asked by host John Travolta about his first flight experience.
He stood to a rapturous applause as he recollected how he was aged seven or eight years old when he excitedly jumped into a Wessex Helicopter.
The head of the family, Prince Alexander of Schaumburg-Lippe, said Harry 'could not stoop any lower' than appearing with Prince Mario-Max
Prince Mario-Max flogging 'wealth elixir' on a shopping channel where he tells viewers 'they can have the life they wanted' by using the product
In 2009 he strutted down the catwalk as he modelled the 'Badelederhose', described on his website as 'Bavarian-styled swim trunks'
Mario-Max claims he has the right to use the royal title after he was adopted by a distant relative of the family when he was 23 years old
Mario-Max pictured with Paris Hilton in 2019. He boasts connections stretching back to William of Orange, which would make him a very, very distant cousin of the British Royals
The 46-year-old was on the German version of Celebrity Big Brother in 2014 where he was evicted after just eight days inside the house, as well as appearing on a shopping channel to sell a 'wealth elixir'
Socialites Cat Boe, Mario-Max, and Bahati 'Kolibri' Venus arrive for the Vienna Opera Ball at the State Opera in  2014
He is also a regular visitor to America, where he has posed for photos with celebrities including Paris Hilton , Liza Minnelli and Ivana Trump
Prince Mario-Max posts pictures of him posing with celebrities on his Instagram page. Pictured with Lady Gaga in 2018
He grabbed a selfie with Lord Andrew Lloyd Webber in 2018.
Harry joked: 'But then my father jumped in behind me and I was terrified.' But the duke made no mention of his sister in law Kate Middleton or his father's medical dramas.
The audience erupted into laughter and applause in response to the prince's quip with whistling also heard. Someone else can also be heard muttering 'excellent'.
King Charles joined the Royal Air Force (RAF) in August 1971 where he was trained to fly both a jet and a helicopter.
He had already taken flying lessons at university and was able to fly himself to RAF Cranwell for his first day of training.
After completing training, Charles gained his RAF Wings as Flight Lieutenant Wales. He was the first member of the royal family to gain this award.
Harry attended the ceremony at the Beverly Hilton Hotel in Beverly Hills last night without wife Meghan Markle, with the Duchess of Sussex having to stay home as one of their children became unwell, the PA news agency reported.
He paid tribute to his mother Diana during his acceptance speech and took a moment to remember the Grease star's meeting with Diana at a White House dinner for President Ronald Reagan in 1985.
Accepting the award from Travolta, the duke said: 'I was just a one-year-old when you danced with my mum at the White House and now look at us.'
Harry completed two tours of Afghanistan as a forward air controller and an Apache helicopter pilot, having flown countless training missions in the UK, US and Australia.
He served for 10 years in the military, rising to the rank of Captain, and later founded the Invictus Games - a sporting event for wounded military personnel and veterans.
Harry takes his place alongside other aviation and aerospace 'legends' including Buzz Aldrin, Jeff Bezos, Tom Cruise, Neil Armstrong, Harrison Ford, Morgan Freeman and Elon Musk.
Prince Harry pictured with John Travolta, Lauren Sanchez and Bill Gates at the Living Legends Of Aviation

The prince is seen arriving for Friday's event in Los Angeles
Harry is seen in December 2012 working as a helicopter pilot in Afghanistan
Harry is pictured in March 2011 standing in front of an Apache Helicopter a few days after the royal passed the half-decade milestone to become a captain in the British Army
The event's website also praised the duke for his work with charities and organisations including Travalyst, Sentebale, African Parks and WellChild.
A statement on its website said: 'Prince Harry is a humanitarian, military veteran, mental wellness advocate and environmentalist.
'He has dedicated his life to advancing causes that he is passionate about and that bring about permanent change for people and places.'
Harry, who was sporting a black velvet tuxedo, was inducted alongside US navy pilot Fred George and former world speed record holder Steve Hinton, as well as Lauren Sanchez - who is engaged to Amazon founder Bezos.
She received the Elling Halvorson Vertical Flight Hall of Fame Award for her skills as a helicopter pilot and aviation businesswoman, having founded aerial filming company Black Ops Aviation in 2016.
The duke's appearance comes as his father, the King, prepared to undergo treatment for an enlarged prostate next week, while his sister-in-law the Princess of Wales recovers from abdominal surgery in the London Clinic.
Among those congratulating Harry on the award was Prince Mario-Max Schaumburg-Lippe of Germany, who appeared on the Real Housewives Of Beverly Hills.
On Instagram, he said: 'Congratulations To HRH Prince Harry for his very much deserved Living Legends of Aviation Award... Well Done.'"
