UniqueID,Title,Author,PTime,DTime,MentionSourceName,MentionIdentifier,Content
O7ZWYEA3J1_H7HS501CNLS0UY4,University of Texas PhD student accused of brick assault hoax after racking up $40K from GoFundMe,"By Andrea Vacchiano , Jasmine Baehr Fox News","Published January 20, 2024 7:44pm EST",20240121,foxnews.com,https://www.foxnews.com/us/university-texas-phd-student-accused-brick-assault-hoax-racking-forty-thousand-dollars-gofundme,"University of Texas at Austin doctoral student Roda Osman, 33, was charged with theft by deception after she alleged that she was hit in the face with a brick and went viral.
A Ph.D. student in Texas was criminally charged after authorities accused her of lying about being assaulted and then raking in as much as $40,000 from a GoFundMe intended to help her recover.
Roda Osman, a student in the African and African Diaspora Studies Department at the University of Texas at Austin, was recently charged with felony-level theft by deception. In September, a friend of Osman's started a GoFundMe called ""Help Roda Recover"" after Osman was allegedly hit in the face with a brick.
On Saturday, Osman told Fox News Digital she's innocent and that she is ""heartbroken"" over the allegations.
Osman posted a video on social media where she alleged that she was assaulted by a man who asked for her phone number and was rejected. In the footage, she appeared visibly upset and pointed to a swollen part of her face.
DHS THREATENS TEXAS WITH LEGAL ACTION OVER SEIZURE OF PARK ALONG RIO GRANDE: ‘CEASE AND DESIST’
Osman told Fox that she was being targeted by the manosphere, a group of anti-feminist social media users. (@rho.reports8 via TikTok)
A friend of Osman's started a GoFundMe called ""Help Roda Recover"" after Roda was allegedly hit in her face with a brick. (GoFundMe)
""This man just hit me in my face with a brick and all these Black men just watched, and they don't give a f–k,"" Osman said.
The video was widely circulated on Twitter and, according to NBC reporting at the time, the situation, ""[pointed] to a familiar pattern of backlash hurled at Black women when they publicly denounce harm from Black men.""
According to court documents obtained by Fox News Digital, the Houston Police Department claims that Osman was in an altercation with a man when she was hit with a water bottle.
""It appeared Defendant Osman and [the man] were in the middle of a verbal argument when Defendant Osman swung her right hand while holding an unknown object and hit [the man] in the face,"" the documents read. ""[The man] then swung his right hand while holding what appeared to be a plastic water bottle and struck Defendant in the face.""
""The video footage capturing the incident did not support Defendant Osman's recorded statement.""
OFFICER WARNS TEENS THEY 'CAN GET SHOT' IF THEY PARTICIPATE IN TIKTOK TREND CAUSING 'DISTRESS FOR RESIDENTS'
Osman told Fox that she was being targeted by the manosphere, a group of anti-feminist social media users. (@rho.reports8 via TikTok)
Police also said they were contacted by a caller who accused Osman of running a fraudulent GoFundMe in 2020.
The 2020 GoFundMe was reportedly titled ""Help Black Muslim Mother Pay Her Medical Bill,"" and claimed that Osman was ""viciously assaulted by private security in Minneapolis, sustaining multiple facial contusions, a black eye and injuries to her leg. She needs an estimated $5,000 to pay for medical bills, legal fees, a new phone and more.""
The caller contacted the Minneapolis Police Department, but said that police could not corroborate the alleged assault. Authorities also spoke with a roommate named Rachel who accused Osman of scamming in the past.
""Ms. Rachel stated at first they were cool, but that she discovered Roda was scamming people and she wanted no part of it,"" the document said. ""Ms. Rachel mentioned the scam Roda took part in by creating the GoFundMe in 2020 claiming someone hit her but it was a lie.""
Osman spoke with Fox News Digital about the allegations on Saturday. She said that the head injury she suffered prevented her from knowing exactly what she had been struck by.
HARVARD ANNOUNCES ANTISEMITISM, ISLAMOPHOBIA TASK FORCES AMID ISRAEL-HAMAS WAR
Roda Osman, who studies African and African diaspora studies at the University of Texas at Austin, was recently charged with felony-level theft by deception. (@rho.reports8 via TikTok)
""I'm not guilty…as a person who suffered from a head injury from blunt force trauma and went online five minutes later for my own safety, I'm not obligated to remember every single detail correctly,"" Osman explained. ""That is unprecedented, and it's dangerous to victim-blame in that way, and to also hold me to a standard that is not legal.""
""I didn't see the weapon he hit me with,"" the student added. ""[A brick] is what it felt like. And that was the only weapon that I saw when I opened my eyes and I looked up…so that's what I believe the weapon of choice was.""
Osman also told Fox News Digital that she was being targeted by the ""manosphere,"" a group of anti-feminist social media users.
""The manosphere [is] targeting me…for speaking out against a Black man because Black women are supposed to protect Black men from the justice system,"" she said. ""But I refuse to be silenced when I have been harmed so brutally.""
COLLEGE PRESIDENTS AT HARVARD, MIT, UPENN SLAMMED FOR EQUATING RISING ANTISEMITISM WITH RARE ISLAMOPHOBIA
The Houston Police Department claims that Osman was actually in an altercation with a man when she was hit with a water bottle. (Houston Police Department)
According to Osman's UT–Austin webpage, her interests include ""Black feminist theory, ethnography, urban social movements, Black diasporic studies [and] decolonial studies."" Osman told Fox News Digital that the legal situation is making it difficult for her to focus on school.
""It's a horrible precedent to set for Black women, because Black women are already unprotected, and we are already silenced,"" Osman said. ""And this is sending a really bad message to all Black women telling them that if you are assaulted, and you do not remember every single detail correctly, you will be criminalized. And that is awful. And it's a scary, scary thing and I feel so heartbroken.""
GoFundMe told Fox News Digital that Osman has been banned from its website.
The University of Texas Tower on the University of Texas campus in Austin. (Ronald Martinez/Getty Images/File)
CLICK TO GET THE FOX NEWS APP
""GoFundMe has zero tolerance for the misuse of our platform and cooperates with law enforcement investigations of those accused of wrongdoing,"" a spokesperson explained. ""The fundraiser has been removed from the platform, all donors have been refunded, and Roda Osman has been banned from using the platform for any future fundraisers.""
Fox News Digital reached out to University of Texas at Austin for comment, but has not heard back.
Andrea Vacchiano is a breaking news writer for Fox News Digital and Fox Business. You can follow her on X at @andrea_vacch or send story tips to andrea.vacchiano@fox.com."
PUO4I981HA_QOLCX8LC7GX2F4T,"DeSantis surrogate says 'we never had high expectations' for New Hampshire, 'real fight' in South Carolina",By Stephen Sorace Fox News,"Published January 21, 2024 11:21am EST",20240121,foxnews.com,https://www.foxnews.com/politics/desantis-surrogate-says-we-never-had-high-expectations-new-hampshire-real-fight-south-carolina,"Rep. Thomas Massie, R-Ky., joins ‘Fox News Sunday’ to forecast the 2024 presidential election as GOP candidates continue to trail Donald Trump by a wide margin.
As support for Florida Gov. Ron DeSantis in New Hampshire's upcoming Republican presidential primary appeared to dwindle in recent polling, a surrogate for DeSantis on Sunday waved off the polls, saying ""the real fight"" would be hashed out in the South Carolina primary.
Rep. Thomas Massie, R-Ky., appeared on ""Fox News Sunday"" and was asked whether the two new polls showing DeSantis trailing former President Trump and former South Carolina Gov. Nikki Haley was the reason why the governor canceled a round of appearances on the Sunday show circuit.
""We never had high expectations for New Hampshire anyway,"" Massie responded. ""And Nikki’s exploiting a quirk of their primary, which is that undeclareds, i.e. Democrats, can vote in a Republican primary.""
""The real fight, I think, is in South Carolina,"" he continued. ""And that’s where Nikki Haley, I think, stumbles. She’s going to miss expectations and not even win her own state.""
DESANTIS CANCELS NBC, CNN APPEARANCES SUNDAY OVER SCHEDULING ISSUE AHEAD OF NEW HAMPSHIRE PRIMARY
DeSantis is trailing Trump and Haley in a distant third in New Hampshire, according to the newest polling. (AP Photo/Michael Dwyer, File)
Two new polls released Sunday morning show DeSantis in a distant third behind Trump and Haley in New Hampshire.
A University of New Hampshire/CNN poll showed Trump at 50%, Haley grabbing 39% support and DeSantis trailing in the single digits with 6%.
TRUMP LEAD OVER HALEY EXPANDS IN CLOSING DAYS BEFORE NEW HAMPSHIRE GOP PRESIDENTIAL PRIMARY
Meanwhile, a daily tracking poll released by Suffolk University, the Boston Globe and NBC10 in Boston showed Trump edging up to 55%, while Haley stood at 36% and DeSantis at 6%.
The new surveys indicate that Haley took majority support among independents, who are known as undeclared voters in New Hampshire. Independents can vote in either major party's contest, and have long played an influential role in the state's storied presidential primary.
CLICK TO GET THE FOX NEWS APP
With the New Hampshire Republican primary set for Tuesday, DeSantis has already begun to shift his focus to Haley’s home state of South Carolina, where he was campaigning over the weekend.
Fox News’ Paul Steinhauser contributed to this report."
QBTV78X3HE_0BJR5XX9UBBC4JC,GRAPHIC PHOTOS: Animal welfare groups call on Biden admin to address 'thousands' of dogs abandoned by migrants,By Houston Keene Fox News,"Published January 21, 2024 4:00am EST",20240121,foxnews.com,https://www.foxnews.com/politics/animal-welfare-groups-biden-admin-address-thousands-abandoned-dogs-border,"Animal welfare groups are calling on the Biden administration to address the large number of abandoned pets at the southern border. (Boots on the Ground)
FIRST ON FOX: Animal welfare groups are calling on the Biden administration to address a large number of abandoned pets at the southern border.
Fox News Digital obtained photos and videos of pets in Colony Ridge, Texas, from animal advocacy group Boots on the Ground that were reportedly abandoned by migrants, including some that appear severely neglected or injured.
Scores of animals have been abandoned at the U.S.-Mexico border as illegal immigrants flood into the country in record-breaking numbers.
Immigrants who are apprehended by Customs and Border Protection (CBP) are often forced to leave their animals behind because animals are not allowed inside federal processing centers.
AS HISTORIC NUMBERS OF MIGRANTS CROSS THE BORDER, THEIR DOGS ARE OFTEN ABANDONED ALONG THE WAY
Migrants are processed in Eagle Pass, Texas, Dec. 12, 2023. (Fox News)
Chase Scott, spokesperson for Big Dog Ranch Rescue (BDRR), a dog rescue group, told Fox News Digital the ""number of abandoned dogs along the border is in the thousands,"" and the Biden administration is ""doing virtually nothing"" to address the situation.
Scott said BDRR ""can lead this effort"" but needs ""donations or help from FEMA to address this issue."" He called on FEMA to provide ""a dozen spay [and] neuter vans to stop the overpopulation"" and ""transport and medical supplies,"" so they ""can heal and rescue the dogs and get them into loving homes.""
""We need to act now before this becomes completely out of control,"" Scott said.
""Colony Ridge is a huge migrant shanty town with starving dogs trying to eat chickens and livestock, so the migrants shoot them and attack them with machetes. The local communities are heartbroken and overwhelmed. They are turning into a Third World [country] with roaming packs of dogs.""
ILLEGAL IMMIGRANT POPULATION SOARS UNDER BIDEN: GOVERNMENT DATA
Scott said BDRR is heading to McAllen, Texas, this weekend on a rescue mission for the abandoned dogs after having gone to the Texas border city of Eagle Pass last year.
Scott said the dogs in McAllen, Texas, ""are being fed"" by the National Guard, ""but with the cold fronts, the situation is dire,"" and BDRR will be rescuing the dogs there first.
After McAllen, Scott said BDRR will head ""into the primary area with the largest issue,"" adding ""ground zero is Colony Ridge.""
BORDER NUMBERS FOR DECEMBER BREAK MONTHLY RECORD, AS BIDEN TALKS AMNESTY WITH MEXICO
Bianca Gracia, president of Latinos for America and Latinos for Trump, told Fox News Digital what ""is happening at Colony Ridge with the abandoned and abused dogs who are voiceless is a tragedy caused by elected officials' open border policies.
""We are asking America to step up and help us rescue these voiceless furry friends from a life they did not choose.""
Animal rights group People for the Ethical Treatment of Animals (PETA) told Fox News Digital it has received reports that it's not just dogs and cats being abandoned. Animals like guinea pigs have been left too.
WARNING: GRAPHIC IMAGES
(Photo courtesy of Boots on the Ground) (Boots on the Ground/Fox News Digital)
(Photo courtesy of Boots on the Ground) (Boots on the Ground/Fox News Digital)
(Photo courtesy of Boots on the Ground) (Boots on the Ground/Fox News Digital)
(Photo courtesy of Boots on the Ground) (Boots on the Ground/Fox News Digital)
(Photo courtesy of Boots on the Ground) (Boots on the Ground/Fox News Digital)
(Photo courtesy of Boots on the Ground) (Boots on the Ground/Fox News Digital)
(Photo courtesy of Boots on the Ground) (Boots on the Ground/Fox News Digital)
(Photo courtesy of Boots on the Ground) (Boots on the Ground/Fox News Digital)
(Photo courtesy of Boots on the Ground) (Boots on the Ground/Fox News Digital)
(Photo courtesy of Boots on the Ground) (Boots on the Ground/Fox News Digital)
Catie Cryar, spokesperson for PETA, told Fox News Digital that abandonment ""is awful — no matter which side of the border it occurs on.""
""PETA has received reports that animals as varied as guinea pigs and small dogs have actually been brought in by people entering the U.S. from Mexico, but we know that the border processing facilities don’t allow it,"" Cryar said.
""We have also heard of an informal network of people on the Mexican side who are looking after animals who have been denied entry,"" she added. ""Many animals are a cherished, integral part of the family and, just like children, should not be separated from that family.
""PETA is calling on the Biden administration to allow animals into the U.S. if they are vaccinated or can be quarantined.""
The White House referred Fox News Digital to U.S. Customs and Border Patrol (CBP) when asked for comment.
""CBP follows CDC guidance with respect to the admission of dogs and other pets into the country,"" a spokesperson for CBP said. ""If the pet’s owner is an inadmissible noncitizen in DHS custody and an animal’s owner does not transfer possession to family or friends, U.S. Customs and Border Protection works with local officials from animal health services, such as a local humane shelter, to see if there can be placement for the animal while its owner remains in custody.""
Fox News Digital also reached out to FEMA and the National Guard for comment.
MAYORKAS TELLS BORDER PATROL AGENTS THAT ‘ABOVE 85%’ OF ILLEGAL IMMIGRANTS RELEASED INTO US: SOURCES
The shocking photos and footage obtained by Fox News Digital show the harsh reality faced by the dogs and other animals abandoned by their owners as they enter the U.S. at the southern border.
The footage depicts abandoned animals in the migrant community of Colony Ridge, Texas, a collection of subdivisions outside Houston.
Colony Ridge is a controversial locale, having made headlines after being sued by the federal government for allegedly hooking Latino buyers up with seller-financed mortgages to set them up for defaulting on their loans.
Colony Ridge CEO John Harris told Fox News Digital in a statement that ""Colony Ridge has done everything conceivably possible to rid the problem of stray dogs and cats and animals throughout the area.
""We have donated consistently $20,000 a year to help solve the problem to the local group that kind of helps spay and neuter and house these animals,"" Harris said. ""So, we are doing our part without question.""
Harris noted that Liberty County, which houses Colony Ridge, is a ""rural area"" that doesn't have an animal control group, and that if one goes ""anywhere in a rural county in America, and especially here in Texas, you're going to have stray dogs and cats and other animals.""
""That's just a fact,"" Harris said. ""But we are doing everything we possibly can to curb the problem.""
Harris also said ""90%"" of Colony Ridge residents ""come from Harris County,"" 40 miles to the south.
CLICK HERE TO GET THE FOX NEWS APP
""The animal issue is not an immigrant issue. It's an issue that stems from bad owners who need to understand how to care for their animals,"" Harris said. ""We are providing that education and going above and beyond what is needed to help resolve this problem.""
The Community Property Owners Association of Colony Ridge told Fox News Digital that This is Houston, a nonprofit organization, has been assisting in the new development since 2021 due to Liberty County not having animal control services.
Houston Keene is a politics writer for Fox News Digital.  Story tips can be sent to Houston.Keene@Fox.com and on Twitter: @HoustonKeene"
QVTMIFR595_86QX4QDLNLL77T1,2 in Oklahoma accused of toppling country radio station tower to steal $100 in copper,By Pilar Arias Fox News,"Published January 21, 2024 12:32pm EST",20240121,foxnews.com,https://www.foxnews.com/us/2-oklahoma-accused-toppling-country-radio-station-tower-steal-100-copper,"Fox News Flash top headlines are here. Check out what's clicking on Foxnews.com.
A man and a woman have been arrested for allegedly taking down part of an Oklahoma radio station's nearly 500-foot tower to steal some copper, Choctaw County Sheriff Terry Park says.
The tower, located in Hugo, belongs to Payne Media Group's station K95.5. The radio station posted a video of the damage on Facebook following the vandalism that took place Jan. 15.
""Cut the guy-wire on one leg and that's what brought entire top sections down,"" the video's narrator, identified to Fox News by the station as Will Payne, says. ""And then, they proceeded to disassemble.""
Cut hardware was shown as viewers were told how the transmission line connected to the antenna was targeted by the thieves.
FOUR OKLAHOMA STATE FRATERNITY MEMBERS ARRESTED FOR ALLEGEDLY LEAVING DEAD LONGHORN OUTSIDE RIVAL FRAT HOUSE
Portion of the mangled radio tower on the ground, shared by Sheriff Terry Park. (Facebook/Terry Park)
Sheriff Terry Park posted the damage to social media. (Facebook/Terry Park)
A man and a woman have been arrested for allegedly vandalizing the nearly 500-foot radio tower. (Facebook/Terry Park)
""What they do, these copper thieves, is they cut it up in these 10-foot sections,"" Payne says. ""So right now we know that there's probably eight to 10 of these sections in the back of a truck or a van, maybe. This is what we need to be looking out for, and if you can help me out as we try to figure out our next step, what we're gonna do to rebuild this place.""
""Let's make them pay,"" Payne says about the crime that happened overnight, leaving the mangled tower on the ground. He said the copper taken would only be worth about $100, but Sheriff Park believes otherwise.
OKLAHOMA WOMAN SHOOTS AND KILLS MAN WHO BROKE INTO HER HOME: POLICE
Radio tower copper theft suspect Candice Logan, seen photographed with a car containing what appears to be copper in the trunk. (Facebook/Terry Park)
Copper theft suspect Matt Wilson in custody. (Facebook/Terry Park)
""Loss of copper a few hundred dollars, damage to the tower and building approximately 500,000.00,"" Park posted on his Facebook page.
The station, identified by call letters KITX, is still not available over-the-air as a result of the tower damage, but can be listened to online. It is also posting updates about the investigation on Facebook.
CLICK HERE TO GET THE FOX NEWS APP
Sheriff Park identified the suspects as Matt Wilson and Candice Logan. Local media outlet the Paris News identifies Wilson as being 37 years old, and Logan as 34. The investigation is ongoing.
The tower was built in 2017 and K95.5 was the first FM station to serve northeast Texas and southeast Oklahoma, a station spokesperson told Fox News via Facebook Messenger. They added that local community response has been ""humbling."""
