UniqueID,Title,Author,PTime,DTime,MentionSourceName,MentionIdentifier,Content
THQS81LK54_VJGNN7KB6ERKMQL,What color looks best on me? Expert tips for choosing the color palette that works best for your tones,By Maeghan Dolph Fox News,"Published January 21, 2024 10:37am EST",20240121,foxnews.com,https://www.foxnews.com/lifestyle/expert-tips-choosing-clothing-color-palette-best-tones,"Fox News Flash top headlines are here. Check out what's clicking on Foxnews.com.
Selecting the right clothing color palette is a crucial aspect of personal style.
The colors you wear can greatly impact your overall appearance, enhancing your features and boosting your confidence.
Here's a guide on how you can find the perfect color match for your complexion with help from stylist and personal shopper Mona Sharaf.
Before delving into the world of colors, it's essential to understand your skin undertones.
Undertones are the subtle hues beneath the surface of your skin, categorized as warm, cool or neutral.
AS WEDDING COLOR OF THE YEAR IS ANNOUNCED FOR 2024, SEE THE HUE THAT BRIDES ARE EXPECTED TO CHOOSE
""Determining whether you are cool or warm can sometimes only be done by an expert. There are theories online that you can tell by the color of your veins, but I don’t find that to be true,"" Sharaf told Fox News Digital.
Sharaf studied image consulting at the Fashion Institute of Technology in New York City and has worked for well-known designers, including Norma Kamali. The often misconceived theory is that greenish veins often indicate warm undertones, while bluish veins suggest cool undertones and neutral undertones may have a mix of both.
""Having your correct undertones assessed by a professional image consultant is really the best way to know. However, if you wanted to try to assess on your own, I would take a look at the pigment of your skin. If it’s more pink or olive, you wear cool colors, if your skin is more yellow and less pink and/ or you tend to freckle in the sun, you are likely warm.""
Choosing the right colors that complement your skin tone can significantly enhance your overall appearance. Consider factors like your undertones, which can be warm, cool or neutral. (iStock)
For individuals with warm undertones, earthy colors are the way to go.
Think of warm shades like reds, oranges, yellows and browns. These colors complement the golden or peachy undertones in your skin, creating a harmonious look. Mustard, rust and olive green are also excellent choices for a warm-toned wardrobe.
OBTAINING THE LOOK AND FEEL OF QUIET LUXURY, A FASHION TREND THAT'S ONLY GROWING
If you have cool undertones, jewel tones can work wonders for your wardrobe.
Shades like sapphire blue, emerald green and amethyst purple can enhance the coolness in your skin, creating a sophisticated appearance.
Cool-toned individuals may also find pastels like mint green and lavender complementing their undertones.
NEW YEAR, NEW STYLE: TRICKS TO HELP GET RID OF CLOTHES YOU HAVEN'T WORN
Neutral undertones have the flexibility to pull off a wide range of colors.
However, individuals with neutral undertones often look particularly stunning in classic neutrals like black, white, gray and navy. These timeless hues provide a versatile base for any wardrobe, allowing individuals with neutral undertones to experiment with various accent colors.
The color wheel is a valuable tool that can guide you in creating harmonious color combinations. Complementary colors, analogous colors and triadic colors are concepts worth exploring to find the perfect balance.
""When you are wearing your ‘right’ colors you look more youthful, brighter, texture (freckles, blemishes, wrinkles, age spots, discoloration) in your skin fades. Even your oily t-zones fade away! You just look more rested and radiant in general,"" says Sharaf.
A woman standing near neutral and pink colored clothing. Experimenting with various shades and observing how they enhance your complexion is key to finding your perfect color. (iStock)
Don't hesitate to seek advice from professionals to discover the perfect palette for your wardrobe and personal style. (iStock)
Contemporary color choices strategically place opposing hues on the color wheel, fostering a bold contrast. This combination elevates visual appeal, giving a modern touch to design and aesthetics.
The juxtaposition of these contrasting colors infuses vibrancy and energy, establishing contemporary color schemes as a favored option across diverse artistic and design realms.
Analogous colors are those that neighbor each other on the color wheel, sharing similar undertones.
CLICK HERE TO SIGN UP FOR OUR LIFESTYLE NEWSLETTER
Widely used in design and art, analogous colors offer a sense of coordination. Their subtle variations allow for creative expression while maintaining a balanced overall look.
Triadic colors involve selecting three hues evenly spaced around the color wheel, forming an equilateral triangle.
The chosen colors are usually primaries or secondaries, creating a diverse yet cohesive look.
Popular in art and design, triadic palettes offer an interplay of colors, enhancing aesthetic appeal with a sense of unity.
Sharaf emphasized the importance of aligning your wardrobe color palette with your lifestyle and personality.
""All of this leads you to feeling more confident. When we are confident, we perform better in everything we do, whether it’s making a presentation at work, going on a date, or taking pictures,"" says Sharaf.
CLICK HERE TO GET THE FOX NEWS APP
Your clothing colors should resonate with who you are and the image you want to project. Consider the settings you're in, your professional requirements, and your personal preferences while choosing your correct clothing color palette.
For a professional setting, neutral colors like black, gray and navy can convey a polished and sophisticated image. If you're more adventurous, injecting bold colors or patterns into your wardrobe can showcase your personality.
The key to understanding your wardrobe color palette is to have fun exploring colors and expressing your unique style with confidence.
For more Lifestyle articles, visit www.foxnews.com/lifestyle."
TRV6THMOWK_QGGEL4XFF696991,"San Francisco Mayor London Breed slams city supervisors' Gaza cease-fire resolution, but refuses to veto",By Stephen Sorace Fox News,"Published January 21, 2024 7:04am EST",20240121,foxnews.com,https://www.foxnews.com/politics/san-francisco-mayor-london-breed-slams-city-supervisors-gaza-cease-fire-resolution-refuses-veto,"Fox News Flash top headlines are here. Check out what's clicking on Foxnews.com.
San Francisco Mayor London Breed on Friday blasted the city supervisors' resolution calling for an extended cease-fire in Gaza as divisive and fanning the flames of antisemitism, though she stopped short of issuing a veto.
The Democrat mayor, who is up for reelection this year, wrote in a statement online that the debate over the nonbinding resolution has left the city ""angrier, more divided and less safe"" as ""abject antisemitism"" had apparently become acceptable to a subset of activists.
""The antisemitism in our city is real and dangerous,"" she wrote, adding that vetoing the resolution would send the issue back to the board, in whom she has ""no confidence,"" lead to more divisive hearings and ""fan even more antisemitic acts.""
Breed said she had spoken to numerous Jewish residents ""who tell me they don't feel safe in their own city. ... They are fearful of the growing acts of vandalism and intimidation.""
ANTISEMITISM IS GETTING WORSE AS MORE ‘SHOCKING’ AND ‘SCARY’ INCIDENTS ARE EXPOSED, DC RESIDENTS SAY
Breed, who is up for re-election, said that vetoing the resolution would only lead to more division in San Francisco. (Tayfun Coskun/Anadolu Agency via Getty Images, File)
A divided board approved the resolution earlier this month, which also condemned Hamas as well as the Israeli government and urged the Biden administration to press for the release of all hostages and delivery of humanitarian aid.
Breed wrote that the board members, and even herself as mayor, are not elected or qualified to weigh in on foreign policy.
View of San Francisco from the Golden Gate Bridge. The Bay Area was struck by a 5.1 magnitude earthquake (Stephen Lam/San Francisco Chronicle via Getty Images)
""Their exercise was never about bringing people together,"" Breed wrote in a statement. ""It was about choosing a side.""
BUSINESS OWNERS SAY SAN FRANCISCO IS ‘GETTING WORSE’ FOR RESTAURANTS AMIDST HOMELESS CRISIS: REPORT
Breed wrote that despite the board putting San Francisco in a ""terrible position,"" she ""must choose unity.""
""When we advocate for people thousands of miles away, we should still care for the people who are right here in San Francisco … We are all San Franciscans,"" she wrote.
CLICK TO GET THE FOX NEWS APP
Dozens of other U.S. cities have approved a resolution that has no legal weight but reflects pressure on local governments to speak up on the Israel-Hamas war, now in its fourth month.
The Associated Press contributed to this report."
U6MLB2FBEA_FB6Y6QO2CU7QHII,Pro-life health care workers urge pro-family policies as major medical institutions push abortion,"By Thomas Phippen , Aubrie Spady Fox News","Published January 21, 2024 4:00am EST",20240121,foxnews.com,https://www.foxnews.com/politics/pro-life-healthcare-workers-urge-pro-family-policies-medical-institutions-abortion,"Chris Faddis, Solidarity HealthShare president, spoke with Fox News Digital at the annual March for Life about the current attacks on pro-life health care.
WASHINGTON, D.C. – Pro-life advocates may have faced political setbacks across the country since Roe v. Wade was overturned, effectively granting states the ability to regulate abortion.
As thousands gathered in the snow Friday on the National Mall ahead of the march around the Capitol to the Supreme Court, many called for a continued expansion of the pro-life cause to include policies and programs to help mothers and families, not just work on legal battles.
""It's important that we not just combat the harm of abortion that it's causing our patients, but also recognize why women are oftentimes seeking abortion and do something about that,"" Christina Francis, CEO of the American Association of Pro-Life Obstetricians and Gynecologists (AAPLOG), told Fox News Digital on the sidelines of the March for Life Friday.
But some pro-life activists in the health profession told Fox News Digital they see other wins since the Supreme Court's decision in Dobbs v. Jackson overturned nearly 50 years of Roe precedent. Doctors and medical professionals are rejecting messages from advocates for abortion.
PRO-LIFE DEMONSTRATORS BRAVE DC SNOW FOR 2024 MARCH FOR LIFE
People march for life in Washington, D.C., Jan. 19, 2024, and they are met by one counter-protester at the Supreme Court. (Andrew Thomas/NurPhoto via Getty Images)
""We definitely have seen a growth in our membership in the last two years, especially right after Dobbs. We had a huge increase in membership,"" Francis said.
AAPLOG's medical student and resident fellowships increased from about 200 to around 400 since the 2022 Dobbs decision, and total membership increased from 7,000 to around 7,500. In the past decade, the group tripled in total membership.
Some new members join AAPLOG due to feeling left behind by the pro-choice stances of the major medical institutions, according to Francis.
""What they're realizing now is that we are under active attack, I would say ... not just from pro-abortion advocates, but from our major certifying bodies,"" Francis said.
""Many of them are seeing the veil has been lifted, I think, on the true position of some of our major medical associations.""
The American College of Obstetricians and Gynecologists (ACOG), according to Francis, has acted inconsistently with many OB/GYNs' beliefs about providing quality health care.
In August 2023, ACOG Interim President Christopher Zahn wrote in a letter to The Washington Post expressing the belief abortion access should not be limited.
""Abortion is safe. It improves and saves lives, and it must be available without restrictions, without limitations and without barriers — just as any other critical part of health care,"" Zahn wrote.
PRO-LIFE GROUPS HAMMER ‘TWISTED ATTEMPT’ BY DEMOCRATIC AGS TO ‘HINDER’ PREGNANCY CENTERS FROM HELPING WOMEN
""I think that many physicians are seeing now how radical that position is,"" said Francis. ""Maybe they're not exactly in the same position I am on abortion, but they recognize that there should at the very least be some limitation, and there should be safeguards put into place for women's safety and to ensure that they're in good care. We really are seeing a lot of physicians and other medical professionals wake up to what's been going on in our profession for quite some time.""
ACOG last year released a fact sheet that dismissed as misinformation some pro-life terms — particularly the claims that abortion defenders want abortion to be legal to the point of birth.
Demonstrators march past the U.S. Capitol during the annual March For Life on the National Mall in Washington, D.C., Friday, Jan. 19, 2024.  (Tierney L. Cross/Bloomberg via Getty Images)
""'[A]bortion up until birth' or ‘abortion after birth’ are examples of derogatory language used by opponents of abortion access that is not based in facts. Neither is accurate, and neither uses clinically appropriate language,"" ACOG's website states.
ACOG also says abortion later in pregnancy is rare and indicates that ""something has gone terribly wrong regarding the patient’s health or the pregnancy.""
Viewing abortion as something involving a single patient, according to Francis, is one of the issues driving medical practitioners to question the major health groups that insist abortion is health care.
PRO-LIFE VOTERS REVEAL HOW THEY REALLY FEEL ABOUT TRUMP'S STANCE ON ABORTION
""We know that induced abortion is not health care. It ends the life of one of our patients, and it significantly harms our other patients,"" said Francis.
""They need to point out the extreme, radical nature of what [Democrats] will do if they get into office and have the majorities in the House, Senate and the White House. It'll be abortion until birth. In debates, when facing down your Democratic opponent, make him or her defend that.""
""This abortion fight is it's not just Planned Parenthood clinics and the pregnancy centers, it is in health care today,"" said Chris Faddis, president of Solidarity HealthShare.
""The health care system is pushing people more and more towards early fetal testing, so they can push people to abortions and their children into, you know, Planned Parenthood for regular female care, so they can get them on birth control and a board of patients and those things,"" Faddis said.
AHEAD OF MARCH FOR LIFE, MISSISSIPPI UNVEILS MOBILE APP TO HELP PREGNANT MOMS
Concerned Women for America President Penny Nance told Fox News Digital a priority for the pro-life movement must be expanding ways for struggling pregnant women and mothers to get assistance, be it public or private.
""We know the No. 1 reason a woman chooses abortion is that she isn't supported,"" said Nance.
One proposal is a national clearinghouse where a pregnant woman can search her zip code for resources near her — not just medical, but financial assistance, help with bills and food or employment. The idea is similar to a program in Mississippi that launched in the past year to collect public assistance and nonprofits into one searchable database.
CLICK HERE TO GET THE FOX NEWS APP
March for Life has also been a political advocacy group, and in light of recent setbacks at the ballot box for abortion issues, pro-lifers have urged pro-life politicians not to avoid the issue, but to put Democrats on the defensive.
""They need to point out the extreme, radical nature of what [Democrats] will do if they get into office and have the majorities in the House, Senate and the White House. It'll be abortion until birth. In debates, when facing down your Democratic opponent, make him or her defend that,"" said Rep. Chris Smith, R-N.J.
Thomas Phippen is an Editor at Fox News."
UFEWCC9YDX_PR5EI7WDCWSF1KF,Fox News Channel to present special live coverage of nation’s first state primary in New Hampshire,By Brian Flood Fox News,"Published January 21, 2024 7:00am EST",20240121,foxnews.com,https://www.foxnews.com/media/fox-news-channel-present-special-live-coverage-nations-first-state-primary-new-hampshire,"Fox News Bryan Llenas on the latest polling ahead of the New Hampshire primary
Fox News Channel will be on the ground in New Hampshire throughout with special coverage of the nation’s first state primary.
Many of Fox News’ programs will broadcast live from Bedford, New Hampshire, throughout the day on Monday and Tuesday leading up to ""Democracy 2024: New Hampshire Primary,"" co-anchored by Bret Baier and Martha MacCallum, at 10 p.m. ET on primary day.
Tuesday's two-hour ""Democracy 2024: New Hampshire Primary"" special will feature additional insight from ""The Five"" co-host Dana Perino, chief political analyst Brit Hume, ""Sunday Night in America"" host Trey Gowdy, FOX Business Network’s Charles Payne and contributor Kellyanne Conway.
AMERICANS TURNED TO FOX NEWS DIGITAL IN 2023 AS PLATFORM FINISHES AS TOP-PERFORMING NEWS BRAND
""Democracy 2024: New Hampshire Primary,"" co-anchored by Bret Baier and Martha MacCallum will begin at 10 p.m. ET on Tuesday.  (KAMIL KRZACZYNSKI/AFP via Getty Images)
""America’s Newsroom"" co-anchor Bill Hemmer will analyze results in real-time on the electronic ""Bill-board"" throughout the evening, and ""America Reports"" co-anchor Sandra Smith will present Fox News Voter Analysis to showcase results from the primary election.
""FOX & Friends"" will kick things off with Lawrence Jones broadcasting live from a Bedford diner on Monday.
""America’s Newsroom,"" ""The Faulkner Focus"" with Harris Faulkner, ""Outnumbered,"" ""The Story with Martha MacCallum,"" ""The Five,"" ""Special Report with Bret Baier,"" ""Jesse Watters Primetime"" ""and ""Hannity"" will broadcast from the Bedford Village Inn.
Special primary programming will continue with Trace Gallagher, who will anchor a New Hampshire primary edition of ""FOX News @ Night"" from 12-2 a.m. ET on Wednesday morning. An extended edition of ""Democracy 2024: New Hampshire Primary"" co-anchored by Gillian Turner and Mike Emanuel will begin at 2 a.m. ET.
FOX NEWS CHANNEL CRUSHES CNN, MSNBC IN 2023, FINISHES AS MOST-WATCHED CABLE NETWORK FOR 8TH STRAIGHT YEAR
A sign outside the state capital building in Concord, New Hampshire, spotlights the state's treasured position for the past century in holding the lead-off presidential primary. (Fox News - Paul Steinhauser)
Additional contributions in the Granite State will be made by ""The Five"" co-host Jessica Tarlov, ""Outnumbered"" co-host Kayleigh McEnany, FNC senior political analyst Juan Williams, FOX News Radio’s Guy Benson and contributors Katie Pavlich and Marc Thiessen.
Neil Cavuto already kicked off coverage from New Hampshire on Saturday with ""CAVUTO Live,"" and Shannon Bream will anchor ""FOX News Sunday"" from Bedford. On Sunday night, ""Democracy 2024: New Hampshire Primary"" co-anchored by John Roberts and Sandra Smith will examine the nation’s first primary state.
Fox News will also offer live reports throughout New Hampshire and updates from candidate headquarters during the primary from correspondents Bryan Llenas, Alexis McAdams and Madison Alworth.
Many programs will broadcast from New Hampshire on Wednesday, too.
FOX NEWS CHANNEL’S TRUMP TOWN HALL CRUSHES VIEWERSHIP OF CNN’S HALEY-DESANTIS DEBATE
Republican presidential candidate, former U.S. President Donald Trump points to supporters at the conclusion of a campaign rally at the Atkinson Country Club on January 16, 2024 in Atkinson, New Hampshire. (Brandon Bell/Getty Images)
Last week, Fox News Channel crushed viewership of MSNBC and CNN combined on Monday night during special coverage of the Iowa GOP caucuses.
Fox News averaged 2.8 million viewers from 8-11 p.m. ET compared to 1.1 million for MSNBC and an average audience of 688,000 for CNN. Fox News more than quadrupled CNN’s audience and doubled MSNBC’s viewership.
Fox News also thumped the competition among the demographic most coveted by advertisers, averaging 402,000 adults age 25-54 from 8-11 p.m. ET compared to 194,000 for CNN and only 143,000 for MSNBC.
CLICK HERE TO GET THE FOX NEWS APP
Brian Flood is a media editor/reporter for FOX News Digital. Story tips can be sent to brian.flood@fox.com and on Twitter: @briansflood."
