UniqueID,Title,Author,PTime,DTime,MentionSourceName,MentionIdentifier,Content
035VTU3JHA_7IQLTX1GOPNH5T2,"Trump talks 2024 with Bret Baier, says Biden is ‘very dangerous’ and ‘can’t put two sentences together’",By Bradford Betz Fox News,"Published January 21, 2024 3:46pm EST",20240121,foxnews.com,https://www.foxnews.com/politics/trump-talks-2024-bret-baier-says-biden-very-dangerous-cant-put-two-sentences-together,"New Hampshire’s highly anticipated primary comes on Tuesday, January 23.
Fox News’ Bret Baier caught up with former President Donald Trump in Bedford, New Hampshire on Saturday to discuss the 2024 presidential race ahead of Tuesday’s highly anticipated primary in the state.
The 2024 frontrunner discussed beating GOP rivals Florida Gov. Ron DeSantis, who came in second, and former U.N. ambassador and South Carolina Gov. Nikki Haley, who came in third in the Iowa primary.
Trump hit back at Haley after she questioned the former commander-in-chief’s mental capacity after he appeared to mix her up with former House Speaker Nancy Pelosi during a rally this week.
Republican presidential candidate and former President Donald Trump speaks during a campaign rally at the SNHU Arena on January 20, 2024, in Manchester, New Hampshire.  (Alex Wong/Getty Images)
""She’s just trying to get a little nasty because she came in third place. She wanted to come in second. And she wasn’t even that close, actually, to second. You know, I have to give that to Ron De-sanctimonious,"" Trump said, referring to his penchant for coming up with nicknames for his opponents. Most recently, Trump referred to Haley – the daughter of Indian immigrants – as ""Nimbra,"" referring to her birth name of ""Nimrata.""
FORMER TRUMP ATTORNEY SAYS IT'S ‘ABSOLUTELY’ POSSIBLE FORMER PRESIDENT IS CONVICTED
Haley earned 21,085 caucus votes, or just under 20% in Iowa, putting her behind second-place finisher Florida Gov. Ron DeSantis, who had 23,420 votes, or 21.2%. Trump trounced all of his challengers, winning an outright majority at 51%, with 56,260 votes in a historic caucus victory that resoundingly confirmed his frontrunner status.
That frontrunner status was further cemented later Sunday when DeSantis dropped out of the presidential race and endorsed Trump.
Nikki Haley, former ambassador to the United Nations and 2024 Republican presidential candidate, during a campaign event in Bretton Woods, New Hampshire, on Tuesday, Jan. 16, 2024. (Adam Glanzman/Bloomberg via Getty Images)
Responding to Haley’s assertion that Trump’s political indictments have become a liability on the campaign trail, Trump dismissed them as ""Biden indictments.""
""He is bad for democracy … He is very dangerous,"" Trump said of his Democratic rival in the White House. ""He can’t win fair and square. The guy can’t put two sentences together.""
Trump also took shots at Fani Willis, the Fulton County District Attorney who was accused of having an improper romantic relationship with special prosecutor Nathan Wade, whom she appointed to prosecute the election interference case against the former president.
""They did this. This is all political stuff, and it’s a very bad thing for our country,"" Trump said. ""And remember, that goes the other way too. If a Republican gets in … they can do the same thing to a Democrat.""
On the question of a potential pick for vice president, Trump said: ""There’s no rush to that.""
CLICK HERE TO GET THE FOX NEWS APP
New Hampshire’s first-in-the nation primary comes Tuesday, January 23 – just two days after Florida Gov. Ron DeSantis announced he was suspending his campaign.
Bradford Betz is a Fox News Digital breaking reporter covering crime, political issues, and much more."
06PKJR94YA_80IZT18QFNVK6LW,Texas DPS announces discovery of dead migrant who attempted to cross Rio Grande,By Landon Mion Fox News,"Published January 21, 2024 2:43am EST",20240121,foxnews.com,https://www.foxnews.com/us/texas-dps-announces-discovery-dead-migrant-who-attempted-cross-rio-grande,"Criminal defense attorney Brian Claypool and Tammy Nobles, the mother of a murder victim, join ‘Fox News Live’ to discuss her testimony in the DHS Secretary Alejandro Mayorkas impeachment hearing and her lawsuit against the DHS and HHS.
The Texas Department of Public Safety said an illegal immigrant was found dead on Saturday after attempting to cross the Rio Grande in Eagle Pass.
The department's Tactical Marine Unit recovered an unidentified deceased man from a shallow portion of the river south of Shelby Park at about 2:30 p.m., Texas DPS spokesperson Lt. Chris Olivarez wrote on X, the platform formerly known as Twitter.
""Another tragedy from crossing the dangerous Rio Grande in Eagle Pass,"" Olivarez wrote.
There have been roughly 2,300 illegal immigrant deaths in the last three years from drownings, heat exhaustion, vehicle accidents or hazardous conditions attributed to human smuggling and harsh environmental conditions, according to Olivarez.
ABBOTT SAYS CLAIMS TEXAS ALLOWED MIGRANTS TO DROWN IN RIO GRANDE ARE FALSE: 'THEY FORGOT THE FACTS'
The Texas Department of Public Safety said an illegal immigrant was found dead on Saturday after attempting to cross the Rio Grande in Eagle Pass. (Texas DPS)
Texas is using every preventive measure to deter illegal border crossings, Olivarez said. He said this type of preventative action ""requires a federal response to apply consequences & enact current laws to prevent anyone from crossing the river.""
This comes after three migrants – a woman and two children – drowned just over a week ago in the Rio Grande. Federal officials and U.S. Rep. Henry Cuellar, D-Texas, initially claimed the state was responsible for the deaths of the three migrants following accusations that the Texas Military Department had denied Border Patrol access to Shelby Park to help six migrants in distress.
But an investigation by the Texas Military Department determined the accusations were ""wholly inaccurate"" and that the drownings had already happened by the time Border Patrol requested access to the area.
""At the time that Border Patrol requested access, the drownings had occurred, Mexican Authorities were recovering the bodies, and Border Patrol expressed these facts to the TMD personnel on site,"" the TMD said in a news release last week.
DHS CLAIMS BORDER PATROL BLOCKED BY TEXAS FROM ENTERING AREA TO RESCUE MIGRANTS WHO LATER DROWNED
Texas DPS' Tactical Marine Unit recovered an unidentified deceased man from a shallow portion of the river south of Shelby Park. (Texas DPS)
CLICK HERE TO GET THE FOX NEWS APP
The Texas Military Department said its soldiers were in direct communication with Border Patrol on Jan. 12 when it requested access to Shelby Park upon learning of distressed migrants. Soldiers said they told Border Patrol when it requested access that Mexican authorities had already recovered the bodies of two drowned migrants.
Border Patrol specifically requested access to the park to secure two additional migrants who were presumed to have traveled with the ones who had died, but had crossed to the boat ramp, the press release said. Two migrants were apprehended by the Texas Military Department, with one turned over to the Department of Public Safety and the other transferred to EMS for initial hypothermic conditions.
The soldiers then continued to use lights, night vision goggles and thermals to ensure no more migrants were in the river or in distress, according to the press release."
0UGGD8REFS_EBKFCE8DMW8MW2F,Critics mock Tim Scott's 'delivery' while endorsing Trump: 'Embarrassed for him',By Hanna Panreck Fox News,"Published January 21, 2024 5:00pm EST",20240121,foxnews.com,https://www.foxnews.com/media/critics-mock-tim-scotts-delivery-while-endorsing-trump-embarrassed-him,"Scott told Fox News during a Trump 2024 presidential primary rally in New Hampshire on Friday night that now is the time for Republicans to unite and get behind Trump and fire Joe Biden.
Critics mocked Sen. Tim Scott, R-S.C., over his ""delivery"" of his endorsement during a rally for former President Trump on Saturday and said they were ""embarrassed"" for him.
""We need a president who understands the American people are sick and tired of being sick and tired, we need,"" Scott said as the crowd responded, ""Donald Trump.""
""Senator Tim Scott endorses Donald Trump and uh, the delivery was a choice,"" CNN reporter Omar Jimenez posted to social media. Jimenez joined ""CNN This Morning"" on Saturday and said the Trump campaign wanted to play up Scott's endorsement.
""It's quite the delivery,"" Jimenez said. ""Now, remember that Nikki Haley was the person who appointed Tim Scott to the Senate, and so this happening, of course, in the way that it did is a major blow to the former South Carolina governor. And they easily could have chosen to do this before the South Carolina primary.""
CNN's Omar Jimenez joined ""CNN This Morning"" on Saturday to discuss Sen. Tim Scott's endorsement of Donald Trump. (Screenshot/CNN)
RON DESANTIS ARGUES TIM SCOTT ENDORSEMENT OF DONALD TRUMP IS ‘A BLOW' TO NIKKI HALEY
Critics responded to Jimenez' social media post, including The Nation writer Elie Mystal, who shared a GIF of Samuel L. Jackson's character Stephen from ""Djano Unchained"" and said, ""everybody saw that coming.""
Others took issue with Scott's words, where he appeared to quote civil rights activist Fanie Lou Hammer, who famously said, ""I am sick and tired of being sick and tired.""
""I hope Fannie Lou Hamer's ghost haunts him terribly for the rest of his natural life,"" Franklin Leonard, who founded The Black List, wrote on social media.
Frequent MSNBC guest and Vanity Fair correspondent Molly Jong-Fast responded to the video posted to social media and said, ""I feel embarrassed for him.""
HuffPost opinion editor Stephen Crockett Jr. likened the video to a ""WWE audition tape.""
HALEY TURNS UP THE HEAT ON TRUMP AS SHE TRIES TO CLOSE THE GAP WITH THE GOP FRONT-RUNNER
The Hollywood Reporter's Kim Masters called Scott a ""sellout.""
""We need, you see, we need a president who doesn't see Black or White. We need a president who sees Americans as one American family,"" Scott said during the New Hampshire rally. ""And that's why I came to the very warm state of New Hampshire to endorse the next president of these United States, President Donald Trump.""
Fox News Digital has reached out to Sen. Scott's office for comment.
Following the rally, Scott said in a Fox News interview that ""it's time for us to unite our party so that we make sure that the only target we're talking about is firing Joe Biden. Our country can't take four more years. I'm not sure we could take ten more months. The best way for us to get rid of Joe Biden as our president is to unite our party now behind Donald Trump.""
Scott was criticized after endorsing the former president by fellow Republicans, including New Hampshire Gov. Chris Sununu, who has endorsed GOP candidate Nikki Haley.
""Tim Scott actually just looked in the camera and said ‘Donald Trump’s going to unite the country.’ Not even Donald Trump believes that statement,"" Sununu told Fox News’ Neil Cavuto.
""Nobody thinks Donald Trump’s united the country,"" he said.
Senator Tim Scott, a Republican from South Carolina, right, speaks while standing next to former US President Donald Trump during a campaign event in Concord, New Hampshire, US, on Friday, Jan. 19, 2024.  (Photographer: Al Drago/Bloomberg via Getty Images)
CLICK HERE TO GET THE FOX NEWS APP
Gov. Ron DeSantis officially dropped out of the race on Sunday and announced in a video posted to X that he would also endorse the former president.
Hanna Panreck is an associate editor at Fox News."
169SXEV3JB_BHZUMUCPMK0HQ7L,Cartel human smuggling business is turning entire border towns into war zones,By Luis Chaparro Fox News,"Published January 21, 2024 12:51pm EST",20240121,foxnews.com,https://www.foxnews.com/world/cartel-human-smuggling-business-turning-entire-border-towns-war-zones,"Video shows Mexican national guard in shootout with cartels in Sonoyta, Sonora on Dec 29, 2023. (Video: @Michelle Rivera on X.)
CIUDAD JUÁREZ – Mexican drug cartels are making millions in profits from the hundreds of thousands of migrants arriving at the U.S.-Mexico border and are now turning entire border towns into war zones.
The money left by the migrants trying to get across the border wall from Mexico into the U.S. to criminal organizations that are charging to guide them across, extorting them or kidnapping them is creating a multimillion-dollar illegal business. Now the different criminal organizations operating across the border are fighting to death for a piece of the pie.
From small towns like Sonoyta, across the border from Lukeville, Arizona, to entire cities like Ciudad Juárez, across the river from El Paso, Texas, different cartels are killing each other and challenging Mexican authorities to gain control of the smuggling routes.
In a video from Dec. 29 shared online from Sonoyta, Sonora in northern Mexico, an SUV with several armed men around it is set on fire during a violent gunfight between alleged members of a local criminal organization with ties to the Sinaloa Cartel and the Mexican army, according to local news outlets.
MEXICAN CARTEL BASES USED TO SPY ON ENEMIES, DISPATCH HITMEN
A group of migrants walks to a van as hundreds of migrants gather along the border Dec. 5, 2023, in Lukeville, Arizona. (AP Photo/Ross D. Franklin)
The gunfight lasted for several hours, according to Sonora state authorities. The gunmen used AK-47s and AR-15s to fight authorities. After the gunfight, only five of over a dozen henchmen were captured, according to authorities.
Several videos from the same gunfight were shared online by locals where sicarios are seen firing their weapons at authorities barely managing to stay put. The main international bridge between Sonoyta and Lukeville remained closed for days after the incident, according to Customs and Border Protection (CBP) authorities.
""This last one (shooting) was probably the most publicized because the videos made it to mainstream news, but it is not the first one. This is all because of the amount of migrants arriving to this town,"" Joel Pérez, a local Sonoyta resident, told Fox News Digital.
DEADLY CARTEL DRONE ATTACK STRIKES REMOTE MEXICAN VILLAGE
Mexican federal troops in shootout with cartels in Sonoyta, Sonora. Lukeville, Arizona, sits right across the border. (Screenshot: @Michelle Rivera on X)
A few weeks back, on Dec. 4, the same bridge was closed for a full day by U.S. authorities regarding a large number of migrants arriving at the border and overwhelming U.S. border authorities' capacities.
The Tucson sector, where Lukeville sits, is one of the busiest sectors on the southern border, recording over 300,000 migrant crossings in FY 2023 alone.
On Jan. 2 in the Mexican border state of Tamaulipas, 31 migrants were kidnapped by a convoy of cartel members while riding a bus heading toward the city of Matamoros, across the border from Brownsville.
The group was stopped in the middle of the night on a highway by armed men who ordered them to get off the bus and board several pickup trucks. The migrants had to pay over $2,000 each to be released, according to Mexican news outlets that obtained proof of the ransom. The group was freed 24 hours later.
MEXICAN CARTELS FORCE LOCALS TO COVER BOOTLEG WI-FI COSTS UNDER THREAT OF DEATH
Migrants wait to be processed by the U.S. Border Patrol on Aug. 6, 2022, in Yuma, Arizona. (Qian Weizhong/VCG via Getty Images)
A cartel member in Ciudad Juárez, across El Paso, Texas, who oversees human smuggling operations for a local criminal gang, said that over the past two years the illegal business around immigration has become ""more profitable than ever before"".
""No one wants to work on anything else right now. Everyone wants to work with the migrants because you can make a lot of money from it these days and it is easy work,"" the cartel member told Fox News Digital, at the request of remaining anonymous.
""Right now it is more profitable to smuggle migrants than to traffic bricks of cocaine, and with less risk if you get caught,"" he said.
Migrants can be seen from Ciudad Juarez, Mexico, lining up after being detained by U.S. immigration authorities at the border wall, Dec. 27, 2023. (AP Photo/Christian Chavez)
The attorney general in Chihuahua, César Jáuregui, where Ciudad Juárez is located, also said the city is ""[experiencing] a spike in homicides"" as a direct consequence of the number of migrants arriving to the city and the illegal business around them.
""Criminals are finding a profitable business in migrants and abusing them to bleed more money from them, and this is increasing as more large numbers [of migrants] keep arriving in the city or transiting along the state,"" Jáuregui said.
MEXICAN SOLDIERS FIND FACTORY PRODUCING DRONE BOMBS, GRENADE LAUNCHERS, FAKE MILITARY UNIFORMS
Migrants are seen camped out near Lukeville, Arizona, Dec. 5, 2023. (Fox News)
Overall the U.S.-Mexico border had record-setting numbers during 2023 for migrant apprehensions, with more than 225,000 in the first 27 days of December, according to U.S. Border Patrol statistics.
""It is cruel that we have to go to criminals to help us navigate through the border or get killed, we come running from very similar situations in our countries, only to find more of that here in Mexico,"" Alfonso Robles, a Venezuelan migrant in Ciudad Juárez told Fox News Digital.
Robles left Venezuela after a local gang began extorting his small business, threatening to kill him. He traveled from Venezuela to the U.S.-Mexico border along with his wife and his 7-year-old daughter.
""As soon as we entered Mexico they started to extort us, or try to kidnap us. Right now we don’t know what else to do because the (U.S.) government is not allowing us to get into the United States and wait there, but here, it's only a question of time before a criminal group finds us and takes us,"" Robles said.
The border crossing was closed on Dec. 15, 2023, at Lukeville, Arizona. (AP Photo/Gregory Bull/File)
CLICK HERE TO GET THE FOX NEWS APP
The same cartel member in Ciudad Juárez confirmed that two gangs, one affiliated with the Juarez cartel and another with Sinaloa Cartel, are fighting for the human smuggling business, and that the turf war has extended to U.S. border cities.
""This business is not only on this (Mexican) side of the border, it is also leaving millions in the U.S. to American smugglers, so they are also fighting for this business over there,"" the smuggler said.
Luis Chaparro is a freelance journalist based at the US-Mexico border covering criminal organizations in Latin America.He can be followed on Twitter @luiskuryaki"
1DJC6SA2UR_PE73NOARB8EZEK0,Former Trump attorney says it's 'absolutely' possible former president is convicted,By Stephen Sorace Fox News,"Published January 21, 2024 2:21pm EST",20240121,foxnews.com,https://www.foxnews.com/politics/former-trump-attorney-says-its-absolutely-possible-former-president-convicted,"Fox News contributor Andy McCarthy breaks down the collision of Trump court cases and his 2024 campaign on 'America Reports.'
Former Trump attorney Joe Tacopina on Sunday said that while there may be a ""political bent"" to some of the criminal indictments that former president is facing, it is ""absolutely"" possible that he could be convicted.
Tacopina, who withdrew from Trump’s legal team last week, was asked about the likelihood of a jury convicting the former president during an appearance on MSNBC’s ""Politics Nation.""
""Is it possible? Absolutely,"" Tacopina responded. ""You have a jury of twelve who’s going to ultimately decide this.""
""Do I think there’s a political bent to some of this, the way it’s gone about?"" he questioned. ""Yes, I do. Do I think these cases are invalid cases? Look, a grand jury voted to indict. You can’t say there’s no way he’ll get convicted or no way he’ll be sentenced. You just can’t say that.""
LAWYER IN TRUMP DEFAMATION CASE WON'T INTRODUCE ‘ACCESS HOLLYWOOD’ TAPE AHEAD OF POSSIBLE TESTIMONY
Joe Tacopina, Donald Trump's former lawyer, says that it is ""absolutely"" possible that the former president can be convicted after he was indicted four times last year. (AP Photo/Seth Wenig, File)
Trump was indicted four times last year, including for alleged election interference in Georgia and in New York City for allegedly falsifying business records.
He was also indicted on multiple felony counts for the alleged improper retention of classified records from his time in the White House at his Mar-a-Lago home in Palm Beach, Fla., and four federal charges related to the Jan. 6 Capitol riot in Washington, D.C.
Trump, pictured gesturing to a crowd after speaking during a campaign event in Manchester, N.H., on Saturday, is leading in the polls for the Republican presidential nomination. (AP Photo/Matt Rourke)
MAINE OFFICIAL APPEALS HER REMOVAL OF TRUMP FROM VOTING BALLOTS TO STATE'S TOP COURT
Last week, Trump appeared in Manhattan civil court for a defamation suit brought by writer E. Jean Carroll, who alleges that Trump raped her at a department store. Trump denied the claim repeatedly, leading Carroll to sue him for defamation, arguing that his denial had harmed her reputation.
CLICK TO GET THE FOX NEWS APP
Despite the numerous legal issues Trump is facing, he continues to lead in the polls for the Republican nomination for president."
1QPM1YO3DM_11XUL02L4X4MUKP,New Hampshire protester removed from Trump rally after rushing stage,By Sarah Rumpf-Whitten Fox News,"Published January 20, 2024 9:51pm EST",20240121,foxnews.com,https://www.foxnews.com/politics/new-hampshire-protester-removed-trump-rally-rushing-stage,"Former President Donald Trump was interrupted by a protester, who attempted to join Trump onstage, during a rally in Manchester, New Hampshire on Saturday, Jan. 20.
A protester at a Donald Trump rally in New Hampshire was immediately escorted out after interrupting the event and trying to join the former president onstage.
""Who is this? Is this a friend,"" Trump asked during a rally in Manchester, New Hampshire on Saturday night.
Video from the rally showed a man who was wearing a black sweatshirt, reading ""Kelly's Roast Beef,"" who yelled indecipherable phrases at the former president.
""Get out of here. Get out of here,"" Trump yelled. ""You can throw him out.""
ASA HUTCHINSON SHARES SUPPORT FOR NIKKI HALEY AHEAD OF NEW HAMPSHIRE PRIMARY, SAYS TRUMP TRYING TO ‘DIVIDE'
Local law enforcement officers escort an unidentified man out of the venue during a campaign event for Republican presidential candidate former President Donald Trump in Manchester, N.H., Saturday, Jan. 20, 2024. (AP Photo/Matt Rourke)
Republican presidential candidate former President Donald Trump on stage during a campaign event in Manchester, N.H., Saturday, Jan. 20, 2024.  (AP Photo/Matt Rourke)
According to video from the rally, as Secret Service personnel and local Manchester police approached the agitator, the man looked like he was about to grab his jacket, but turned to walk quickly towards the stage.
A Secret Service member, who was stationed beneath the staircase, stopped the protester in his tracks and the man was promptly arrested.
As the man was being escorted out of the arena, Trump supporters booed and chanted, ""USA, USA"" at the protester.
""Well, now we know that politics is getting serious, so now we know we're getting serious,"" Trump said as the protester was being escorted out. ""Now he's just a disturbed person.""
Local law enforcement officers escort an unidentified man out of the venue during a campaign event for Republican presidential candidate former President Donald Trump in Manchester, N.H., Saturday, Jan. 20, 2024. (AP Photo/Matt Rourke)
The Republican presidential frontrunner said that protesters are only interrupting because ""we're leading,"" alleging that billionaire George Soros pays the protesters at the rallies.
""Remember that this used to happen all the time. But now, probably, we're really now in the political season,"" Trump said. ""And a lot of those guys, by the way, are paid by Soros. So these people, you know, are troublemakers.""
TRUMP MIXES UP NIKKI HALEY WITH NANCY PELOSI AT NEW HAMPSHIRE RALLY
""This is only happening because of all the weaponization, because we're leading,"" he continued.
Supporters reacting to seeing Republican presidential candidate former President Donald Trump during a campaign event in Manchester, N.H., Saturday, Jan. 20, 2024. (AP Photo/Matt Rourke)
Trump, who is running a third straight time for the White House, grabs 52% support among those likely to vote in next Tuesday's New Hampshire GOP presidential primary, according to a Friday poll released by Suffolk University, the Boston Globe and NBC10 in Boston.
CLICK HERE TO GET THE FOX NEWS APP
Haley, who served as ambassador to the United Nations during the Trump administration, stands at 35%, with her support edging up two points since Wednesday's survey.
DeSantis remained a distant third at 6% for the second straight day.
Get the latest updates from the 2024 campaign trail, exclusive interviews and more at our Fox News Digital election hub.
Sarah Rumpf-Whitten is a breaking news writer for Fox News Digital and Fox Business.
She is a native of Massachusetts and is based in Orlando, Florida.
Story tips and ideas can be sent to sarah.rumpf@fox.com and on X: @s_rumpfwhitten."
