UniqueID,Title,Author,PTime,DTime,MentionSourceName,MentionIdentifier,Content
DSJR66OIBP_U8ZZ2V5MYJQA1IE,Trump teases DeSantis over Fox interview about Iowa results: 'Short circuits',By Andrea Vacchiano Fox News,"Published January 20, 2024 9:53pm EST",20240121,foxnews.com,https://www.foxnews.com/politics/trump-teases-governor-ron-desantis-fox-interview-iowa-results-short-circuits,"2024 Republican presidential candidate Gov. Ron DeSantis joins ‘Your World’ to discuss the battle for New Hampshire.
Former President Trump joked about Florida Gov. Ron DeSantis ""short circuit[ing]"" during a tense interview on ""Your World"" Friday.
""Ron DeSanctimonious short circuits when confronted with the fact he didn’t win a single county in Iowa,"" Trump wrote on Truth Social.
The former president posted an interview that Fox News host Neil Cavuto conducted with DeSantis.
TIM SCOTT ENDORSES DONALD TRUMP AHEAD OF NEW HAMPSHIRE'S PRIMARY
""You look at Iowa. Um, you know, we did it, right?"" DeSantis said during the program. ""I mean, we got the endorsement of the governor. We won the debates, the Miami debate, the Newsom debate, the NewsNation debate, the CNN debate. We did televised town halls, you know, got a great response.""
Former President Trump joked about Florida Gov. Ron DeSantis ""short circuit[ing]"" during a tense interview on ""Your World"" Friday. (AP Photos)
""But you didn't win a single county, right?"" Cavuto responded. ""I mean… You didn't win a single one. You visited them all, to your credit, but you didn't win a single one.""
""But I also had, I mean, you know, how many people would have been able to handle $50 million in ads?"" DeSantis fired back. ""How many people would have been able to handle all the headwinds we did? I mean, we had a very uphill battle.""
""We dug in and we executed, and we did run hard. We did do well,"" he added.
On Saturday, DeSantis abruptly canceled two Sunday appearances planned for NBC’s ""Meet the Press"" and CNN’s ""State of the Union"" with Jake Tapper, and is headed to New Hampshire for Tuesday's presidential primary.
RON DESANTIS ARGUES TIM SCOTT ENDORSEMENT OF DONALD TRUMP IS ‘A BLOW' TO NIKKI HALEY
Republican presidential candidate Donald Trump on stage during a campaign event in Manchester, N.H., Saturday.  (AP Photo/Matt Rourke)
""The media hits were canceled due to a scheduling issue and will be rescheduled,"" DeSantis press secretary Bryan Griffin posted on X.
At his Saturday night rally in Manchester, New Hampshire, Trump took the opportunity to criticize the DeSantis.
""In short, if you want a losing candidate who puts America last, vote for either one of them: Nikki Haley or Ron DeSantis,"" Trump said to the crowd.
CLICK HERE TO GET THE FOX NEWS APP
Republican presidential candidate and Florida Gov. Ron DeSantis speaks to supporters during a campaign rally in Nashua, N.H.  (Brandon Bell/Getty Images)
Fox News Digital reached out to the DeSantis campaign for comment.
Fox News Digital's Brie Stimson contributed to this report.
Get the latest updates from the 2024 campaign trail, exclusive interviews and more at our Fox News Digital election hub.
Andrea Vacchiano is a breaking news writer for Fox News Digital and Fox Business. You can follow her on X at @andrea_vacch or send story tips to andrea.vacchiano@fox.com."
E7XYV1TC7C_4XJQ4B8CWS8YYAR,"Biden's bogus border deal, the Stanley Tumbler trend, and more from Fox News Opinion",By Fox News Staff Fox News,"Published January 21, 2024 11:00am EST",20240121,foxnews.com,https://www.foxnews.com/opinion/biden-bogus-border-deal-stanley-tumbler-trend-more-fox-news-opinion,"Fox News host Laura Ingraham breaks down the fallout from President Biden's 'disastrous open border policies' on 'The Ingraham Angle.'
LAURA INGRAHAM – Fox News host breaks down the fallout from President Biden's 'disastrous open border policies'. Continue watching…
HUGH HEWITT – No Border Wall, no deal on Israel and Ukraine. Continue reading…
BOONDOGGLE BUST – Biden's trillion dollar climate agenda is blowing up and John Kerry has a lot to answer for. Continue reading…
GUTFELD – The Feds asked US banks to spy on Republicans using search terms like 'Trump' and 'MAGA'. Continue watching…
TAMMY BRUCE – The fraud and death of feminism will be complete in 2024. Continue reading…
RAYMOND ARROYO – Hunter Biden gets dusted in federal court. Continue watching…
TURN UP THE HEAT – Don't ignore the health benefits of being warm. Continue reading…
KAROL – I'm here to defend Gen Alpha tweens and their skincare routines. Continue reading…
OH, STANLEY – This mom is using the Stanley Tumbler trend to teach my kids to be rebels. Continue reading…
CARTOON OF THE DAY – Check out all of our political cartoons…
01.18.24
This article was written by Fox News staff."
FPU1N6ZCRL_854E28626XKIY23,JD Vance predicts Haley wouldn’t survive Dem attacks if elected nominee: ‘Baggage’,By Emma Colton Fox News,"Published January 21, 2024 1:22pm EST",20240121,foxnews.com,https://www.foxnews.com/politics/jd-vance-predicts-haley-wouldnt-survive-dem-attacks-elected-nominee-baggage,"Sen. JD Vance, R-Ohio, joins ‘Fox News Sunday’ to weigh in on the new poll revealing that Trump is leading Haley by 19% in New Hampshire.
Republican Ohio Sen. JD Vance argued 2024 presidential candidate Nikki Haley would likely be unable to survive Democratic attacks if elected the party's nominee, saying she's ""the candidate that Democrats haven't teed off on.""
""Nikki does have baggage. She just hasn't faced the onslaught of years of media attacks, of super PAC attacks that Donald Trump has faced. And frankly, the fact that Trump is still standing and still leading in the polls against Joe Biden suggests he has real political resilience,"" Vance told Fox News' Shannon Bream on ""Fox News Sunday.""
Bream aired a clip of her asking New Hampshire voters who they supported ahead of the Granite State's primary on Tuesday, with one woman explaining she's voting for Haley because she has ""no baggage."" Vance, who is serving as a surrogate for the Trump campaign, pushed back that Haley does have ""baggage,"" but Democrats have not attacked her, as they have Trump, in recent years.
FIRST ON FOX: TRUMP ALLY SEN JD VANCE ENDORSES IN OHIO’S 2024 GOP SENATE PRIMARY, BACKING BERNIE MORENO
Ohio Sen. JD Vance joins ""Fox News Sunday"" ahead of the New Hampshire primary. (Fox News Digital )
""I know a lot of people who are choosing Nikki Haley think she's the low baggage candidate. In reality, she's the candidate that Democrats haven't teed off on, but they will tee off on her if she's the nominee,"" Vance said, adding that Haley ""won't be"" the nominee.
TRUMP MAINTAINS MASSIVE LEAD IN NEW HAMPSHIRE DAYS AHEAD OF FIRST PRIMARY: POLL
""But if she is [the nominee], she will face exactly what Donald Trump has faced for the past six years, and I don't think she'll survive, and I certainly don't think she'll win the presidency through it. That's why we need to elect the guy who's shown some resilience. That's why we need to nominate Donald Trump,"" he said.
Trump solidified himself as the Republican frontrunner for 2024 last week, when he handily won the first-in-the-nation Iowa caucuses. He is now focusing on the New Hampshire primary on Tuesday.
Kimmel wondered if when Trump is ""dead,"" things will be ""better"" in the country.  (Sean Rayford/Getty Images)
While some polls, such as one published by American Research Group Inc., showed Haley and Trump tied for support, others have shown Trump with a stronger advantage over the former South Carolina governor.
HALEY TURNS UP THE HEAT ON TRUMP AS SHE TRIES TO CLOSE THE GAP IN THE NEW HAMPSHIRE PRIMARY
Vivek Ramaswamy endorses former US President Donald Trump during a campaign event in Atkinson, New Hampshire, on Jan. 16, 2024. (Timothy A. Clary/AFP via Getty Images)
Trump has 55% support among those likely to vote in the primary, compared to Haley's 36% support and DeSantis' 6% support, a Suffolk University, the Boston Globe and NBC10 poll found.
Bream cited the Suffolk poll, as well as a CNN poll that found Trump has 50% support to Haley's 39%, and noted to Vance that many voters in New Hampshire are undeclared, but vote in the GOP primary.
TRUMP SAYS NIKKI HALEY 'HAS NO CHANCE' AHEAD OF NEW HAMPSHIRE PRIMARY: 'MAGA IS NOT GOING TO BE WITH HER'
""There are a couple of newspaper editorials today endorsing Nikki Haley, telling people if you're independent get out, ‘save the country and vote in that GOP primary.’ I mean, that's a substantial group of people here. How concerned are you about them showing up and not choosing President Trump on Tuesday?"" Bream asked.
Former U.N. Ambassador Nikki Haley taking the stage at CPAC 2023. (Getty)
Vance responded that liberals who recently moved out of Massachusetts to New Hampshire would ""never"" vote for a Republican nominee – whether they be Trump or Haley - and are instead ""trying to play spoiler to Donald Trump"" and his primary race.
""I think a lot of them are going to vote for Donald Trump and also liberal… many of them from Massachusetts who are moving to New Hampshire, they're never going to vote for a Republican nominee, even if it's Nikki Haley,"" Vance said.
CLICK HERE TO GET THE FOX NEWS APP
""They're just trying to play spoiler to Donald Trump. But I think Republicans really have to ask ourselves, do we want liberal suburbanites from Massachusetts to choose our nominee? Or do we want to choose our nominee as Republicans and independent-minded conservatives? I think if we choose our nominee, Donald Trump is going to win, and he's going to win handily,"" Vance added.
Get the latest updates from the 2024 campaign trail, exclusive interviews and more at our Fox News Digital election hub."
GAAPDMMSLL_VX8YCQIFFVATA3L,'Sense of hopelessness': Michael McCaul sounds alarm on border patrol mental health crisis,By Elizabeth Elkind Fox News,"Published January 21, 2024 5:17pm EST",20240121,foxnews.com,https://www.foxnews.com/politics/michael-mccaul-sounds-alarm-on-border-patrol-mental-health-crisis,"House Foreign Affairs Committee Chairman Michael McCaul sat down with Fox News Digital in McAllen, Texas, a city on the U.S.-Mexico border, to discuss the migrant crisis. He led a bipartisan congressional delegation to the border over the weekend.
MCALLEN, Texas — House Foreign Affairs Committee Chair Mike McCaul said he’s ""profoundly"" alarmed at the impact the ongoing border crisis is having on Customs and Border Patrol (CBP) agents’ mental health.
The senior Republican spoke to Fox News Digital in the border city of McAllen, Texas, a bipartisan congressional delegation met with border and immigration officials while also touring facilities where migrants are brought and their asylum claims processed.
McCaul said the state of the border is ""just worse"" each time he’s seen it.
""Every time I come down here, it gets worse; the lack of detention space, the human tragedy you see here; what the Border Patrol has to deal with every day, day in and day out, looking at these migrants that are pouring in; this sense of hopelessness, that it won't stop,"" the Texas Republican said.
REPUBLICANS, DEMS SPAR AT MAYORKAS IMPEACHMENT HEARING AS STATE AGS DESCRIBE IMPACT OF MIGRANT CRISIS
House Foreign Affairs Committee Chair Michael McCaul spoke with Fox News Digital in the border city of McAllen, Texas, over the weekend. (Elizabeth Elkind)
""Profoundly, I worry about the mental health of our border patrol. The suicide rate is going up. They don't have the proper resources.""
Seventeen CBP agents died by suicide in 2022 alone, Chris Cabrera, vice president of the National Border Patrol Council, told Congress in March 2023. That’s the highest number since CBP began tracking it in 2007. There were 19,357 CPB agents on the job in 2022.
Since then, the number of migrant encounters at the border has continued to see historic highs, most recently this past December, while CBP has struggled somewhat to replenish its retiring forces.
REPUBLICANS MOVE FORWARD WITH MAYORKAS IMPEACHMENT AMID EMOTIONAL TESTIMONY: DEMS DECRY ‘MAGA SPECTACLE’
A Border Patrol union official said these discarded ladders were used by migrants to scale a 15-foot wall on the border just feet from where this photo was taken. (Fox News Digital)
McCaul said the cartels on the other side of the border that are bringing a constant flow of drug and human trafficking are better equipped, in some ways, than the federal officials patrolling on the U.S. side.
""For instance, we only have 20 drones here in the Rio Grande Valley sector, and the cartels are way out numbering us. And that's just eyes and ears on the ground,"" McCaul said. ""So, we're not equipping them. But most importantly, more than money, is just the lack of policy.""
Cabrera spoke to the media during his recent border visit, describing what he said were regular instances of officers getting overwhelmed.
MEXICAN SOLDIERS FIND FACTORY PRODUCING DRONE BOMBS, GRENADE LAUNCHERS, FAKE MILITARY UNIFORMS
A hole in a fence near the U.S.-Mexico border is what National Border Patrol Council spokesperson Chris Cabrera said migrants would use after entering the U.S. illegally. (Elizabeth Elkind)
CLICK HERE TO GET THE FOX NEWS APP
""There’s times when you’re out there, two, three agents, and you’ll have 100 people there,"" he said.
""But then you also have the medical emergencies: pregnant women, dehydration, kids with illnesses, people that have broken legs along the journey. And then we have people that fall off the wall. So, while we’re dealing with two, three hundred people, or 50 people, you’re also having to deal with medical emergencies and issues like that.""
Elizabeth Elkind is a reporter for Fox News Digital focused on Congress as well as the intersection of Artificial Intelligence and politics. Previous digital bylines seen at Daily Mail and CBS News.
Follow on Twitter at @liz_elkind and send tips to elizabeth.elkind@fox.com"
GOHP7AP0P9_RYARSSBM8MADAB1,Squatter pirates in Florida setting up homes on abandoned boats,By Emma Colton Fox News,"Published January 21, 2024 4:00am EST",20240121,foxnews.com,https://www.foxnews.com/us/squatter-pirates-florida-setting-homes-abandoned-boats,"A suspected squatter who was allegedly illegally living in a Florida home and using the owner’s car was spotted on video staking out other homes before his arrest, video obtained by Fox News Digital shows.
Squatters in Florida are increasingly moving into derelict boats dumped along the coast, according to authorities working to clear the boats and squatters.
""We’ve seen a tremendous increase, actually, throughout the county,"" Martin County Sheriff’s Office Lt. Michael Dougherty told local media last week. ""You’ll have vagrants squatting on the boat, it falling apart, there have been several instances where the boats have come loose and ran into the docks.""
The Martin County Sheriff’s Office says it has long dealt with derelict boats left to rot along the Florida coast, but now, authorities say homeless individuals are increasingly taking up residence on the boats. The county is situated along Florida’s southeastern coast and includes cities such as Jupiter Island and Jensen Beach.
Authorities cite cost of living issues for the increase of squatters and homeless people moving onto the boats. Derelict boats are defined as vessels found in waterways with at least two violations, which can range from having not motor to leaking fuel. Dumping derelict boats is a state crime that could lead to jail time or fines.
FLORIDA POLICE DISMANTLE SQUATTERS' BOOBY-TRAPPED 'METH ISLAND'
A derelict boat is removed by the Martin County Sheriffs Office. Derelict boats have long been an issue in the area, officials say, but squatters and homeless people are increasingly moving onto the vessels. (Martin County Sheriffs Office )
County commissioners recently amended an ordinance that gives more power to law enforcement and the harbormaster to remove such boats. Boats ruled derelict can now be tagged by authorities, who then contact the boat’s owner, NBC Miami reported. If no action is taken in 21 days, authorities can dispose of the boat - which comes at a big cost for taxpayers.
""It can be anywhere from $6,000 and upwards,"" Dougherty told the outlet. ""Astronomical amounts of money.""
The boats and squatters have also had negative impacts on businesses that rely on showing tourists Florida’s waterways and beaches.
SQUATTERS TURNING FLORIDA NEIGHBORHOOD INTO 'NIGHTMARE' AS COPS LEFT 'HANDCUFFED': REPORT
""This time of year is our busiest … with the snowbirds making their way down,""Giles Murphy, who owns Stuart Angler Bait & Tackle, told WPTV. ""A lot of them are seeing these derelict boats and being like, 'What's up with these boats?' It's a real eyesore. The attraction of our waters to anglers to get out there and fish, and tourists and stuff, I mean, we need to keep it looking good.""
The Martin County Sheriff's Office is cracking down on derelict boats. (Martin County Sheriff's Office )
In addition to the derelict boats, the sheriff’s office has recently been dealing with abandoned boats that appear to have transported migrants to the U.S.
Florida, similar to other states across the nation, has been dealing with repeated instances of squatters moving into abandoned homes or forging documents to make it appear they own a home.
SQUATTER SPOTTED CRUISING IN HOMEOWNER'S CAR AFTER SETTING UP GAME ROOM
Roughly 160 miles up the coast from Martin County, squatters took over an area located near the Dunlawton Bridge in Port Orange, dubbed by social media commenters as ""Meth Island."" Squatters built makeshift wooden structures, including an elaborate four-story tree house, and other huts made out of what appeared to be old lumber and tree branches.
A tree house on an island near the Dunlawton Bridge in Port Orange, Florida, where squatters have built a camp. (Volusia Sheriff's Office)
They also installed a trampoline and appeared to be in the middle of constructing a pool on the island, footage of the scene published by authorities showed. To deter visitors, the squatters even allegedly outfitted the island with booby traps.
SQUATTERS TAKE OVER FLORIDA ‘METH ISLAND,’ BUILD ELABORATE TREE HOUSE AND INSTALL TRAMPOLINE
Authorities there began dismantling the sheds last June.
CLICK HERE FOR MORE US NEWS
While residents of a neighborhood in Winter Park, Florida, in September said squatters have created a ""nightmare"" situation and have not been evicted citing how the police department is ""handcuffed"" from doing anything. Additionally, an alleged squatter in Fort Myers, Florida, was arrested in November after making himself cozy in a private residence, including setting up a PlayStation console in the bedroom and driving the homeowner's car."
