UniqueID,Title,Author,PTime,DTime,MentionSourceName,MentionIdentifier,Content
GO733A7L0T_E5QTOKJY3LN4J6X,Human rights activist Amjad Ayub Mirza says PoK govt in exile will be formed if demands are not met by February 5,India Blooms News Service,"21 Jan 2024, 11:10 pm",20240121,indiablooms.com,https://www.indiablooms.com/world-details/SA/41586/human-rights-activist-amjad-ayub-mirza-says-pok-govt-in-exile-will-be-formed-if-demands-are-not-met-by-february-5.html,"The humanitarian activist said it is not enough to reduce the taxes on electricity bills in POK or reduce the prices of wheat in Gilgit-Baltistan.
He asked the Pakistani government to withdraw its troops from PoK and PoGB.
The Tehreek-e Itefaq-e-Rai chairman was quoted as saying by ANI, “For eight months, the people of Pakistani-occupied Kashmir and Gilgit Baltistan have been protesting, taking out protest rallies, and observing protest sit-ins against the increase in the tariff of electricity in POK and against the cuts and increase in the prices of wheat.”
“However, up till now, several sets of negotiations have taken place, but to no avail. The government of Pakistan and the puppet governments in Gilgit Baltistan and POK are not confirming that they are going to reverse the electricity tariff or the increase in the prices of wheat,” he added.
“And now for the first time in the history of POK, Joint Awami Action Committee has announced that on February 5, they will observe a people’s rights day. p till now, every year for the past 33 years, Pakistan has been observing Kashmir Solidarity Day on the February 5 which in actuality has been used to muster and gear up hatred towards India,” Mirza said."
NWUXGYDMJ8_25QRFKSU8WIWY5F,Two Hezbollah members killed in Israeli drone strike,India Blooms News Service,"21 Jan 2024, 09:00 pm",20240121,indiablooms.com,https://www.indiablooms.com/world-details/F/41584/two-hezbollah-members-killed-in-israeli-drone-strike.html,"Several civilians were also wounded in the attack near a checkpoint of the Lebanese army, according to Elnashra.
Meanwhile, Hezbollah said its fighters targeted the Israeli gatherings at the sites of Zarit and al-Dhahira, confirming causing casualties among Israeli troops.
Ambulances rushed to the Israeli raid site to transfer casualties to nearby hospitals while fire brigades participated in putting out the attack-induced fire.
Confrontations on the Lebanon-Israel border continued on Sunday, with Israel's warplanes carrying out air raids on the southern Lebanese villages of Rmeish and Markaba and its heavy artillery targeting another Lebanese village of Aita al-Shaab.
The border witnessed increased tension since Oct. 8, 2023, after the Lebanese armed group Hezbollah fired dozens of rockets toward Israel in support of the Hamas attack on Israel the previous day, prompting Israel to respond by firing heavy artillery toward southeastern Lebanon.
The confrontations between Hezbollah and Israel have killed 227 on the Lebanese side, including 161 Hezbollah members and 37 civilians, according to Lebanese security sources.
(With UNI inputs)"
OL01ZW8RTV_O68TZBO1KJ6F70A,Fugitive rape accused Nithyananda says he will attend Ram Temple opening in Ayodhya on January 22,India Blooms News Service,"21 Jan 2024, 06:29 pm",20240121,indiablooms.com,https://www.indiablooms.com/news-details/N/94436/fugitive-rape-accused-nithyananda-says-he-will-attend-ram-temple-opening-in-ayodhya-on-january-22.html,"He said he will be attending the event.
On his Twitter handle, the self-styled godman wrote: ""'2 More Days Until the Inauguration of Ayodhya Ram Mandir!' 'Don't miss this historic and extraordinary event! Lord Rama will be formally invoked in the temple's main deity during the traditional Prana Pratishtha and will be landing to grace the entire world!"" he said.
"" Having been formally invited, THE SUPREME PONTIFF OF HINDUISM (SPH), BHAGAVAN SRI NITHYANANDA PARAMASHIVAM will be attending this grand event,"" he said.
Who is Nithyananda?
Nithyananda was arrested in 2010 in a rape case over a complaint filed by his driver in 2010.
He was later released on bail.
According to reports, the same driver claimed in 2020 that the self-styled godman has fled the country.
Nithyananda and Kaisala
He had created a fictional country named Kaisala.
Nithyananda’s 'Kailasa' derives its name from Mount Kailash in Tibet, which is considered a sacred site by Hindus. The place also has its own website which that was established as a haven for practicing, aspiring, or persecuted Hindus around the world.
According to Nityananda's X page, representatives of his fictional nation attended the World Economic Forum.:"
T23SN2WUCW_ZEWNMPWWTFXDJW6,"India-Bangladesh relations growing from strength to strength, says S Jaishankar",India Blooms News Service,"21 Jan 2024, 09:45 pm",20240121,indiablooms.com,https://www.indiablooms.com/news-details/N/94441/india-bangladesh-relations-growing-from-strength-to-strength-says-s-jaishankar.html,"The two leaders met on the sidelines of the NAM summit in Kampala.
Following the meeting, Jaishankar wrote on X: ""So glad to meet with my new Bangladesh counterpart FM Dr. Mohammed Hasan Mahmud in Kampala today. Congratulated him on his appointment and wished him all success.""
""India-Bangladesh relations are growing from strength to strength. Look forward to receiving him in Delhi soon,"" he said.
Bangladesh, this month, voted to elect Prime Minister Sheikh Hasina and her Awami League to power for yet another term.
Jaishankar also met Sri Lankan President Ranil Wickremesinghe and wrote on X: ""Pleased to call on Sri Lankan President @RW_UNP on the sidelines of the NAM Summit in Kampala. Appreciate his continued guidance for the advancement of our bilateral initiatives. India’s commitment is reflected in our Neighbourhood First and SAGAR policy.""
During his visit to Kampala, Jaishankar met several other top leaders at the sideline of the NAM summit."
WAMU6SLI9E_IFEI0XKRQLQ9P1L,Boy dies after Maldives President denies approval to his family for Indian aircraft emergency airlift: Report,India Blooms News Service,"21 Jan 2024, 10:23 am",20240121,indiablooms.com,https://www.indiablooms.com/news-details/N/94426/boy-dies-after-maldives-president-denies-approval-to-his-family-for-indian-aircraft-emergency-airlift-report.html,"A Dornier aircraft, produced by Hindustan Aeronautics Limited (HAL) and provided by India, has been used extensively in the island nation for humanitarian purposes.
The family of the teen, who is battling a combination of a brain tumour and a stroke, desperately sought an air ambulance to airlift him from the remote island of Wilmington in Gaaf Alif Villingili to Maldives capital Male, where he could have got advanced medical care, the report said.
The incident happened on Wednesday night when the child suffered a stroke, prompting his family to request an aerial transfer to the capital.
However, their distress calls went unanswered until Thursday morning, when the country's aviation authorities finally responded. The delay, reportedly lasting 16 crucial hours, sparked protests near the hospital in Gaaf Alif Villingili.
""We called Island Aviation to get him to Male immediately after the stroke but they did not answer our calls. They answered the phone at 8:30 am on Thursday. The solution is to have an air ambulance for such cases,"" the father told local media outlet Adhahu.
He was finally transferred to Male but by then the child's health was rapidly deteriorating. Upon arrival, the boy was immediately admitted to an Intensive Care Unit (ICU).
Aasandha Company Limited, the company responsible for medical evacuations, issued a statement indicating that they had initiated the evacuation process promptly upon receiving the request. However, they cited a last-minute ""technical glitch"", leading to a delay.
""It is with deep regret that we acknowledge the unfortunate passing of the patient involved in the emergency medical evacuation incident from GA Vilingili on January 18, 2024. The entire management and staff of Aasandha Company extend our heartfelt condolences to the bereaved family. Our thoughts and prayers go out to them, seeking solace in Allah (SWT) for the departed's eternal rest in Jannatul Firdaus,"" the company said in a statement.
Media Statement: Regarding the Emergency Medical Evacuation Incident from GA Vilingili on January 18, 2024 pic.twitter.com/4weAjLEPPA
Local Maldivian media reported protests outside the hospital where the child died.
""People shouldn't have to pay with their lives to satisfy the President's animosity towards India,"" Maldives MP Meekail Naseem posted on X.
The incident comes against the backdrop of strained diplomatic relations between India and Maldives.
The diplomatic ties between both countries hit a new low recently after Maldivian Minister Mariyam Shiuna’s disparaging comments on Prime Minister Narendra Modi as a ""clown"" and ""puppet"" in posts on X, which have since been deleted.
The tweets were removed following criticism and backlash on the micro-blogging site.
The row erupted also under the shadow of strained India-Maldives ties after President Mohamed Muizzu, who is seen as a pro-China politician, came to power."
Z6GOEYL3U2_PU2E4WYNHXIWHHY,Nirmala Sitharaman claims Tamil Nadu govt has bannned live telecast of Ayodhya Ram Mandir programmes,India Blooms News Service,"21 Jan 2024, 06:04 pm",20240121,indiablooms.com,https://www.indiablooms.com/news-details/N/94435/nirmala-sitharaman-claims-tamil-nadu-govt-has-bannned-live-telecast-of-ayodhya-ram-mandir-programmes.html,"The finance minister also alleged that the state police were stopping private temples from organising events commemorating the consecration ceremony of the temple in Ayodhya.
""TamilNadu government has banned watching live telecasts of #AyodhaRamMandir programmes on January 22. In Tamil Nadu, there are over 200 Shri Ram temples. In HR&CE-managed temples, no puja/bhajan/prasadam/annadanam in the name of Shri Ram is allowed. Police are stopping privately held temples from organising events,"" she said on a social media post on X.
She further added, ""They are threatening organisers that they will rip off pandals. Strongly condemn this anti-Hindu, hateful action"".
""TN govt is unofficially claiming law and order issues to justify the live telecast ban. False and fake narrative! There were no L&O issues on the day of the #Ayodhya verdict. Not even the day when PM @narendramodi laid the foundation, in any part of the country.""
""The groundswell and the voluntary participation of people to celebrate #ShriRam in TN has rattled the anti-Hindu #DMK "" she further added.
Hitting back at the politician, the Tamil Nadu government said the BJP is propagating erroneous information to divert people's attention from the DMK Youth Conference in Salem.
HR & CE Minister P K Sekarbabu said it was unfortunate that a person like Nirmala Sitharaman, who holds “high position” was indulging in spreading news that is “blatantly false and fake.”
(With UNI inputs)"
